serial_no;title;status;fund_perc;category;place;last_updated;company;websites;project_link;description
162;Lightweight, Compact, High-Lumen Beam Keychain Light;13;left;Gadgets;Wan Tsai, Hong Kong;;LifeGoc;[];https://www.kickstarter.com/projects/1683265947/lifegoc-keyes-super-light-compact-high-lumen-beam;"""Conquer the Dark with Unmatched Clarity - Experience 800 Lumens, 130m Beam, Weighs Just 30g"""
163;Reflection Frame: Digital Photo Prints;13;left;Gadgets;Menlo Park, CA;;Creative Design Worx;[];https://www.kickstarter.com/projects/creativedesignworx/reflection-frame-digital-photo-prints;Experience photos with Reflection Frame: Enjoy your cherished photos whenever and wherever you want
164;IVYCable P6- Fast-Charging Magnetic Cable & Power Bank;33;left;Gadgets;Wilmington, DE;;Matt Chang;[];https://www.kickstarter.com/projects/azurbit/ivycable-p6-fast-charging-magnetic-cable-and-power-bank;PD 60W Fast Charging | Pass-Through-Charging Power Bank| One Cable Charges All Your Devices | Self-Folding Magnetic Cable
165;Mini Magnetic Bluetooth Speaker with Wireless Charger Stand;28;left;Gadgets;Hong Kong, Hong Kong;;INNOGO;[];https://www.kickstarter.com/projects/innogocorp/powerbeat-magnetic-bluetooth-speaker;📢Mini Bluetooth Speaker⚡15W Wireless Charger for Smartphone, iWatch & Airpods 🤳Magnetic Phone Stand 🎶TWS Mode💡Vibrant RGB Light
166;Engineered for the Future: Fastenings with a Twist;13;left;3D Printing;Perth, AU;;SHP;['https://www.stlhardwareparts.com/'];https://www.kickstarter.com/projects/stlhardwareparts/engineered-for-the-future-fastenings-with-a-twist-0;Change the way you build with SHP's range of nuts,bolts & washers. Designed to be 3D printed, they fit traditional parts and each other
