serial_no;title;status;fund_perc;category;place;last_updated;company;websites;project_link;description
332;Humankinds;Launching;none;Apps;Tours, France;;Baptiste & Marie;['https://humankinds.io/'];https://www.kickstarter.com/projects/1008397698/humankindsio;The ethical and private social network, already online !
333;Inseye: eye tracking extension for enhanced graphics in VR;Launching;none;Hardware;San Francisco, CA;;Piotr Krukowski;['https://inseye.com/', 'https://www.linkedin.com/company/inseye-inc/mycompany/', 'https://www.youtube.com/channel/UC6v3YKNONMPEADF1k_1Q_rg', 'https://prelaunch.com/projects/inseye-enter-into-a-new-realm-inseye-enter-into-a-new-realm'];https://www.kickstarter.com/projects/inseye/inseye-eye-tracking-extension-for-enhanced-graphics-in-vr;Eye tracking extension for enhanced graphics in VR games and life-like feeling in VRChat
334;Baoling Bureau Rebirth Elves Toy Series;Launching;none;Gadgets;New York, NY;;BAOLIGAME;[];https://www.kickstarter.com/projects/1902198738/baoling-bureau-rebirth-elves-toy-series;A stunningly original exploration and collection game with a doomsday setting that rebirth Elves
335;AirPoint® Mouse: Wearable Wireless Ring & Desktop mouse;Launching;none;Hardware;Los Angeles, CA;;Magnima;['https://magnima.com/'];https://www.kickstarter.com/projects/magnima/airpoint-mouse-wearable-wireless-ring-and-desktop-mouse;AirPoint® is a dual mode air and surface mouse. Ideal for home office and presentations, the wearable Ring elevates mouse experience.
336;Travel Health Companion;Launching;none;Apps;London, UK;;Melanie Villarreal;['https://www.travelhealth-companion.com/'];https://www.kickstarter.com/projects/travel-companion/travel-health-companion;A digital platform that supports the well-being of international aid workers.
337;D911 Disaster Response Mobile App;Launching;none;Apps;Kennesaw, GA;;Daniel Francis;[];https://www.kickstarter.com/projects/d911/d911-disaster-response-mobile-app;Connect - Communicate - Conquer The D911 Mobile App allows disaster survivors to connect with local citizen responders.
338;Raya Bag;Launching;none;Gadgets;Austin, TX;;Katie;[];https://www.kickstarter.com/projects/katieananina/raya-bag;A fanny pack with handles for hands-free stroller walks
339;The Monster Detector;Launching;none;Gadgets;Charleston, SC;;Jason Houston;['https://themonsterdetector.com/', 'https://stingtings.com/', 'https://completewebcharleston.com/'];https://www.kickstarter.com/projects/jason-houston/the-monster-detector;Giving kids around the world confidence to sleep at night with the only device to detect and scare monsters of all sizes.
340;TandemPad game controller;Launching;none;Hardware;Krakow, Poland;;Kris;['http://tandempad.eu/'];https://www.kickstarter.com/projects/tandempad/tandempad-game-controller;Modular and transformable controller, designed to fill the gap between a gamepad and a mouse & keyboard
341;JamNexus.Studio;Launching;none;Apps;Grantsville, UT;;David Green;['http://www.dagreen4029.com/', 'https://www.jamnexus.studio/', 'http://www.lighttekdevelopment.tech/'];https://www.kickstarter.com/projects/dagreen4229/jamnexusstudio;Meet other musicians, form a new band, perform live on an augmented reality stage, and transform your world through digital eyes!
342;Faith Family;Launching;none;Apps;Oslo, Norway;;Faith Family;[];https://www.kickstarter.com/projects/faithfamily/faith-family;The community app that makes it easier to connect with other christians all over the world.
343;TV of the Future;Launching;none;Gadgets;Yonkers, NY;;DOREEN TECH;['https://www.doreenhub.com/'];https://www.kickstarter.com/projects/doreentech/tv-of-the-future;"Bringing the theater home,120"" Ambient Light Rejecting (ALR) concealed screen, An unique cabinet explicitly designed for UST projectors"
344;Build a Twitter Clone Using Blockchain - Web3 Video Course;Launching;none;Apps;South Florida, FL;;Bader Y;[];https://www.kickstarter.com/projects/badery/build-a-web3-twitter-clone-in-under-a-week-howtoweb3;Build a Twitter clone and become fullstack web3 application developer for the future of the internet.
345;AIMURUI—Eco-friendly Pet Toy & Snack Dispenser With Music;Launching;none;Gadgets;Hong Kong, Hong Kong;;AIMURUI;[];https://www.kickstarter.com/projects/1075013742/aimuruieco-friendly-pet-toy-andsnack-dispenser-with-music;The best toy that fills pets’life, to keep your pet active throughout the day.
346;YouConnect: the new way of exploring arts;Launching;none;Web;Venice, Italy;;Luca Carraro;[];https://www.kickstarter.com/projects/youconnectweb3/youconnect-the-new-way-of-exploring-arts;Bring entertainment - and beyond - available to anyone from everywhere
347;Bringing Dating Back;Launching;none;Apps;Los Angeles, CA;;Qeysh;['http://www.qeysh.com/'];https://www.kickstarter.com/projects/qeysh/bringing-dating-back;Click, Schedule, Date. Dating Made Simple. Verified Users. No Catfishing, No Ghosting
348;Holy Mountain Magickal Makerspace;Launching;none;Makerspaces;Longmont, CO;;Brother Moses Shenassa;['https://holymountain.co/', 'https://hoodoomoses.com/', 'https://instagram.com/hoodoomoses'];https://www.kickstarter.com/projects/hoodoomoses/holy-mountain-magickal-makerspace;My favorite makers, mystics and magickal folks coming together to create an IRL community space for the magickal + spiritual arts
349;Termafilm: Efficient and ecological heating system;Launching;none;Gadgets;Madrid, Spain;;Francisco Badea;[];https://www.kickstarter.com/projects/fbadea/termafilm-efficient-and-ecological-heating-system;Termafilm is a newly developed, energy efficient and ecological heating system, that will increase you comfort while saving money.
350;Slide Soket: An innovative surge protector like never before;Launching;none;Hardware;Canton, GA;;Will Owens;['https://slidingsoket.com/'];https://www.kickstarter.com/projects/slidesoket/slide-soket-an-innovative-surge-protector-like-never-before;Slide Soket is an adjustable surge protector designed to fit all of your devices guaranteed!
351;Cherry Hill Platform.com, A Free Health Support Community;Launching;none;Web;Jacksonville, NC;;Joshua William Walton;['https://www.cherryhillplatform.com/'];https://www.kickstarter.com/projects/cherryhillhealth/cherry-hill-platformcom-a-free-health-support-community;Where users can get advice in mental health and physical wellness, from people who fight the same conditions, right in their own area.
352;Circlone: The All-Verified, All-Ages Social Media;Launching;none;Software;London, UK;;Circlone;[];https://www.kickstarter.com/projects/rupertlowe/circlone-the-all-verified-all-ages-social-media;The modern & safe, age-friendly, server-based community building platform, designed around inclusivity and a verified-only user base.
353;FTS pro - Football Training System 1.0;Launching;none;Hardware;Szczecin, Poland;;PAKO-TECH;['https://www.pako-tech.pl/'];https://www.kickstarter.com/projects/tfspro/fts-pro-football-training-system-10;Training system to develop players' skills, tactics training  and fun for everyone.
354;Customizo;Launching;none;Apps;Pasadena, CA;;Norman Yuan;[];https://www.kickstarter.com/projects/464355618/customizo;An app that lets users order customized items like phone cases, t-shirts, mugs...
355;Vender Social;Launching;none;Apps;Belleville, Canada;;Doug Black;['https://www.vendersocial.com/'];https://www.kickstarter.com/projects/vender/vender-social;The Location-Based Social Media Platform and Digital Marketing solution.
356;Water Project;Launching;none;Hardware;San Diego, CA;;Water Project;[];https://www.kickstarter.com/projects/youbchat/youbchat;Bring water to anyone anywhere
357;Ergonomic Gaming Laptop Prototype;Launching;none;Technology;Long Beach, CA;;Anthony Montuya;['https://ergotauri.com/'];https://www.kickstarter.com/projects/erotauri/ergonomic-gaming-laptop-prototype;I want to create a prototype for a one-of-a-kind ergonomic gaming laptop!
358;FUELWELL. More MPG with less fuel;Launching;none;Gadgets;Wilmington, DE;;Serhii;['https://fuel-well.com/', 'https://ua.linkedin.com/company/fuelwellDelete', 'https://www.facebook.com/fuelwell.com.ua'];https://www.kickstarter.com/projects/fuelwell-/fuelwell-more-mpg-with-less-fuel;Plug-in device that reduces fuel consumption by 10% and reduces emission of your car
359;ADEVI - Secure Low-Code App Development Platform;Launching;none;Software;Melbourne, AU;;Marat Basyrov;['https://www.linkedin.com/in/maratbasyrov/', 'https://about.me/maratbasyrov', 'https://www.adevi.io/'];https://www.kickstarter.com/projects/maratbasyrov/adevi-web-and-mobile-app-development-platform;Custom App Development Platform. Robust Security Features. Real-Time Collaboration. Designed for Teams!
360;Smart touchless automatic sanitizer/soap dispenser;Launching;none;Hardware;Montreal, Canada;;James Laine;['https://unitecprotection.com/'];https://www.kickstarter.com/projects/jameslaine/smart-touchless-automatic-sanitizer-soap-dispenser;Efficient management of your dispenser(s) by delivering continuous sanitizer/soap through real-time automation.
361;JOURRIES - Beautiful Smart Jewelry That Stores Memories;Launching;none;Wearables;Dusseldorf, Germany;;JOURRIES;['https://jourries.com/', 'https://jourries-jewelry.com/'];https://www.kickstarter.com/projects/jourries-jewelry/jourries-beautiful-smart-jewelry-that-stores-your-memories;The high quality necklace that is compatible with your phone and becomes more valuable over time by adding your personal story.
362;New Age Vikings;Launching;none;Apps;Oslo, Norway;;Christian Hagen;[];https://www.kickstarter.com/projects/647752067/new-age-vikings;The community app for viking and norse fans
363;PT job! Work without barriers - an application!;Launching;none;Apps;Poznan, Poland;;Tatiana Mackowiak;['https://www.bluebaobab.pl/'];https://www.kickstarter.com/projects/ptjob/pt-job-work-without-barriers-an-application;Part time (and full time) jobs for refugees, socially excluded, students, teens, for work & travel and more...
364;Protector OX;Launching;none;Gadgets;Puebla, Mexico;;Luis Vargas;[];https://www.kickstarter.com/projects/protector-0x/protector-ox;This project will be the definitive solution to combat tire theft.
365;Music Jotter: Compose Music Online;Launching;none;Software;Cedar Grove, NJ;;Mike;['https://www.musicjotter.com/', 'https://www.youngcomposers.com/'];https://www.kickstarter.com/projects/musicjotter/music-jotter-compose-an-orchestra-or-write-a-song-online;Compose in your browser at the pro level. Green highlights play your music back. Export to video for YouTube!
366;Chomp-Champ: The Champion of Oral Sensory Input;Launching;none;Gadgets;Hiram, OH;;Natalie Evers;['https://chompchamp.my.canva.site/'];https://www.kickstarter.com/projects/chompchampchewy/chomp-champ-a-chewy-for-passionate-oral-sensory-seekers;A safe, durable, vibrating oral sensory chewy that offers inductive charging and inaccessible internal components
367;Balnz, Teens get rewarded while not using their smartphone;Launching;none;Apps;Brussels, Belgium;;Sebastien Haas;['https://en.balnz.io/', 'https://en.balnz.io/parents'];https://www.kickstarter.com/projects/balnz/balnz-teens-get-rewarded-while-not-using-their-smartphone;A solution dedicated to Teens with the support of Parents to help reduce screen time on smartphone through Reward mechanisms 🎁
368;Verba: Limitless Listening;Launching;none;Apps;Michigan Oaks, MI;;Verba;[];https://www.kickstarter.com/projects/verba/verba-limitless-listening;An audiobook subscription platform providing listeners with unlimited access to a diverse library of independent & exclusive content.
369;Proteckthor. A patented headband to do sport.;Launching;none;Gadgets;Madrid, Spain;;Carlos Pelayo;['https://www.proteckthor.com/'];https://www.kickstarter.com/projects/carlospelayo/proteckthor-a-patented-headband-to-do-sport;A patented headband that helps during the practice of various sports.
370;Social Network LaVecindad.CLUB: Amistad Mexicana en Línea;Launching;none;Web;Tijuana, Mexico;;TechAmigos Adventure;['https://lavecindad.club/'];https://www.kickstarter.com/projects/techamigosadventure/social-network-lavecindadclub-amistad-mexicana-en-linea;Red Social Mexicana: ¡Apóyanos en la Construcción de Nuestro propio Social Network para México y Hispanohablantes
371;Spectacle.;Launching;none;Apps;Venice, CA;;Spectacle LLC;['https://www.spectacle.ooo/'];https://www.kickstarter.com/projects/spectacle/spectacle;This is not just another social platform. Spectacle is here to change the status quo and make the world a better, more informed, place.
372;Ocean Pi: Participate Remotely in Oceanographic Research;Launching;none;DIY Electronics;Detroit, MI;;The Planet School;['https://planetschool.org/'];https://www.kickstarter.com/projects/planetschool/educational-kits-for-sailing-around-the-world;Help fund the maiden voyage of our interactive climate research journey from the Great Lakes to Florida.
373;EOD;Launching;none;Web;Naples, Italy;;Gennaro Illiano;['https://www.earthoceandata.com/'];https://www.kickstarter.com/projects/eod/eod;Earth Ocean Data
