title,company,websites,description
Apple WWDC 2024 Pin Set,Straton Roberts,https://glitchbits.com/,An enamel pin set commemorating Apple's WWDC 2024 conference and iconic hardware. Unofficial gear by a passionate UX designer.
Connect Pro: World's 1st 100W Magnetic Cable With LED screen,asap Technologies,"https://www.chargeasap.com/, http://www.youtube.com/c/asapTechnologies, https://www.instagram.com/chargeasap/","Powerful cable for devices: Supports 100W PD Charge | 27W Apple Fast Charge | Charge USB-C, Apple & Micro USB devices with one cable"
TRMNL: The e-ink display for your favorite apps and news,TRMNL,https://usetrmnl.com/,"7.5"" Display Screen | Wall Mountable | No Subscriptions | No App Required | Minimalist Design | Easy WiFi Setup | Automatic OTA Updates"
"Sola Came: Stylish, Secure, Eco-Friendly Home Surveillance",NSK_Japan,https://n-sk.jp/corporate-profile,"SolaCame: Elegance meets security. Guard your family and garden with our stylish, solar-powered camera, while championing the Earth's"
Homing Pigeon: The Disc Golf Disc Finder,David Greenberg,https://www.homingpigeondiscgolf.com/,A disc in the hand is worth two in the bush!
TR10K: Innovative 3 in 1 Charger Built in Retractable Cable,YKZ,https://ykzofficial.com/,Lipstick Size |PD3.0 |30W Input & Output Cable and USB-C Port |Foldable Wall Charger |10000mAh Power Bank |LED Display |IDC Technology
asStylish Twins Carry | Ultimate Solution for 2 Phones Users,Ricky Lui,https://www.asstylish.com/,"Are you tired of fumbling with multiple cellphones, struggling to keep them organised and accessible throughout your day?"
AV Panel: Acoustic Foam LED Panels,Avarupt,https://www.avarupt.com/,"Illuminate sound, eliminate echos. Wi-Fi controlled lights that seamlessly merge sound and visuals."
Achieve Healthy Sleep with Echofram's 12 White Noise Sounds,Echofram,"https://echofram.com/, https://www.facebook.com/profile.php?id=61559434988557","Sleep soundly, wake gently, and enjoy 8 more features with Echofram."
Tiki Tag: The Ultimate Multifunction Tag,Tiki Smart Inc,https://www.tikismart.com/,The 4-in-1 Tag | Opening Detection | Movement Detection | Temperature Sensor | Activity Supervision | Easy to Use
XTape1: A Modular Digital Laser Tape for Creativity,mileseey.ks,https://www.mileseeytools.com/,A pro-grade modular digital laser tape designed to enable the highest-quality creative projects with unique creativity-driven features.
The World's Best Transparent Projection Screen for Consumers,NanoAR,https://nanoar.store/,Transforming Glass into a Display / Up to 8K Support / Over 90% Transparency / AR&Glasses-free 3D Effect / Available in Three Sizes
Paladin Pro | The Hidden Camera Detector for Home or Travel,Safender,https://safender.com/,Find Hidden Cameras - GPS Trackers - Other Hidden Devices - ZERO Tech Experience Required!
2-in-1 Compact Hybrid Power Screwdriver: H500+,Magpie Tech,"https://www.instagram.com/magpietech_us/, https://www.magpiefunding.com/, https://magpietech.us/, https://www.youtube.com/@MagpieTech_official/featured",Compact yet Powerful | Adjustable Multi Torque Power| Switchable Auto&Manual | Maximized Efficiency in Various Environments
Cowzry MagBox:Expand Your Storage Space,COWZRY,"https://www.facebook.com/profile.php?id=100091825238692, https://www.facebook.com/groups/943361597804490",Magnetic Attachment Design丨Storage Space Expansion丨Suitable for iPhone Photography丨10Gbps Transfer Speed丨Mini Size丨Wide Compatibility
Haptique RS90: A True universal remote controller,Cantata,https://www.cantatacs.com/,Designed to Simplify Your Smart Home Control with a Single Remote.
NEO: World's Smallest Foldable Charger,UZE,https://www.uze.tech/,"One charger for your Apple devices. Travel light, stay organized, and charge in style. Simple, smart, and clutter-free."
Santek EZ Sign 4.2 inch E-paper Display,Santek,https://www.santechnology.com/,Displaying text and images of your choice
Snuuzu: Tesla-tailored mattress for Model Y and Model 3,Snuuzu,https://www.snuuzu.com/,"A comfortable double bed, tailored for the Tesla Model Y and Model 3. Folds into a duffel bag that fits in the sub-trunk."
NEOB ：Portable 20Psi or 150Psi Versatile Kite&Sup&Tires Pump,NEO-B,https://www.neo-b.shop/,"2 Mode - 20Psi & 150Psi | 110,000rpm Motor | 550L/min | 5000mah | Portable Size - 880g | Supports Multiple Kites & wings & Sup & Tires"
"MutiFlex: 13-in-1 Flashlight, Your Ultimate EDC Companion",MutiFlex,"https://mutiflex.com/, https://www.facebook.com/profile.php?id=61555335875623",Power bank|Arc lighter|Plastic bottle cutter|Saw blade|Folding knife|Window breaker|Can&Bottle opener|6 Screwdrivers|Wire cutter|Wrench
LingoBook & LingoYak: The Language Learning Revolution,LingoYak,"https://www.lingoyak.com/, https://blog.lingoyak.com/",The Future of Language Learning is Here | Driven by AI & Machine Learning | Learn 10x Faster
Qudi Mask 2: Animate Your Expressions,Qudi,"https://qudi.tech/, https://www.instagram.com/qudi.mask/, https://www.youtube.com/@qudimask","Emotional LED mask that opens mouth to your speech, reacts to head movements, and fully customizable to match your look."
GC6 - The first carbon fibre smart mini cordless rotary pen,Arrowmax,"https://www.am-arrowmax.com/, https://am-smart.com/","Ultra-lightweight, Smart gesture speed control, High torque, Bluetooth, APP Control, OLED, Wireless charger, Carbon fibre body"
LightBoks: Perhaps the Smartest Projector on Earth 🌏,Openhagen,https://www.openhagen.com/,And the world's only wooden projector 🌳
World's First 8-in-1 Full-featured Magnetic USB-C Cable,xCool,https://www.xcool.com/,4 Interchangeable Ends | Magnetic Design | 240W Fast Charging | 20Gbps Data Transfer | 4K@60Hz Display
World's First Spliceable 2-in-1 Charging&Data Storage Cable,AOHi,https://www.iaohi.com/,2-in-1 Storage & Charging | PD 3.1 240W | 512GB | 1000MB/s | Custom Length | Portable
GLAZER Press: A Greater Way to Sculpt your Crystal ICE,ORI Future,"https://orifuture.com/products/glazer-press-reshape-ice-reshape-moments, https://www.facebook.com/groups/1423133018278810",The next generation of ICE PRESS for Crystal-Clear Creations
Fusion Keyboard 2.0: 4-in-1 Keyboard with Invisible Touchpad,Mokibo,https://mokibo.com/,Revolutionary Touchpad on Keys | Built-In Kickstand & Case | Pair Up to 3 Devices | Multi-OS Support | Portable |by Mokibo
Speekeys - Your EDC Data Hub and Storage Powerhouse,Webble,"https://www.facebook.com/profile.php?id=61555616548880, https://speekeys.com/",10 Gbps | Up to 2 TB | Compact and Lightweight | M.2 NVMe SSD | Up to 1000 MB/s | Silicone case | Tool-free assembly
BoT Talk: AI-Powered GPS Communicator for Kids,BoT US INC,https://www.bsize.com/en/bot/talk,High-Precision GPS | 2-Way Voice Messaging | AI Monitoring | Unusual Event Alerts | One-Button Design | Waterproof & Shockproof
"Brevoy Portable Espresso Maker, Brew Espresso Everywhere.",Brevoy,https://brevoy.com/,"Boil, Brew, Taste 3-in-1 | Ground Coffee and Capsule | Rich Crema | Supports Double Espresso | One Charge 300 Cups | Portable Design"
ELF Cable: 3-in-1 Portable Charging Cable,STYLEPIE ELF Cable,https://stylepie.com/,Multi-Functional Use | Bright LED Lighting | Precision Heating Element | 240W High Power Output | Durable Construction
Shargeek 140: Unrivaled Portable Charging Accessible to All.,Sharge Tech,"https://shargeek.com/, https://sharge.com/","20,000mAh/72Wh | Max 140W Output | 2-device Fast Charging | Premium & Portable | Robust Batteries"
ASDOM Flexible & Cozy Outdoor Heated Jacket for Any Scenario,ASDOM,https://www.asdomlife.net/,"Vest & Jacket | Composite Carbon Nanotube Heating Film | Breathable, Windproof, Waterproof | Ultra-lightweight at 610g | Machine Wash"
Vobot Mini Dock: Docking Station w/ Screen & Built-in Apps,Vobot,https://getvobot.com/mini-dock,Smart Display | 7-in-1 Hub | Pomodoro Timer | Todoist | Weather | CC/Stock Price | App Store | Custom App Dev | Improve Work Efficiency
Beyond Limits: Introducing The Next Generation Super Cable,Horizon,"https://haloband.com/, https://www.facebook.com/halobandproducts, https://youtube.com/c/HALOBAND","Up to 120Gbps, 240W, Multiple 8K, Ballistic Fiber, Lifetime Warranty, The World’s First"
FacePlunge - Ice Water Rejuvenation,LastObject,https://www.lastobject.com/,Dip into Serenity: Effortless Cold Immersion for a Clear Mind and Vibrant Health.
BQEYZ® CLOUD-Exclusive Air-assisted Vibration Earphone,BQEYZ®,https://cloud-earphone.shop/,Aluminum alloy shell | Air-assisted Vibration tech | Ergonomics |30g Ultra-Lightweight |LCP Diaphragm
AirSpot - The Personal & Wearable Fresh Air Monitor,Robert Hackett,"https://airspothealth.com/, https://theatrecaps.com/, https://www.psnetwork.org/",Fresh Air improves concentration and wellbeing. AirSpot makes it simple to optimise your air health.
Feramica - Gadget to Nourish Mental Health,Sandi W,https://intro.feramica.com/intro,Feramica serves gradual and consistent mental nourishment to improve mental health and overall wellness.
WWDC24 | The unofficial community enamel pins,Clément Sauvage,"https://twitter.com/clementsauvage, https://clementsauvage.me/","WWDC 2024 is coming. Let's with enamel pins, carefully made by developers in love with design and Apple technologies !"
Scope Pro : The Lightest Dual / Triple 14'' 2K Monitor,ScopePro,https://kickstarter.scopepro.store/,"Five modes, Type-C, 350° rotation, compatible with any laptop including Mac / PC / Switch, 1.1 pounds 4.8mm thin, 100% sRGB, 2k"
"Guardian Alarm: Live your life freely, no fear for theft",eesens inc,https://www.facebook.com/Eesens-109816187650699,"110dB motion sensitive alarm, long-range wireless theft alert, sound localization, secure attachment to your bike and valuables"
"EASYPLAY 1s:Portable, Easy-to-Start Music Keyboard with MIDI",SummerTones,"https://summertones.fun/, https://www.youtube.com/@SummerTones.EASYPLAY1s, https://www.facebook.com/groups/1072322430620976",25+ Sound Pack | MIDI supported | Bluetooth Speaker | 25-key 3X5 Keyboard Layout | C3-C8 Octave|8-Hour Playtime|Interchangeable Keycaps
MOKiN All In One Station | 100W GaN Charger & USB-C Hub,MOKiN Global,https://mokinglobal.com/,3 Fast Charging Port | PD100W Power Delivery | 4K@60Hz HDMI | Up to 10Gbps Data Transfer | RJ45 Ethernet
AirGo Ⅱ: Evolved All-in-One Mini Bike Pump for Cycling Fans,AirGo,https://airgoii.shop/,135g | Clear Display | Up to 100 psi | Presta & Schrader & English Valve | QC3.0 Fast Charging | 30 min Full Charge | 4 Preset Modes
Creator Cable: One Cable to Rule Them All,How to Creative,"https://howtocreative.com/, https://youtube.com/felixkruip",All-in-one USB-C cable powered by USB4 | 100W Charging | 40Gbps Transfer | 8K60 Video
"Lyridz Tangram Light Panels | Several Panels, Impressive Fun",LYRIDZ,https://lyridz.com/,Infinitely Possible Patterns | Limitless DIY Lighting Effects | Sync with Music Mode | Smart Dimming Mode | Smart Voice & APP Control
Aquaro Smart Water Monitor - Get Leak Alerts,Aquaro,https://myaquaro.com/,An easy-to-install water monitor that measures your water flow and notifies you in a user-friendly app.
The Power Mole - Wireless Power Transfer Through Windows!,Acqua Industries,https://www.acquaindustries.com/,"Power your outdoor devices with an indoor outlet - deliver 10 Watts through up to 30mm of glass, wood, or anything non-metallic!"
AnkerWork S600: The Ultimate Companion for Your Smartphone,Smart Audio,"https://us.ankerwork.com/, https://de.ankerwork.com/, https://ca.ankerwork.com/, https://uk.ankerwork.com/",Qi2 Wireless Charging｜AI-Powered Voice Filtering for Calls｜16H Built-In Battery | 360° Sound for Music | 70° Phone Stand
AutoPro X: Transform your Navigation screen into a Laptop,Mayton Motion,https://maytoncorp.com/,World's first laptop software for navigation system
Quokka: Your Personal Quantum Computer,Chris Ferrie,http://csferrie.com/,"Quokka is your personal 30-qubit quantum computer emulator, used to learn and experiment with quantum coding."
Revolutionize Your Oral Care: Smart Toothbrush Machine,CONLICARE,http://conlicare.com/col.jsp?id=106,CONLICARE 2.0: One-button switch，Automatic discharge of toothpaste，Sewage recovery box，Suitable for all age groups
heat it™ pro: Smartphone-Powered Insect Bite Relief,heat it,"https://heatit.de/, https://heat-it.com/",Treat itchy insect bites through concentrated heat. Just heat it with your smartphone!
Tactical Hair Clip: Tacticlip 2.0 Iridescent EDC Covert Tool,TactiCouture,"https://chevassus.com/, https://knok.org/, https://kalosagon.com/, https://tacticlip.org/, http://tacticouture.com/",Minimalist multi-tool for action lifestyles. Upgraded SUS301 Stainless Steel. Nail File. Raptor Claw Tip. Over 12000 version 1.0 sold.
SyncPen 4 - NEWYES 4th Generation Reusable Smartpen Set,NEWYES,https://www.newyes.com/,Intelligent and Precise Writing System| Innovative Erasable Smart Pen Set | 72 Languages Handwriting Transcription
Puzvox Fidget Toy: 6-in-1 Eternal Flower EDC Spinning Top,Puzvox,https://www.puzvox.com/spinningtop,"Revolutionizing gyro designs, merging aesthetics with amusement."
Mini MMA Welder with More Efficient Digital Control System,ARCCAPTAIN,"https://www.arccaptain.com/, https://www.arccaptain.net/","ARCCAPTAIN Welder Enables Welding Work Anytime, Anywhere|MCU Intelligent Control|IGBT Inverter Technology|DIY & Hobby Enthusiasts"
AMKOV R4: A Multimedia Camera with Simplified Operation,AMKOV,"http://www.amkov.com/, https://r4.amkovcamera.com/, https://www.amkovcamera.com/","Video,Image and Music All in One|3”IPS Touchscreen|1500 mAh Battery Capacity|4K UHD Video|64MP High Resolution|Auto Focus"
Snail Sleep Anti-snore Pillow-Breakthrough Breath Monitoring,Snail Smart Work,https://www.seblong.com/,Breathe Monitoring / Wake-up Function / Sleep Report / Automatic Height Adjustment / Privacy Protection
Kwumsy N1 Three-Proof & Multi-Function Screen Extender,Kwumsy,https://kwumsy.com/,Three-proof protection| Ten-point touch| Digital photo frame| Mobile power supply
Innovative Nano-Steam Hair Straightener for Better Hair Care,HOMETOP,https://www.hometophair.com/,"HOMETOP Hair Straightener is wireless and portable, providing a finer mist for nourishing hair."
UNG : World’s First Self-Powered Purifying Shower Head,UNG,https://www.ung-global.com/,Self-Powered | Cleaner & Smoother Water | No Filter Needed | Water-Saving | Healthy Hair & Scalp | Glowing Skin | Easy Installation
NITECORE MT1C Pro Compact EDC Flashlight,Sysmax,"https://www.youtube.com/channel/UC2ze76sbqabrEgs1q3WSMmQ, https://www.nitecore.com/, https://www.facebook.com/groups/1278398619305106","You can use the MT1C PRO with the type battery of 18350| CR123|RCR123(16340).| 1,000 Lumens|380m|1.05"" x 3.45""|1.23 oz| IP68| EDC|Tools"
ArcticBreeze: Ice-Free Portable Outdoor Cooling Solution,ArcticBreeze,https://www.arcticbreeze.life/,"Unmatched Portability, Ice-Free Chilling, Anywhere, Anytime."
SPLACH Zippy: Ultra-Intelligent Phone Mate for All Scenarios,SPLACH,https://splach.bike/,"Hands-free & hassle-free. This phone holder supports wireless charging, and adapts to various scenarios, simplifying your daily use!"
World First Smart Knobs Preventing Fires in Your Kitchen,Dishknob,https://dishknob.com/,The intelligent and automated timer for your gas cooktop—avoid the risk of forgetting to switch it off!
PROBE - Track lure swimming depth when fishing,Christer,https://www.probefishing.com/,"Track your lure's journey under water and find out swimming depth, water temperature, cast length directly on your smartphone."
Flashtape: Wireless Magnetic PD PowerBank,Casestudi,https://www.casestudi-shop.com/,Magnetic Wireless PowerBank | Retro Cassette Tape | Type-C 20W PD | 5000mAh | 10000mAh | Pocket-Sized | LED Screen | Fast Charging
The Servita - Raise Your Spirits,Aluminance,"https://servita.io/, https://aluminance.co/",Your personal beverage assistant. Turn any project into a statement with this fully customizable beverage server.
Flowtime® Brain Tag: Better Sleep & Daytime Performance,Entertech,https://www.meetflowtime.com/,Biofeedback Brain Trainer & Comfortable Sleep Tracker Powered by EEG/HRV/SpO2 Technology for Daily Use at Home
PhotoCube PD+: Smart On-The-Go Backup For Precious Memories,PhotoFast,https://ec.photofast.com/en/,Secure Auto Phone Backup On-the-Go | PD Fast Charge & Auto Backup | No Monthly Fees | Leak-Proof Security | Support Up To 2TB Micro-SD
Hush: An Intuitive Lamp that Breathes Away Anxiety,Hush,https://thehushlamp.com/,Illuminate your space with a lamp that is customizable to your needs.
Fitrus Plus 3.0 : Next Level of Fitness Tracking,ONESOFTDIGM,"http://start.thefitrus.com/, http://onesoftdigm.com/EN/, https://www.fitrusplus-kickstarter.com/","Your All-in-One Health Tracking Solution – Body Composition, Skin & Object Temperature, and Real-Time Insights at Your Fingertips!"
The M1: A Compact Multitool for Technophiles and Hackers,Monstatek,https://www.monstatek.com/,Elevate Your Tech Game
LightReady: Smart Light Strip Colors Changing with Screen,LightReady,https://lightready.shop/,Plug&Play HDMI Connectivity / For TV&PC&Game console / Seamless Synchronization / Versatile Compatibility / HDMI 2.0 / 20ms Low latency
A Small Coffee Maker: More Choices to DIY Your Perfect Brew,HiBREW,"https://ks.hibrewcoffe.com/, https://www.hibrew.com/",HiBREW H10B: Adjustable Temperature for Coffee &Steam | Pre-brew Adjustment | Adjustable Coffee Capacity | Digital Display
"NITECORE EBP10 MINI, Air Pump and Tire Gauge 2 in 1.",Theodore,"https://nitecore.com/, https://www.facebook.com/NitecoreCrowdfunding, https://www.instagram.com/nitecore_crowdfunding, https://www.youtube.com/channel/UC2ze76sbqabrEgs1q3WSMmQ",EBP10 MINI is NITECORE's first electronic bicycle pump|120PSI |8.2Bar| Display| Tire Gauge| Air Pump| Gadget | Ede | Mtm | Bike| Tools
Luxceo M8: Smallest Wireless Stereo Mic 2-in-1 Charging Case,Team LuxCEO,https://luxceoshop.com/,Compact / 20 Hrs Battery / Up to 100m / Plug & Play / 7 RGB Light / Noise Reduction / Magnetic / Wireless Charging Case / Monitoring
3d printed Nixie Tube Clock: experience the cosmic adventure,Vadim Antonov,"https://us.past-indicator.com/, https://twitter.com/past_indicator, https://www.reddit.com/u/PastIndicator/",This chilly winter Past Indicator presents cool cosmic clocks: limited make 100 series. Vintage Nixies in a modern design
An Innovative 2-in-1 Car Millimeter-Wave Radar with Integrat,NaviCam,"https://ks.spedal-store.com/, https://spedal-store.com/",Reversing 3D radar measurement｜Wireless Carplay/android Auto｜ADAS AI Collision Avoidance Technology｜4K/1080P Front & Rear Dashcam
Nukii: Your Unassailable Personal Data Protector,Maktar Inc.,"http://www.maktar.com/, http://www.piconizer.com/",Offline Data Storage | Anti-Virus Read-Only | Disconnect Auto-Lock | Patented NFC Unlock | Server-Grade Memory | Remote-Erase All Data
Clawmate: World's Pioneering 10-in-1 Smart Dog Trainer,Clawmate,https://www.clawmate.com/,"Two Training Modes, Multiple Leash Uses, Groom, White & UV Lights, IP68 Waterproof, Waste Bags & Water Bowl"
4URPC: Truly Plug-and-Play Wireless Transmitter and Receiver,4URPC,https://www.4urpc.com/,"HD Screen Mirroring丨Plug-and-Play丨Long-distance Transmission丨Wide Range of Applications丨Compatible with MAC OS, Windows, Android"
Mars Players Multi Function Tripod Outdoor Camping Light,Mars Players,https://www.mars-players.com/,Only 615g | Modular Design | Quick Release |Magnetic Tripod | Hidden Flame Source | Diffuse Tent Lighting
LeMat Fixer MINI - Modernize your Desk Mat | Make 100,VoRis,"https://lemat.io/, https://www.facebook.com/profile.php?id=61550909843465",CHARGING | NIGHTLIGHT | TOOLBAR | PERSONALIZATION. Clever desk organizer featuring a magnetic design compatible with any desk pad.
KnifeYouLike Multi-angle Knife Sharpener,KnifeYouLike,https://knifeyoulike.com/,"Intuitive, fast, versatile, looks good in any kitchen and truly high quality."
JUMPAC: Your 5-In-1 Ultimate Car Companion🚗,Jumpac,https://www.jumpac.com/,"Jump Starter, Portable Vacuum, LED Light, Power Bank, Inflator"
Thor's Hammer Inspired MjolnEVr Tesla Mobile Cable Mount,Moiré,https://www.onemoire.com/,Tired of the boring cable organizers for your Tesla? Elevate Your Tesla Experience with MjolnEvr Cable Mount! Made of Aluminum.
TAIM | MacBook cable management,Bair,"https://bairartifacts.com/, https://www.facebook.com/bairartifacts, https://www.tiktok.com/@bairartifacts, https://www.instagram.com/bairartifacts/, https://www.youtube.com/@BairArtifacts",Quickly and easily tame unruly Apple MacBook® charging cables while on the go.
DiGimbal- Elevate your Creative Selfie Game!,DiGimbal,https://www.digimbal.shop/,Suitable for Dual Phones/Tablets | 4500 mAh Battery | All Metal Base | 360° Shooting | Physical Anti-Shake
YASHICA Vision binocular night vision: Capture Night in 4K,YASHICA,https://www.yashica.com/,"YASHICA Vision is a binocular night vision device offering 4K image quality, full-color vision and up to 600m view range in darkness"
MakaGiC VS01 Intelligent Electric Vise for DIYer & Maker,MakaGiC,"https://www.makagic.com/, https://www.facebook.com/groups/makagicofficial/",Smart clamping | Adjustable intensity | Multiple modes | Expandable peripherals | Large capacity battery | All aluminum alloy body
"NeoX: Ultimate 3-in-1 Card-sized Tracker, Wallet and Stand",NeoX,https://www.neoxhub.com/,"The 1.8mm Credit Card-Sized Tracker with Apple Find My Sync, Wireless Rechargeable Battery, sleek glass and aluminum design, and More!"
mui Board Gen 2: Smart Home Hub for More Playful Moments,"mui Lab,Inc.","https://www.facebook.com/muilab, https://www.twitter.com/mui_labo, https://www.instagram.com/muilab, https://muilab.com/en/","Say hello to “mui Board Gen 2,” a smart home hub that turns your home into a body- and soul-nourishing family sanctuary."
DIVEROID | Perfect Solution for Snorkeling and Free-diving.,DIVEROID,https://diveroid.com/,Turn your smartphone into an underwater 4K camera and logbook.
Make/100 - Redkey V5 USB Data Wipe Kit,Gareth Owen,http://www.redkeyusb.com/,Kickstarter Special Mini Campaign With Less Than 100 Rewards! Limited Availability!
SPERAS U2T Ultimate Outdoor Flashlight with Wireless Control,SPERAS Flashlight,https://sperasflashlight.com/,5000lm / 340m / 6400mAh / USB C Fast Charging / Power Bank / Bike Light/ Wireless Control /Outdoor & Tactical
AyraTec Infinity Charger: Revolutionize your charging,AyraTec,https://www.ayratec.ch/,Pioneering: Simultaneous fast-charging. True compatibility. Laptop charging.
BT-20Wingman | Tactical power bank with detachable batteries,Kodai Industries,https://www.kodai-industries.com/,Dynamic capacity | Tactical reload design | Sustainable design | 20W Type-C output | Battery charger
SolarBeam by BloomWise,BloomWise,https://bloomwisedesign.com/,A charming handcrafted oak grow light that makes growing plants indoors simple and appealing.
MagDisk - MagSafe SSD | PowerBank | USB-C Hub,EON Electronics,https://www.eonelectronics.co/,"512GB | 1TB | 2TB | 4TB - Read and Write Speeds of up to 2,000MB/s. USB 3.2 Gen 2x2 + 2400mAh Power Bank"
CoolGeek VS-02: 3-in-1 Multifunctional Vertical CD Player,coolgeek,"https://vs-02.coolgeekdesign.com/, https://www.coolgeekdesign.com/","Awsome sound experience! Vintage vibes meet the cool blend of CD player, FM radio, and Bluetooth 5.0 speaker."
Mileseey D9 Pro:Your Ultimate Space Transformation Companion,mileseey.ks,https://www.mileseeytools.com/,World’s 1st laser measure with visual aligning |Innovative Measuring for Inaccessible Areas | Unmatched 18 measuring modes for any task
FemPot: More Stylish Functional Electric French Fries Cutter,Fempot,https://www.fempot.store/,Efficient Automatic Working & Low Maintenance | 20-Year Life | Retractable Food Drawer | Detachable Structure for Easy Cleaning
"Arma Scooter: Easy to carry, fits in your bag.","Arma by Shimizu (SMZ, inc.)",https://arma-ev.com/,"Forget about where to park  with the smallest and lightest Arma Scooter, focus on what truly matters in your day."
TrampleTek Blue: Unleash Smart Home Magic with Every Step,ASC (Applied Sensor Corp),https://asc.com/,Elevate Your Home Automation: TrampleTek Blue – Step into the Future of Smart Living with Our Textile Sensor Mat and Open Dev Kit
All New +Star Christmas Tree Topper and Accent Light,Stellar Kinetics,"https://www.stellarkinetics.com/, https://get.stellarkinetics.com/, https://www.facebook.com/people/Stellar-Kinetics/100089120553462/","An easy to use, fully customizable tree topper. With 16 million vibrant colors, dynamic animations, and more!"
The Universal Super Cable,Horizon,"https://haloband.com/, https://www.facebook.com/halobandproducts, https://youtube.com/c/HALOBAND","One Cable, Every Device｜20Gbps & 100W | iPhone 15 Series | Ballistic Fiber | Lifetime Warranty"
Somvai: Optimize Your Naps & Sleep to Be More Productive,Somvai,https://somvai.com/,Enhance Your Sleep | Radar Sensing | Sleep Cycle Optimization | Breathing Exercises | White Noise | Intelligent Power Naps
NITECORE EDC35：The Smaller And Powerful EDC Torch,Sysmax,"https://www.youtube.com/channel/UC2ze76sbqabrEgs1q3WSMmQ, https://www.nitecore.com/, https://www.facebook.com/groups/1278398619305106",The First High-Performance EDC Flashlight With NiteLab 9-core UHi 40 MAX LED |LUMIN SHIELD™|SEARCH|EDC|550M|Sensor Protection Function|
kaami. Lanco - Steam Lance Cleaner/Milchschaumdüsenreiniger,Lars Hoffmeister & Jannis Brünger,https://www.kaami.de/,The new way of steam lance cleaning: Where functionality meets sophisticated design. Coffee | Barista | Espresso | Portafilter
TiSpanner: a Compact Titanium Multitool always within reach,Titaner JP06,https://www.titaner.com/,"A CNC-machined Portable Titanium Multitool that combines a Bottle Opener, Tungsten Attack Head, Nail Puller, and Caliper."
MOTOR -ZERO:A new definition of a razor,MECH·ONE,https://mation.top/,Diamond Cut Craftsmanship|Portable|110g|EDC|Self-sharpening tips|Replaceable tips|LED Smart Display|IPX7 Waterproof|Transparent body
