title,company,websites,description
Pixy Mini Pro: World's Smallest & Lightest 30W 10k Powerbank,Futurizta Tech,https://www.futurizta.com/,"Smaller than your palm, charges your laptop | Built-in Type-C Cable | 30W PD | 10,000mAh | Dual Output | LED Touch Display"
"Pilet: Opensource, Modular, Portable Mini Computer",soulscircuit,https://soulscircuit.com/,"Where retro meets modern, powered by Raspberry Pi 5 with 7-hour battery life, Starting at $199"
Power Mole V2 - Power Outdoor Devices via Indoor Outlets!,Acqua Industries,https://www.acquaindustries.com/,"Capable of delivering 5V Power through windows up to 36mm (1.4 inches) thick! Smaller, longer range, and more power than V1!"
4URPC: True Wireless 4K Type-C Transmitter and HDMI Receiver,4URPC,https://www.4urpc.com/,"Video & Audio Transmit丨4K 30Hz, 1080P 60Hz丨Plug-and-Play丨Remote Transmit丨Built-in 5G-WiFi丨100W PD3.0丨Supports Windows & MacOS & Android"
ENMESI V50: Your Gateway to Immersive Vision,ENMESI TECH,https://www.enmesi.com/,210” AR Display | 75g Lightweight | 3000nits Ultra Bright | 0-6D Myopic Adjustment | ANC Audio Experience
The Mic Light,Brighter Devices,https://brighterdevices.co.uk/,A stylish PC peripheral device that lights up automatically when you're in an online meeting to prevent others interrupting you.
H6 Coffee Maker: Brew Coffee Just the Way You Like,HiBREW,"https://ks.hibrewcoffe.com/, https://www.hibrew.com/","Automatic Recognition of 4 Capsule Types | Adjustable Temperature, Pre-brew Time, and Coffee Volume | Hot & Cold Brew | 24-Hour Timer"
CARLUEX VISION: Wireless CarPlay Aapter with Screen,Carluex Team,"https://carluex.store/, https://carluex.com/, https://www.youtube.com/@CARLUEX, https://www.tiktok.com/@carluex_official","Screen Control | Wireless CarPlay & Android Auto | Watch Netflix, YouTube, Apple TV, etc | HDMI Output | Downloadable Apps"
SEEPPO: Your Lightweight Solution for Ultimate Back Support,SEEPPO TECH,https://www.shipengexo.com/,Lightweight Lumbar Exoskeleton | Max 300N Assistance | 0.95kg Ultra-Light Design | Adjustable for Comfort | Quick Release Mechanism
Protmex Neptune: Your Guardian for Outdoor Adventure,Protmex,https://www.protech-instruments.com/,"The All-In-One Outdoor Safety Companion that keeps you informed and safe with real-time data on CO2, CO, UV levels, and more!"
STIFF/ARM Remote Controlled Home & Hotel Security Device,Kenneth Finley,https://www.stiffarmdoorstop.com/,"STIFF/ARM provides resistance & early warning, activated inside or outside, easy to install & remove, leaving no holes or scratches."
LORZOR Wallet: World's 1st Trackable Minimalist Wallet,LORZOR,"https://www.facebook.com/Lorzorofficial/, https://www.instagram.com/lorzor_official/","An ultra-slim wallet with NFC, tracking, quick access, and seamless design. Lifetime warranty."
Looktech AI Glasses: The Smart Glasses That Truly Know You,Looktech,https://www.looktech.ai/,Personalized AI Assistance | Hands-Free Control | 13MP Camera | 2K Video | Immersive Audio | Privacy-First | 14-Hour Battery | Only 37g
DEFI AI Smart Pill Bottle | Don’t Ever Forget Your Meds,"donteverforgetit, Inc",https://donteverforgetit.com/,Upgrade your basic pill bottle to an AI-powered smart solution
"Reference Circuits, Volume 1 and 2",Ian,"https://www.boltind.com/, https://www.iandunnart.com/",Electronics books made from circuit boards with actual circuits on each page.
The Hard Bar - A Titanium Pry Sheath,Sanctum Brand,https://www.sanctumbrand.com/,"The Hard Bar is a compact titanium pry tool that houses a fixed-blade knife, the first of its kind."
SOULCUBE: Bring Your Beloved Pet Back to Life,AIDICOME Inc.,https://aidicome.com/kr/index.php,Interactive holographic device that brings the spirit of your beloved pet back to life
Kompo - Redefining Food Waste,Ben,https://get.kompo.online/,"Transform the way you dispose of food waste with Kompo. Quick, Sleek, Odor Free."
hand://poem Presenter Glove (remote control),Handpoem - Sound of Movement,https://handpoem.com/,Gesture-Controlled Presentations: * The Presenter Glove allows making presentations more engaging and fluid.
"KALOS K1 Pro:3-in-1 CarPlay, Android Auto & Gaming for Tesla",Zjinnova,https://www.zjinnova.com/,Wireless CarPlay | Android Auto | Mobile Phone Mirroring | Switch & Xbox Compatibility | OTA Upgrades | Tesla Screen Enhancement
Pixeldarts: The Retro-Inspired Electronic Throwing Game,Chessnut,https://chessnutech.com/,Engage in electronic live games | Advanced recognition tech | Retro pixel display | Endless expansion with programmable games/widgets
Chargie - Protect Your Laptop's Battery Health,Ovidiu Sandru,https://chargie.org/,"If you're the type who keeps laptops plugged in all the time, Chargie is for you. It will prolong battery life by many years."
Darwin MX Pro: All Microscopy Tasks on One Screen!,BEAVERLAB TECH,https://www.beaverlabtech.com/,"Smart Digital Microscope | 2200X Magnification | 2K Microscopic Details | 9"" IPS Screen | Dual-screen | Free App | RGB Optical Staining"
"Unifloss: 3-Sided Toothbrush, 3X Faster, 99% Cleaner Teeth",Unifloss,"https://www.facebook.com/profile.php?id=61564453780015, https://www.unifloss.com/","Triple Action Care - Toothbrush, Water Flosser, and Mouthwash in One."
"TC3 Tire Inflator-Faster Than Ever, Built to Inflate All",AstroAI,"https://www.astroai.com/, https://www.facebook.com/AstroAI",6 Smart Modes|Inflates Balls to Heavy-Duty Car Tires|30s Fast Inflation|4000mAh Detachable Battery|Power Bank|Super Bright Flashlight
SonarPen 2: The Most Affordable iPad Pen with Pro Features,GreenBulb,"http://www.greenbulb.com/, https://www.instagram.com/greenbulb_com/, http://www.sonarpen.com/, https://twitter.com/greenbulb_com, https://hackaday.io/project/26225-sonarpen-turning-an-earphone-into-a-smart-stylus","Tilt & pressure sensitivity, pointy nib, and pro features – all for the cost of 6 cups of coffee! Works with iPads (2017 & newer)."
Starship 240W: The Ultimate Reliable Power On The Go,AOHi,https://www.iaohi.com/,"240W Max Output | 27,600mAh | TSA-Approved | 3-device Fast Charging | 140W Max Input | Smart Display | Automotive Grade Battery"
PORTAL: Real-time coffee brew profiler.,Belka,https://belkacoffee.com/,"It provides a real-time log of the concentration(EC), temperature, etc. during brewing, and is used as a brew profiler for baristas."
BLEShark Nano: A Compact Wireless Multi-Tool for Hackers,InfiShark Tech,https://infishark.com/,"A portable device for testing Bluetooth and Wi-Fi vulnerabilities—including games, apps, auto updates, and a buttery-smooth interface."
GD10 Touchscreen Portable SSD – Your Data Security Guardian,MOVE SPEED,https://www.movespeed.com/,"1.83"" TouchScreen｜Encryption/Unlock｜Support Apple Find My｜Status monitoring｜10Gbps｜USB 3.2 Gen2｜1TB/2TB Portable SSD"
"The Supertiny - the smallest 65W GaN charger, ever.",Rolling Square,https://rollingsquare.com/,"It's 2024, and you are still carrying around heavy brick chargers, but why? We got you. US, UK and EU compatible."
SPERAS U3: Versatile EDC Flashlight for All Your Light Needs,SPERAS Flashlight,https://sperasflashlight.com/,Red Light | Green Laser | UV Light | Side Light | Bike Light | Magnetic | Quick Mode Switch & Stress Relief Slider | P68
Mstick4: Unlock Your Car Display's Full Potential,Mgears,https://www.m-gears.com/,"Go beyond CarPlay and Android Auto. Waze, Netflix, YouTube, Spotify, and more — Bring all your favorite apps to your car display!"
Wrap Rabbit: Simplifying Cable Chaos for Musicians and DJ's,Edmund Sugzdinis,"https://www.wraprabbit.com/, https://www.hotdammit.com/","Designed for Musicians and DJs, this tool ends cable chaos, so you spend less time untangling and more time focused on your sound."
Robostands RW1 Automatic Watch Winder,Robostands,https://robostands.com/,A head-turning watch winder that appeals to the kid and nerd at heart.
World's First Carbon Fiber Electric Drill Pen Benchtop Press,Arrowmax,"https://www.am-arrowmax.com/, https://am-smart.com/",Carbon fiber body /5-Speed /900RPM /OLED Display /Multi-purpose fixed bracket /CNC machining /20 HSS Bits /LED Lights /500mAh /Cordless
KalimbaGo Plus: Even More Joy at Your Fingertips,Evie Innotech,"https://kalimbago.com/, https://evieinnotech.com/","Play Kalimba Effortlessly Like Never Before—Even More Intuitive, with a Beautiful Sound for Meditation"
Scoutlite BlinkO: Ultimate Wearable Outdoor Safety Light,SCOUTLITE,https://scoutliteworld.com/,Multi-scenario | Wearable | Hands-free | Cut-out Design | One-click Magnetic Attachment | Dual Color | Compact & Versatile
Ravelights V2 | Lighting for Creative Expression,Michael Madi,"https://ravelights.ca/, https://x.com/Ravelights, https://t.me/lithardware",Wearable smart LEDs for parties & festivals. Transform any space with wall mounts. Sync to your environment and sync to your friends.
PARDUS 2-in-1 Hand Warming Solution,PARDUS,https://www.pardus-bikes.com/,"Magnetic Design | Pocket Size | 360° Heating | 3s Fast Warming | Single or Combined Use for Hand Warming Anytime, Anywhere."
Twelvetooo: A Mini 3D Projector With No Glasses Required!,Twelvetooo,https://www.twelvetooo.com/,"Explore 60+ themes, where vibrant 3D worlds are brought to life with immersive sound and light, creating unique and enchanting stories"
KUXIU—3-in-1 Wireless Charger Inspired by Basketball Hoop,kuxiu,https://www.kuxiu.cc/,"A fun desktop basketball toy for basketball fans |Simultaneously charge your iPhone, AirPods, and Apple Watch with Qi2 certification"
Portable Venty Clip Fan,Team Vento,https://www.ventyfan.com/,Clip It. Hang it. Mount it. Your scented rechargeable fan for work & sleep.
Outrider: A Tire Pressure Sensor For Bikes,Outrider,https://www.outride-bike.com/,"A low cost, Garmin-compatible device to keep you safe and optimize your tire performance on the trail"
"L-Ring 2: ChatGPT-Powered Ring for Control, Translate & More",Toall Tech,https://www.toall.com.cn/,ChatGPT-Powered | Gesture Control | Air Mouse | Real-time Translation | Voice to Text | AI Chat | Meeting Summary
Plugable: Turn One USB-C Charger Into Ten,Bernie Thompson,"http://plugable.com/, http://www.linkedin.com/in/bernie, http://www.youtube.com/user/plugabletech, https://twitter.com/plugable",Charge up to 10 devices with Plugable's elegant charger. Up to 100W per port. Uses the USB-C power supply you already have.
iMicro Q3p: A 1200x Polarizing Fingertip Microscope,QingYing E&T LLC,http://www.mobile-scope.com/,"Tiny, light, optical performance comparable to a pro polarizing microscope, easy to use while affordable, and work on any camera phone"
CyberAxon D3: 13-in-1 Multifunctional Stream Control Dock,RayCue,https://www.raycue.com/,Stream Control Touchscreen| 8K Display | 10Gbps｜Triple 4K@60Hz | 13 ports | 100W PD | USB 3.2 Gen 2
World's First 240W App-Controlled Magnetic Smart Cable,mobfree,https://www.imobfree.com/,App-Controlled | 240W Fast Charging | OLED Display | Customize Start-Up Animation | Magnetic Design. Redefine your charging experience!
Magnetic Handwarmer: Winter Magic in Your Hands,Morwie,https://morwie.net/,Power Bank | 10000 mAh | 360° Heating | 16h Battery Life | Magnetic | 3 Heat Levels | Intelligent Protection | Temp Battery Display
Pokoro: The World’s First GPT-4o Powered Reading Companion,Neolab,https://pokoro.co/,AI-Powered Conversations | Empower Kids to Read Independently | A Screen-Free Learning Experience | Foreign Language Practice
Valerion VisionMaster: Cinematic-Grade RGB Laser Projector,Valerion,https://www.valerion.com/,Most Funded Projector in Crowdfunding History | 2024 Most Funded Crowdfunding Project | The Hook Up's 2024 Top Pick Lifestyle Projector
XL Tactical Hair Clip Multitool in Iridescent Tacticlip® EDC,TactiCouture,"https://chevassus.com/, https://knok.org/, https://kalosagon.com/, https://tacticlip.org/, http://tacticouture.com/",Minimalist CYBERPUNK tool for action lifestyles. New XL Size. Stainless Steel. Nail File. Raptor Claw Tip. 14th successful Kickstarter.
"NANO TRACKS: A Tiny, Fully Functional RC Excavator",Jonathan,https://www.nanotracksrc.com/,"Tiny Yet Mighty: Experience Precise, Fully Functional RC Excavation Anywhere"
"Reel Saber: Retractable, Customizable, Programmable!","Matt ""Fish""",https://www.reelsaber.com/,"A Fully Retractable Saber – Engineered for Sci-Fi Fans, Tailored for Customization!"
Iris: The all-in-one portable solar tracker,Iris Solar Technology,https://iris-solar.com/,"Energy, anywhere."
VocaEase:The 1.st rotating 360° MagSafe AI Translation Ring,VocaEase,https://vocaease.ai/,138 Languages|Multi-Mode Translation|Video Call|Cross-app|Recording Transcript|Dialogue|Power by AI|MafeSafe Ring|Summary|Free App
Liene PixCut S1 Photo Sticker Printer and Cutter,Liene,https://www.liene-life.com/,"High-quality Printing - 300 DPI｜Precise Cutting with Fine-point Blade｜Waterproof, Fade-resistant & Scratch-resistant Stickers｜Smart App"
Ti-coolX: Premium Titanium Cooling Ice Pack,TiCool,http://www.ticooltech.com/,"Model TA1 Pure Titanium | Instant Freezing | Extended Cold Retention | Compact, Safe & Eco-Friendly"
GeckoWiper🦎| Removable Rear Window Wiper for Hyundai IONIQ5,GeckoWiper,"https://www.instagram.com/gecko_wiper?igsh=MTkzdDFqaDlwaHJnaw==, https://www.facebook.com/profile.php?id=61561831824769&mibextid=ZbWKwL, https://www.reddit.com/u/GeckoWiper/s/4Z9gTQQ8uG, https://youtube.com/@geckowiper?si=MNGKbe9SJmG_J5vL, https://www.tiktok.com/@geckowiper?_t=8nmZyo1hDWq&_r=1, https://x.com/GeckoWiper",Retrofit | Rear Window Wiper | for Hyundai Ioniq 5 | Tool free Mounting | Dual Safety System | Attachable & Removable in seconds |🦎|
Icepura: The Instant Water Cooling & Filtration Pitcher,Icepura,"https://www.facebook.com/profile.php?id=61565903666040, https://icepura.com/",Filter and cool your water to a perfect 10°C in minutes for instant refreshment anytime.
McGIZ Oclick：Create your own phone accessories in a snap,Nerz,https://www.mcgiz.com/,McGIZ Oclick is a streamlined collection designed to unlock your creativity and make phone accessory truly personal!
GOKKCL: The Next-Gen Sodium Battery Emergency Jump Starter,GOKKCL,https://gokkcl.com/,Sodium-Ion Battery | High Safety | Longer Power Storage Time | 27000mAh | Digital Display Screen | 60W PD Power Bank |3-Level LED Light
Fosi Audio VOL20 - Multimedia Control Knob with RGB light,Fosi Technology,https://fosiaudio.com/,"Built with zinc alloy, VOL20 offers Bluetooth/USB connectivity, customizable RGB lighting, and plug-and-play ease for volume control"
Ti-ONE:Ultra-Portable All-in-One Titanium EDC Tool,Clean One,https://mation.top/,6-in-1/ Multi-Function Screwdriver/ Cutting Knife/ Craft Knife/ Window Breaker/ Eternity Pen/ Ruler/ Titanium/ Portable/ Fashions
"AirCard Pro & AirNotch Pro - Track & find any item, forever.",Rolling Square,https://rollingsquare.com/,Rolling Square's Bluetooth trackers family | Android & Apple | Locate everything you care about | Lose the hassle of losing things
Illumi-key: Find your Keys in the Dark!,Illumi-key,https://www.illumi-key.com/,✅ Automatic LED lighting in the dark using GPS/WiFi detection ✅ Real-time tracking and sound alerts if you lose your keys or phone
SHERRIVA：Wireless Type-C Transmitter and HDMI Receiver 100ft,SHERRIVA,https://sherriva.com/,High-Speed Stable Transmission丨Plug-and-Play丨Long-distance Transmission丨Wide Compatibility丨Compatible with Type-C Systems
MEMDock: The Ultra-Compact Magnetic USB-C Hub,MEMDock,"https://www.memdock.com/, https://www.facebook.com/groups/1026072729246015",5-in-1 Hub｜USB 3.2 Gen 2｜10Gbps｜100W PD｜4K@60Hz｜Supports Steam Deck & Nintendo Switch
MOGABI V3 Guitar: Unleash Your Creative Power Anywhere,MOGABI AMT,"http://www.mogabi.net/, https://www.facebook.com/Mogabi-106342851085624, https://www.youtube.com/channel/UChROH4L-z89BkQtlwpUChqA/featured",Electric Effect Sound Recording | Battery Self-Replacement | High-Output Sound | Foldable Design | Noise Cancellation| Wireless Pairing
SNAPPY: Super Stable Ergonomic Battery Grip for Mobile Phone,Buddiesman,http://www.buddiesman.com/,Mobile Gimbal | Ergonomic Grip | One-Touch Switch | Ring Light | Bluetooth Remote | Zoom Wheel Control | Expansion Port | Power Bank
Kica JetFan Max：The World's Most Powerful Air Blaster,FeiyuTech,https://www.feiyu-tech.com/,"324 KM/h Powerful Airflow, 785W Turbo Motor, Instant Thrust, Clean. Vacuum, Deep Cleaning, Precision Airflow, Recharge and Replace"
GEMINI CABLE: Seamless Dual Charging & Versatile Cable Modes,STYLEPIE ELF Cable,https://stylepie.com/,240W High Power Support | Two-in-One Mode Switching | 20-80% Power Distribution | Versatile Lengths | Built-in Wireless Charging
Super Charge Bros - Nostalgic Wireless Phone Charger,John Roo,https://www.theretroroomgames.com/,A retro styled wireless phone charger!
Poolert S- The Ultimate AI-Driven Pool Alarm for Security,Poolert,https://poolert-alarm.com/,Quadruple Alert System丨Security AI Camera丨Real-time monitoring丨Automatic activation mode丨Solar Charging Pool Alarm丨Easy To Install
Charmast C10 | Hook and Go Power Bank for All Devices,charmast,https://www.charmast.com/,"Cookie Size, Lanyard Design | Charge 4 Devices at Once | 3-in-1 Wireless Charging | 2 Built-in Cables | 6 Colors | 20W | Smart Display"
DIVEROID - Turn your smartphone into an All-in-one Dive gear,DIVEROID,https://diveroid.com/,"Turn your smartphone into an affordable all-in-one Dive computer, Underwater camera, and Photo-synced log book with Diveroid."
Youtrons: Guardians of Focus,Captain Make,https://captainmake.com/,"Tiny, joyful pomodoro timers that keep distractions away. Simply plug into any USB port and focus. No settings, just pure concentration"
Flare: An Off-grid Locator with Messaging,Metrazi,https://metrazi.com/,Flare elevates your outdoor experiences with friends in areas without cell-service. Background location sharing and text messaging.
DECOKEE—Magnetic M.2 NVMe SSD Enclosure,DECOKEE,"https://www.decokee.com/, https://www.facebook.com/groups/decokee, https://www.instagram.com/decokeeai/, https://x.com/DecokeeTech, https://discord.com/invite/xdE3PAUwuq",Magnetic Structure Design | LED Lighting | USB 3.2 Gen2 | 1GB File in about 1 Second | M.2 NVMe SSD Up To 2TB
Disk Plus: Ultra-slim Data Solution for Your Daily Tech,Sharge Tech,"https://shargeek.com/, https://sharge.com/","World's Thinnest 0.24""｜10Gbps｜Max 4TB｜Data & Charging at Once｜Snap with MagSafe｜Streamlined Cable Management"
E-Paper Calendar and Smart Display,Konstantin,https://www.invisible-computers.com/,A 10-inch digital paper display for your calendars and other apps.
"Qubii Power: 2-in-1 Auto-Backup & Charge, 10 Years Warranty!",Maktar Inc.,"http://www.maktar.com/, http://www.piconizer.com/","One-step backup & charge simultaneously without Internet. Zero effort, never forget again! Foolproof, convenient & compact for travel!"
QicoBay P1: Redefine Flossing with Elegance and Innovation,QicoBay,https://qicobay.com/,"Ultra-Modern Flosser: World's 1st Auto-Restringing, Steel Body, Ergo-Design, Stylish Portability, UV Sanitizer, Zero Waste, and More"
Hopper: The Footrest That Promotes Healthy & Active Sitting,Wes Furuta,https://www.hopperfootrest.com/,"Support better posture, reduce stress, and burn calories with every move. Hopper keeps you comfortable & active while you work or relax"
Portable SSD Magbox: Your Ultimate Mobile Storage Solution,COWZRY,"https://www.facebook.com/profile.php?id=100091825238692, https://www.facebook.com/groups/943361597804490",Wide Compatibility with Type-C Device| 2TB M.2 NVMe SSD | Magnetic Design | Support Apple ProRes 4K·60 | 10Gbps Transfer | Compact
Kefary: Dual Cassette Stoves for Outdoor Cooking Adventure,Kefary,https://kefary-service@outlook.com/,Double Stoves | 3.6KW High Heat | Explosion-proof | Portable and Foldable Structure | Applicable for Various Fuels
"FarReach A1: Your In-Car Rescue Tool, All in One Solution",FarReach Auto,https://www.facebook.com/profile.php?id=61559937074563,150PSI Super Inflation | Real-Time Tire Pressure | 2000A Instant Jump Start | 20000mAh Powerful Power Bank | Multi-Mode LED Light
FUNDIAN X1 Gaming Keyboard   CookieRun Limited Edition,FUNDIAN,"https://www.fundian.com/, https://www.youtube.com/channel/UCAYV5bR-n3ACfGQ8YCdLazw, https://www.facebook.com/fundians","All-in-one Wireless GamePad and Keyboard Combo compatible with iOS Arcade, Android, Win Mac Steam PC Game and Nintendo Switch."
EvoDuster Pro: Ultimate Powerful Cordless Blower&Air Duster,EvoDuster,https://evoduster.shop/,Wireless / 1.2kg~1.5kg Strong Wind Force / 10×2000mAh Big Battery / 1.2kg Lightweight / Various Nozzles / Suitable for Courtyard Use
NOMAD 3.0: Electronic Mosquito Protector,Luc Deschamps,"https://www.lifts.life/, https://www.bacterras.com/","Embrace Nature, Not Mosquitoes: A Chemical-Free Protector!"
Womier RD75: Rapid Disassembly QMK/VIA Wireless Keyboard,Womier INC,https://womierkeyboard.com/,"Wireless and Wired | Full Aluminum | QMK/VIA | Ultra-Low Latency | Hot-Swappable | Connects Up to 5 Devices | For Mac, Windows, Linux"
Thumby Color,Ken Burns,"https://twitter.com/TinyCircuits, https://tinycircuits.com/",Next Generation of the Playable Programmable Keychain
Keychron K2 HE: Ultimate Customizable Magnetic Keyboard,Keychron,https://www.keychron.com/,Hall Effect Magnetic Switches | Wireless 2.4G & Bluetooth | Custom Actuation Points | Rapid Trigger | QMK | For Mac & Windows | Wooden
COOLSMILE: Ultimate Portable Air Cooler for Any Space,ecostar,https://en.eco-star.co.kr/,Cost-saving alternative to AC and fans | Turns warm air into a cool breeze | Runs up to 8 hrs on one charge | Ideal for all environment
Luck - The Smart Hummingbird Feeder,bbpeco,"https://bbpeco.com/, https://www.youtube.com/@bbpEco","Experience Every Moment with Real-Time Alerts, Stunning Imagery, and Nectar Quality and Level Monitoring"
AUDIO ADVENTURES,Lee McGeorge,https://www.trumantoys.com/,"An electronic story adventure system designed for all, but optimized for people with blindness and disabilities"
H10Plus Coffee Maker: DlY Your Coffee Your Way,HiBREW,"https://ks.hibrewcoffe.com/, https://www.hibrew.com/",HiBREW offers flexible options for crafting your coffee's flavor profile while maintaining stable control over its taste.
The SheltieCam - The portable pet camera with temp sensor!,Meanwhile,"https://www.meanwhile.nu/, https://www.instagram.com/meanwhile_petcam/, https://www.facebook.com/MeanwhileAB","4G connection | Rechargeable battery | Monitors video, temperature, sound and motion | Universal mounting | Alerts and warnings"
Titaner TiGlide S1: Unparalleled Single-edge Titanium Razor,Titaner TiGlide,https://www.titaner.com/,"Comforting Smooth Skin-fitting, Adjustable Close Efficient Shave, Ergonomic Handle, and Aesthetical Design for Every Gentleman"
Hydra : World's First Triple Type-C 100W LED Cable,Futurizta Tech,https://www.futurizta.com/,Triboost™ Technology | Fast Charge 3 Devices At Once Up To 100W | LED Display | Data Transfer | Optional Watch/Lightning/Micro Adapter
Portable Keyring Laptop Stand & Eco Tote Bag Set for Nomadic,Habitamin,https://www.habitamin.com/,"Productivity tool, Portable keyring laptop stand and eco tote bag set for those working diligently in diverse environments."
OVERLYING Portable Nintendo Switch Monitor with TV Mode,OVERLYING,https://overlyingtech.com/,"Unlock TV Mode Anywhere! Switch Monitor with Portable Power & Modular Design for Enhanced Gaming Anytime, Anywhere!"
World's 1st Wallet with Built-in Find My,ESR,https://www.esrgear.com/,Easy to Find | Thin & Lightweight | Cost-Effective | Rechargeable | More Storage | RFID Blocking
RUNK: The world's smallest stylish mini portable power bank,RUNKER,https://runkerinc.com/,Mini Portable |3000mAh | 62g | 30W | EDC | NFC | Comes with Charging Cable | Can be placed on Key Ring| 3-in-1 |
Whaley | Sleep & Relaxation Pillow | For Better Relaxation,Whaley Sleep,https://www.whaleysleep.com.au/,Improve Sleep | Two Guided Deep Breathing Exercises | 3 Levels of Heat Therapy | Menstrual Pain Relief | Stress Relief | For Wellness
Woowind NW10: The Ultimate Cordless Fast SUP and Kite Pump.,Woowind,https://woowindshop.com/,Cordless Design | Max 20PSI | Auto-off｜13500mAh Battery｜Pumps 8 SUPs｜Power Bank｜Made to Last｜Energy Efficient
Aligoo Boost: 4000A SuperSafe Car Battery Jump Starter,Aligoo,https://www.backerarea.com/aligooboostseries,For Engines Up to 10L/8.0L | 4000A | 24000mAh Capacity | 100W PD Power Bank | IP67 Waterproof | 4-Level LED Light | Magnetic Base
"Jelly Max, The Smallest 5G Smartphone ?",Unihertz,"http://www.unihertz.com/, https://www.facebook.com/1526680197345277/, https://twitter.com/unihertz, https://www.instagram.com/unihertzjelly, https://www.youtube.com/@unihertzofficial, https://www.linkedin.com/company/unihertz/","Max Power, Perfect Size! Jelly Max is the latest 5G small smartphone that ideally fits in your palm."
iGulu S1: The Ultimate Beer Brewer For Everyone,iGulu,https://comingsoon.igulu.com/igulus1,"One-Tap Easy Brew丨Chill&Dispense丨Intelligent Brewing System丨Customize Ingredients&Recipes丨Craft Kombucha, Cider, Mead丨Easy Clean-up"
Hazel Quinn X Eduardo Recife 1 L Electric Kettle,Hazel Quinn,https://hazelquinn.com/,Gorgeous Botanical Motifs | Long Straight Spout | BPA-Free | STRIX Thermostat
Suplugg: MagSafe Power Hub – Simplify Your Charging!,Kylsen,https://www.suplugg.com/,6 AC Outlets | 4 USB Ports | 15W Charging | Light Sensor | Portable Bluetooth Speaker | Magnetic Wireless Charger | Wall Mount.
anyfree Hello Doorbell: AI-Powered Smart Home Security,anyfree,https://www.anyfree.com/,Solar-powered | AI Motion Detection | 1km Transmission Range | Easy to Install | 2.4GHz/5G Wi-Fi | Night Vision | 1080P Camera
Windsible: Desktop Wind Tunnel for Your Diecast Cars Models,Fun-Tech-Lab,https://www.fun-tech-lab.com/,Make Your Model Move Through the Air: Think and Observe Like an F1 Designer
