title,company,websites,description
Eternal City: World's 1st DIY Space-themed Charging Station,AOHi,https://www.iaohi.com/,Unleash your inner engineer. Soar to new heights in both work & imagination w/ the ultimate DIY cyberpunk wireless charger & power bank
Starship Seer - Make the future foreseeable!,STORM 2,https://www.shargeek.com/,"10,000mAh power bank/35W output/30W input/USB-A & USB-C/Predict remain charging time/12 hour program Clock/Alarm clock/Portable/Stylish"
abxylute: Top-notch streaming handheld with stunning display,abxylute,https://abxylute.com/,"One-stop gaming | Remote Play | 7"" 1080P Graphics | 8-hr Gameplay | Low latency | Built-in Launcher | Precise Controls"
iChessOne: First Foldable Electronic Chessboard|Made of Wood,iChess,https://www.linktr.ee/iChessOne,"Tournament-style, hand-carved wooden set, easy to carry and transport. Play chess online but on a real board with anyone in the world!"
Bone Conduction Business Headset & Bluetooth Headphones,Sam&Johnny,https://www.samjohnny.net/,"Sam&Johnny—Open-ear Headphones l Bluetooth 5.2 l Magnetic microphone l Bone & air conduction dual speakers, with the best calls & sound"
Tensegrity Table for Phones,Kontax Engineering Ltd,"http://www.stirlingengine.co.uk/, http://www.facebook.com/kontaxstirlingengines, https://www.kontax.co.uk/","A companion for your phone. Great for facetime, teams meetings. Or just to cradle your phone."
Light-Up Chess by Masteek | Wireless Led Chess Set,Masteek,https://www.masteek.com/,Chess pieces light up wirelessly using electromagnetic induction.
Zoo Gears - All-In-One Smart Music Instrument for Pets,Zoo Gears,https://www.zoogears.com/,Smart Music Instrument | Educational kits for IQ & mental development | Communication tools | Food feeder & tech modules add-in
Birdfy Nest: A Dual-Camera Smart Bird House,Netvue,http://netvue.com/,Enjoy the beauty of bird nesting on your phone anytime anywhere.
Delta 2-in-1 Reflective Reversible Graphene Jacket,Wear Graphene,https://weargraphene.com/,"One-of-a-kind apparel made for day and night performance. Graphene-infused, lightweight, waterproof, windproof, and strong-as-diamonds."
Catmos - The Smart Cat Collar,Catmos Global,"https://www.catmosglobal.com/, https://www.instagram.com/catmosglobal/, https://www.facebook.com/profile.php?id=100089296410694",The smart activity monitor translating meows into accurate and reliable data.
Geo Wallet - World's 1st MagSafe Wallet with Full Find My,ESR,https://www.esrgear.com/,A MagSafe wallet with Apple-certified Find My functionality that securely locks onto your iPhone and opens out into a stable stand
HexaCharge - Redefining Apple CarPlay and Android Auto,Malinto Design,"https://www.hexacharge.com/, https://www.facebook.com/myhexacharge, https://www.malinto.com/",Converting your wired Apple CarPlay and Android Auto wireless without draining off your smartphone’s battery power
Super Long Throw OMNI Laser Flashlight Tactical Lighting,GALAXYMAN,"https://www.galaxyman.us/kickstarter/, https://www.facebook.com/galaxymanlighting, https://www.youtube.com/@galaxymanlighting",1039M Beam Distance | 270LM | OMNI Laser Light Engine | Picatinny Rail Mount | IP65 | 1.5M Impact Resistant | Rechargeable | CE | FCC
"KINDALU®: a new cable case, that solve all cable problems",Kindalu s.r.l.s.,https://kindalu.com/,All your cable frustrations– solved with a twist of your finger! 3D PRINTED - UNTANGLE THE CHAOS
New Phone accessory. Tracktable Lifestyle.,Alejandra Alaniz,https://www.tracktablelifestyle.com/,"Smart phones have become an essential part of our life, losing it, breaking it can be expensive and frustrating. The solution is here!"
WAVE Pro:Smart Portable Outdoor Pump with 2.5X Speed Boost,OAK & IRON TECH,"https://www.facebook.com/OakIronUSA/, https://www.instagram.com/oakiron.usa/, https://oakiron.tech/",Outdoor Use &Family Backyard|Pump Up 3.7 SUPs & 8 KITEs|Time Cut by 63%|Inflate & Deflate|High-pressure & Cordless
POLARRIES E-Cube 100: A Superfast 100W Travel Adapter,POLARRIES,https://polarries.com/,Astonishing 100W Output | 2C2A+1 for 5 Devices Charging with Ease | Go Well with Worldwide Sockets | Worry-free Auto-Resetting Fuse
Fight back against hackers: The Gorgon Cyber Defense System,Gorgon Cyber,https://www.gorgoncyber.com/,Simplified Cyber Intrusion Detection and Active Response system for your home office - all in a small touch-screen device.
Lochett & Litl Lochett- Powerful magnetic storage that glows,XDraggon PTY LTD.,"https://www.facebook.com/Lochett, https://www.lochett.com/, https://www.instagram.com/_lochett/","Powerful, versatile, practical and seriously updated. Introducing Litl Lochett, a lighter version to add even more applicability."
Purring electric toothbrush for cats | ForCatCare,ForCatCare,https://www.forcatcare.com/,Expand your cat’s lifespan by brushing their teeth | Brush at least once a day | No-fight-brushing thanks to our purring toothbrush
Cherry Tart: Crafty & Interactive Nature Inspired Robot Kit,Tart Robotics,https://www.tartrobotics.com/,The sound-activated & LEGO-compatible crafting robot kit for kids & adults to innovate | ✅ Starting at $45
MindLax Sleeping Mat: Relaxing Sleep with Sound Wave Massage,MindLax,https://mindlax.com/,Fall Asleep in 10 mins｜Improve Sleep Quality｜Reduce Stress｜Quick Nap｜Meditation｜Yoga｜MWS Based On Noble Prize｜Insomnia & Anxiety Helper
Dayoo TranSteamer - The True Cordless Steam Cleaning Center,Dayoo,https://transteamer.dayoosmart.com/,100% Chemical Free | Steam Ready in 30S | Cordless Cleaning Up to 16Mins | Up to 120ml/min Steam Discharge | Modular Design&Accessories
Infinity Flip Mobius Fidget band Toy,CYKAPU,https://cykapu.com/,"Infinite flip, Playing Meditation"
"Four-star bike seat cushion, enjoy the ultimate comfort",Team JFT,https://www.jft-shop.com/,Airbag Design/ Press To Adjust/ Anti-slip/ Portable/ Waterproof/ Easy to Install
BlueSleuth-Lite - Detect hidden AirTags,Scott Schober,"https://www.bvsystems.com/, https://scottschober.com/",Instantly detect hidden AirTags and any personal BLE tags and devices used for stalking and illegal tracking
All-in-One Docking Station with AC Outlets for Workstation,mobfree,https://www.imobfree.com/,110W 4-Port Total Output/ HDMI 4K@60Hz/10W Wireless Charger Stand/ 2 AC Outlets /5Gbps Data Transfer /Gigabit Ethernet
DearBuds PE: Ear Dehumidifier for Pets,Linkface,http://linkface.co/,"DearBuds Pet Edition - Use them after a shower, swim, or outdoor activities to maintain optimal humidity."
"Litterbot Pro: No Mess, No Stink Automatic Cat Litter Box",Litterbotics,https://litterbotics.com/,No scooping | No mess | Effectively preventing bad smell | Easy to clean | Super quiet & Energy Efficient
Cycloid Mini,Joe Freedman,"http://www.leafpdx.com/, http://www.sarabande.com/",A small epicycloid drawing machine that comes completely assembled
"ShakerBot: Bringing Intelligence to the auto ""Mouse Shaker""",RealIOTTech,https://realiottech.com/,"This is a fully programmable ""Mouse Jiggler"" that allows time based scheduling, Web configuration and OTA Updates"
The InBirdie Tempo + : The Smart Golf Putting Simulator,DMBH,"https://www.inbirdietempoplus.com/, http://www.dmbh.co.kr/","AI technology with 12 precision optical sensors to accurately measure and train putting tempo, angle, and distance up to 60 feet."
"Flipstik Pro Phone Accessory - Mount, Stand, and Grip",flipstik,"http://www.getflipstik.com/, https://instagram.com/getflipstik, https://www.facebook.com/groups/getflipstik","Make your phone a: GoPro, Mounted TV, Continuity Camera, Tripod, GPS, or Camera Man."
Yeslamp Ace: RGB eSports Dynamic 4-in-1 LED Desk Lamp,Yeslamp,https://www.yeslamp.com/,"RGB Ambient Lighting | Mecha Style | Fast Wireless Charging Pad & PD Port | Natural Spectrum | Perfect for Gaming Setup, Working, Study"
Chargerman: Tesla to J1772 Charging Adapter,Chargerman,https://chargerman.com/,Charge any EVs much faster and safer than ever with a J1772 port. An essential adapter for Non-Tesla Electric Vehicles.
Huhubol Pro2 - Your New Super DIY Grinding Drill,Huhubol,https://hu-hu-bol.shop/,35 Modes/35000RPM/Anti-vibration/long lifespan/stainless steel materials/compact design
BBMini—New era of clean photography gadget,Sysmax,"https://www.youtube.com/channel/UC2ze76sbqabrEgs1q3WSMmQ, https://www.nitecore.com/, https://www.facebook.com/groups/1278398619305106",Blowerbaby Mini|Camera Cleaning New Level:40.3 mph|Magnetic Quick Release Brush|2.5 kPa|8.88Wh|Pump
S2 | Pro Massage Made Easy.,ELEEELS,https://www.eleeels.com/,"Hot Stone Massage Anywhere, Anytime."
SENSE3: No-Look Wireless Charging Pad For All Apple Devices,YTREES,https://www.ytrees.com/,"Free Position | 10,000mAh Power Bank | Universal Compatibility | Wireless + Wired | 3 Devices at 25W Output Max | Optimum Charging"
AOHi: Modular Extension USB-C Cable Set For Fast Charging,AOHi,https://www.iaohi.com/,"Charge your way with mix & match cables for the perfect length, 240W PD 3.1 of lightning-fast power charges your devices on the fly."
MAD PIXELS LAB：Crazy In Quick & Versatile Charging Solutions,Magica Team,https://www.facebook.com/profile.php?id=100087366761316,Insanely-Fast Charge│Charge 4 Devices At Once│Funny & Original Design│Wide Compatibility│Mini Portable Power Bank│Pixels Phone Stand
Nitetronic Z6: Meet The Non-invasive Anti-snore Pillow,Nitetronic,https://www.nitetronic.com/,AI-powered/Smart APP/Manual Control/All night standby/Clinically verified/Comfortable pillow
Broccoli—Eco-friendly Cookware With Natural Non-stick,Harford,https://www.harford.com.cn/,"Natural and healthy coating non-stick pan, energy-saving cookware series for all your cooking and storage needs."
"Magnilink 360 PRO: Charging Problems, Magnetically Solved",Magnilink,https://magnilink.co/,"The latest generation of Magnilink, the 360 PRO brings you even more power!"
"KWUMSY KX ,The Touchscreen with UI 98-Key Keyboard",Kwumsy,https://kwumsy.com/,The FHD portable large-format touchscreen increases your productivity and improves your gaming experience
PowerSoo: The Only All-purpose PD200W 6-in-1 Desktop Charger,PowerSoo,https://www.powersoo.com/,PD 200W & 4 USB-A Fast Charging for Designers & Gamers | Portable Wireless Charger | Quickly Charges up to 9 Devices Simultaneously
WYND Sentry - Complete Property Risk Monitoring,"Wynd Technologies, Inc.","http://www.hellowynd.com/, http://www.facebook.com/hellowynd, http://www.twtter.com/hellowynd","An advanced solution to protect your property from smoking, loud parties, and other environmental risks."
PUZZLE FEEDER - A Eating Habit Changing Device for Your Dog,PUZZLE FEEDER,https://thepuzzlefeeder.com/,"We developed Puzzle Feeder to help every dog pet stay away from digestive problems, obesity and bloat which can take away their lives."
"Inateck 8-in-1 iMac 24"" 2021 Docking Station, USB 3.2 Gen 2",Inateck,"https://www.inateck.com/, https://www.inateck.de/",Multiport Hub: 3 USB A Ports | 2 USB C ports | 1 SD Card Slot | 1 Micro SD Card Slot | 1 NVMe SSD Slot | Charging Supported.
NiKOTA META-2000: First Portable Power Station with 4G/5G,NIKOTA,https://www.nikotapower.com/,"Enhance your outdoor experiences and protect yourself from blackouts with access to power, communication, entertainment, and more."
"µChart – Test your camera, lenses, phone, and other optics",QingYing E&T LLC,http://www.mobile-scope.com/,Affordable quality micro charts comply with iso standards and US military test protocol to test the resolution of your optic tools.
Back Hammock: Lumbar Support for Standing Desk Users,ActiveWork,https://www.activework.fitness/,Make standing comfortable | Stay active | Relieve back pain | No tipping your desk | Emergency release
"Allingo Remo - Record, Transcribe, Translate Speech",Allingo,https://www.allingo.info/,134 languages|Speech to text transcribe|translation|10m 360° voice capture
QicoBay C1: World’s 1st Auto-Restringing On-the-Go Flosser,QicoBay,https://qicobay.com/,"For saving your time, health, and our earth."
QROV: Only Car Wireless Mount you’ll Need,Qrov Inc,http://getqrov.com/,Universal Wireless Charger Mount charge iPhone | Android | AirPods | Qrov Boost App | Magnetic MagSafe
Zeus: Worlds First & Smallest 270W GaN USB-C Charger,asap Technologies,"https://www.chargeasap.com/, http://www.youtube.com/c/asapTechnologies, https://www.instagram.com/chargeasap/",Tiny charger for powerful devices: OLED Screen | 3 USB-C Ports | 140W USB-C | 270W Total Output | Charge 4 USB devices at the same time
Kitchen Knife Sharpener - Freehand Guide,Mark Turnbaugh,https://sharpworx.com/,Sharpen your kitchen knives in the same way a professional chef would.
"CtrlAX | Premium Ultrasonic Cutter | 40,000 Vibrations/Sec.",WONDERCUTTER,"http://www.wondercutter.com/, http://www.facebook.com/wondercutter.com, https://www.instagram.com/wondercutter/, https://www.youtube.com/channel/UCPl78ibke9ARgGHfjpsG5Lg","Cutting Plastics with stronger force | Fast, Delicate, Easy | 5 Types of Multi-Blades | 3 Types of Power Mode | 2nd Gen."
Standard Poker Co.,SPC Innovation Solutions Inc,https://standardpoker.co/,SPC 2.0: The Smartest Home Poker Sets Ever Friggin' Imagined.
CXBER—Multi-function Coffee & Juice Maker,CXBER,https://cxber.com/,"All-in-one machine with coffee bean grinding, coffee brewing, juice extraction, and crushed ice functions."
Air.0 | The Foldable Bluetooth Computer Mouse,Air.0,https://www.myair0.com/,Foldable Full-size Mouse | Only 4.5mm thin | Weighs 40g | Extremely Portable | Truly Ergonomic |  Snaps to activate | Patented
Spider Tool Holster PRO | Next-Gen Tool & Tethering Solution,Spider Holster,https://spidertoolholster.com/,A trade ready solution for securely carrying tools with an integrated tethering system for dropped object prevention.
STRIG Boomerang: Full Body Self-Massager | We're Back!,Strig,https://getstrig.com/,Patented microvibration technology and single & double-edged blades for personalized relief | No need for extra heads/attachments
LYIEW SEED—The Interactive Music-Controlled Ferrofluid,LYIEW,https://lyiew.deoum.com/?preview=true&contest_score=7,The combination of retro styling and cutting-edge technology: dance to the music | multiple interaction modes | stress release
"SwitchBot Blind Tilt, solar-powered retrofit smart blinds.",Wonder Tech Lab,"https://switchbot.jp/, https://switch-bot.com/","Simple Setup | Solar Powered | Compatible with Alexa, Google Home and Siri | Light Sensing Controls"
"Anymotor—Versatile Powerful Hair Dryer, Air Pump & Blower",Augmotor,https://www.anymotor.cn/,"Use with 3 mouthpieces, built-in battery, no charging cable, can be used anytime"
Ticktime Cube: Flip to Start Countdown & Manage Your Time,Ticktime,https://ticktimenow.com/pages/ticktime-cube,"600,000+ Sold. Just Flip and GO! End your procrastination. Efficient, and better than what's out there. Office|Study|Game|Cook|Workout"
BodyPedia: Most Powerful & Portable Body Composition Scale,BODYPEDIA,https://lightmovetech.com/,"BodyPedia is the World’s Most Precise Body Composition Analyzer. For Welling-being and Fitness, Monitor Your Health at Home."
"XXL Tactical Multi-tool Hair Clip: Tacticlip® - 4"" EDC Tool",TactiCouture,"https://chevassus.com/, https://knok.org/, https://kalosagon.com/, https://tacticlip.org/, http://tacticouture.com/","Ultra-sized hair clips: control unruly & thick hair. Minimalist 4"" inch survival multi-tools. Vacuum plated. FREE USA shipping 📦🇺🇸"
Mix Things Up With RAYNOLSE: Double Under Tracking Jump Rope,Raynolse,https://www.instagram.com/helloraynolse/,Trade in your jump rope for Raynolse: the smart jump rope that never misses a jump! Pair with our nifty app to track your workouts.
Airlephome—Smart Air Purifier with Bladeless Fan,Airlephome,https://www.airlephome.com/,Air Purification l Bladeless Fan l Imitation Sunrise Wake-up Light l Sensor Table Lamp l 15W Wireless & Wired Charging
OBDGO G1: One Tap Unlock Hidden Features and Code Your Car,OBDGO,https://www.obdgo.com/,"Plug and play sensor, even beginner can taste the fun of customization, easy operate, one tap unlock hidden features by your mobile"
EDGE Pro - Bring True Modularity To Your Workstation,Rolling Square,https://rollingsquare.com/,EDGE Pro is an Ecosystem of products that can be combined in endless configurations to make your workstation setup truly personal.
Dash Cam Omni: 360° Rotating Vehicle Security Guard,70mai,https://www.70mai.com/,360° Full View | AI Motion Detection | Superb Night Vision | GPS & Route Tracking | Voice Control
"Real-time Tire Pressure Monitor for Road Bikes ""Smart iPump""",Morris Ostrow,https://www.ipump.jp/,"Bicycle riders, measure your tire pressure and temperature in real-time, fits Presta and Schrader bicycle tires."
"Cybersense: A ""Cybertruck"" style diffusers",Wild-Charger,https://www.wildcharger.net/,"This is a very futuristic and cyber style diffusers. You can put it anywhere.
| Car | Desk | Bedroom | Bookcase | Office | Anywhere｜"
Cargenta OBD - Connect Your Car with Your Phone,Cargenta,"https://www.cargenta.com/, https://www.facebook.com/cargenta.brain/, https://twitter.com/Cargenta_, https://www.youtube.com/channel/UCYJdA5uA6FX1u6xJISvuPgg, https://www.linkedin.com/company/cargenta/, https://www.instagram.com/cargenta.brain/","Advanced OBDII device to track your car location in real time, scan & erase fault codes, setup security, add alarms & simplify repairs."
"Ifory: The Era-defining 40,000 mAh Power Bank Boosts It All",G-youth,https://www.amazon.com/iFory-Portable-40000mAh-See-Through-Waterproof/dp/B0BWJQP6SC/ref=sr_1_3?m=A1WHHL9ULECBBG&marketplaceID=ATVPDKIKX0DER&qid=1686496531&refresh=1&s=merchant-items&sr=1-3&ufe=app_do%3Aamzn1.fos.f5122f16-c3e8-4386-bf32-63e904010ad0,"40,000 mAh | 100W PD fast charging | Pocket size | LCD Screen | Waterproof and dustproof"
Blips3 - The new extra thin macro lenses for any smartphone,SMO SmartMicroOptics,https://www.smartmicrooptics.com/,"With Blips3 you can turn ANY smartphone into a POWERFUL macro camera. EXTRA-PORTABLE, to explore the tiniest details in any moment!"
eMinder - the paperless sticky note from and for tomorrow,post-think,"https://www.post-think.com/?lang=en, https://instagram.com/post.think.official?igshid=NDBlY2NjN2I=",The eMinder collects all your tasks and notes in one place to help you minimize distractions and be more productive.
MOW: The Next Generation Razor. Reinventing shaving,"Hybrid Razor, LTD",https://mowshaving.com/,The MOW™ Razor — patented shaving technology that combines the closeness of a blade with the convenience of an electric razor.
Touchlox Pro Fingerprint Padlocks,Touchlox,https://touchlox.com/,"No Key & No Combo Needed | Holds Up To 20 Fingerprints | Allows 3,000 Unlocks Per Full Charge"
NOYAFA—Multifunctional Electric Wire Detector,NOYAFA,https://noyafa.com/,AC wire locator l Network cable locator l Circuit breaker finder l Socket test l NCV induction pen l LED illumination
MODIplay - Racing Fun with up to 30 friends at your home,Martin Müller,"http://www.drift-racer.com/, http://www.sturmkind.com/, http://www.drift-racer.de/",Amazing driving behavior - difficulty adjustable - from easy like slotcar/for children to demanding for racing pros
Aristos Home Dropbox: Best Way Protect Your Amazon Packages,ARISTOS HOME,https://www.aristoshomes.com/,Extra Large | Anti-theft | Disinfection | Durable | Waterproof | APP Control | 4 Ways Unlock
Model cardME : A multi effect slot card for the Buchla 208,Northern Light Modular,https://northernlightmodular.com/,"Add a selection of high quality audio effects to your Music Easel 
Unleash the sonic possibilities tapping into its internal modulation"
Eye-to-Cam 2 - The Webcam That Lets You See Eye to Eye,SurvaQ Inc.,https://eyetocam.com/pages/eye-to-cam,Create a positive connection in every call.
UGAST:The smallest intelligent inflatable pump,UGAST,https://www.facebook.com/Zjmx-3-103846225755524,1000LM ultra-long-range lighting|Mesh cooling|Chip Control|Fan cooling|53mm*165mm|Preset tire pressure|accurate air refill|25 Cylinders
The 1947-T Mk1 Revision III Time Accumulator Clock,Ren,http://www.limaflo.com/,"A hand-crafted timepiece, comprising genuine Bakelite & Glass meters and analogue controls, housed in a solid English-Walnut case."
Nesugar: 2-IN-1 Foldable Shoe Dryer & Deodorizer,Nesugar,https://www.nesugarlife.com/,360° Uniform Heating | Smart Temperature Control | 3 Timing Mode | Easy Storage Cable | Good for Household & Trip
Delux PockCombo: A Portable Keyboard & Mouse Combo,Delux,https://www.deluxworld.com/en/index.html,"Featuring a foldable keyboard, sliding mouse, and protective case, PockCombo has all the essentials to set up an office workspace."
Flora - Your Pocket Sized Plant Coach,Flora,https://florasense.com/,Save your plants with the Flora Pod: A smart plant sensor that takes the guesswork out of plant care!
Invisible Paper-thin Table For Travelers & Home Workers,iSwift,https://iswift.us/,Transform in 1 Second | Invisible when you store it | Ultra Thin | Super Light | Stable M Structure | Eco-friendly Material
Blackcoffee.io : Be Your Own Barista,BlackCoffee.io,https://blackcoffee.io/,Mobile app and bluetooth scale for hand-drip coffee. Step-by-step guide to go from bean to cup.
COR PUMP: ULTIMATE SMART PUMP FOR KITE SURFER & SUP RIDER,COR Team,"https://www.corpump.co/, https://www.facebook.com/itscorpump",Travel Size | 0-15 PSI | Pump Time Cut by 50% | IKO Coach Recommended | Inflator For All Kites /Paddle Boards/ Car Tire
Phigolf World Tour Edition: World's Smallest Golf Simulator,PhiNetworks,http://www.phigolf.com/,With the LARGEST COURSE SELECTION! Play a PRACTICE ROUND before you get out to play for real! At ANY GOLF COURSE around the world.
AirBox Go｜ The 3-in-1 MagSafe Battery Pack for Apple Devices,MOMAX Airbox,https://www.momax.net/,"An Apple-certified battery pack with genuine MagSafe components. Wirelessly charges iPhone, Apple Watch and AirPods on-the-go."
Surplex - Future VR Full-Body Tracking Shoes,Surplex,"https://discord.gg/N7CjBQVjfp, https://surplex.io/",Full-Body Movements Tracking｜No Base Station & Webcams Needed | Not Prone to Occlusion & Drifiting｜480 Press Sensors｜Wi-Fi Connection
PocketStar - Keychain sized Retro gaming!,Pocuter,"https://pocuter.com/, https://discord.gg/wuYNhyu","An Arduino-Compatible, open source gaming console with Multiplayer, WiFi & BLE, App Store, SDK, API & more in the size of a matchbox!"
NANO: Self Powered 2.5K 165hz Touch Gaming Portable Monitor,ArmoryLabs,https://www.techarmory.my/,15.6 inch | lightweight | Self-Powered | Touch | Ultra Portable| 165hz | 2.5K / 4K resolution | 100% Adobe RGB | Next Gen Console Ready
KIMBLADE: Space 4.0 | High-Performance Non-Disposable Wiper,KIMBLADE,"https://www.facebook.com/kimbladewiper/, https://www.instagram.com/kimblade_wiper, https://twitter.com/KIMBLADE1, http://www.kimblade.com/",Just $69. | Nano-Tech Windshield Care Set + 4 bar linkage Rectangular Wiper | 4th Gen. Secret Edge | Space Edition Colors
Unitree Pump: Motor-Powered All-in-One Smart Pocket Gym,UnitreeFitness,https://unitreefitness.com/,Quantify Resistance| 700g Weight| Eccentric&Concentric Available| Arcade Style Games | One for All Training Demands|Free 100+ Tutorial
Yeslamp Evo Adjustable LED Desk Lamp,Yeslamp,https://www.yeslamp.com/,6-Axis adjustable large range LED natural spectrum lamp covering your lighting needs when working on a desk
Coffee & Tea to Go Go™,Coffee & Tea to Go Go,https://coffeeandteatogogo.com/,Dual purpose filter for home (fits in all Keurig machines) and transforms into a portable micro-brewer to go everywhere else!
T-MFY The Slim Easy-Card-Drawing Stealth Wallet,T-MFY,https://www.t-mfy.com/,The thinnest wallet for cards and cash. Make your cards conveniently pop up when you need them.
iZYREC: Smallest and Most Easy-to-Use Voice Recorder for All,iZYREC,"https://plaud.ai/, https://note.plaud.ai/, https://izyrec.com/",18g Ultralight | Fits Anywhere Easily | 50-Day Battery Life | 1536Kbps HD Mic | AI Noise Canceling | 32GB EMMC storage | Sliding Switch
Hinyx MagFlex 2 in1 Foldable Magnetic Wireless Charger Stand,Shaw Brian,https://hinyxshop.com/,✅Foldable Phone Stand✅15W Portable Qi MagSafe Charger✅Super Flexible Angle Adjustment✅Redefine the iPhone 14&13&12 charging experience!
Wicked Egg : Automatic Interactive Pet Toy & Treat Dispenser,Wicked Lab,https://www.wickedlab.me/,"Satisfy your pet’s curiosity with an interactive dispensing toy, keeping them happy & healthy while you’re away"
EZ MILL- 2 in 1 Salt & Pepper E-Dual Mill,Mr.Captain,https://www.kickstarter.com/projects/ezmill/ez-mill-2-in-1-salt-and-pepper-e-dual-mill?ref=1wjnsc&token=90131ce2,Dual-Side Grinding Design | One Button Operation | 5-Precise Grind Settings | Type-C Rechargeable | Long Standby
Magmo : Snap-On MagSafe Call Recorder,MUNE AMERICA INC,"https://www.magmoglobal.com/, https://www.muneproduct.com/",The iPhone-vibe accessory that does what Apple does not
Palm-size Multifunctional Ultrasonic Cleaner CLEANGUARD,SMART VOICE,https://www.smartvoice.aurapioneer.com/,Palm-size Multifunctional Ultrasonic Cleaner That Sanitizes Everything
Ocoopa Union 5s:World First Modular Rechargeable Hand Warmer,Ocoopa,https://www.ocoopa.com/,"Replaceable Battery Core & Heating Case| Real 2-in-1 Detachable Hand Warmer & 10,000mAh Power Bank| Enjoy Uninterrupted Warmth"
DOCA: Smart Mouse & Touch Display Shortcut & Editing Console,Doca,https://www.docasmart.com/,All your favourite software shortcuts and tools under your hands. Simplify your workspace and improve your creativity.
Capsule Gravity: Futuristic Efficiency Booster,STORM 2,https://www.shargeek.com/,"5,000mAh Power Bank|Pomodoro Timer|Kitchen Timer|Flip to Countdown|20W Fast-charge iPhone, iPad & MacBook|Cyberpunk See-through Design"
