title,company,websites,description
Polycade Sente: The Modular Arcade System,Tyler,"http://www.polycade.com/, https://twitter.com/thepolycade, https://www.instagram.com/polycade/",A high quality arcade console enabling you to relive retro classics and dive into modern titles. Arcade gaming for the modern age.
DIVEROID| Turn your smartphone into an All-in-one Dive gear,DIVEROID,https://diveroid.com/,"Turn your smartphone into an affordable all-in-one Dive computer, Underwater camera, and Photo-synced log book with Diveroid."
M-Cube | Modular Laser Measure that Evolve with Your Demand,HOZO Design. Co.,https://hozodesign.com/,"4 Modules Build to Adapt | 328ft 100m Fast Laser| Up to 17 Functions, Smart Planner, Bilateral Laser, Rolling Ruler and much more"
LumiCard | Lighting Revolution from Your Wallet.,Blind Spot Gear,http://www.blindspotgear.com/,"The future of mobile lighting with LumiCard! Wallet-sized and wirelessly powered, say hello to stunning visuals anytime, anywhere."
01 PUMP: Ultimate 5-in-1 Outdoor Air Pump & Camping Lantern,01 PUMP,https://www.crazydonkey.co/pages/01pump,Pocket Size | Ultra-light | Air Pump | Vacuum Pump | Camping Lantern | 4.5kPa Pressure | IP44 Waterproof｜Power Bank | SOS Light
YUBWVO ScreenUp: Dual Monitor For Flexibility On The Go,YUBWVO,https://www.yubwvo.com/,"Laptop Screen Extender | Dual Monitor Flexibility and Portability | 14 & 15.6"" screens | Max. 2K QHD | Stacked Display | 235° Rotation"
Light Up Your Words with 'The Box',LinkedSparx,https://www.linkedsparx.com/,"Where Innovation, Flexibility, and 3D Artistry Meet"
Powster NEO One Smart Ski Goggles,powsterstudios,https://powsterstudios.com/,Integrated Bluetooth Headphones & Intercom | Fog & Frost Proof Lenses | UV 400 Protection | 6-Hour Battery Autonomy
"Vitaloop: Get pure water from any lake, river, pond or sink",Vitaloop,https://vita-loop.com/,Automatic | One-touch | 5 stage filtration | Versatile | Durable | 13 Gallons (50 L) of water per charge | Great Taste
PlantMate | Water Your Plants Automatically,PlantMate,https://www.plantup.io/,"Plant Mate gives you peace of mind when you travel. Engineered to deliver precise water, tailored to your plants' needs."
iMicro Q3 - A Fingertip Microscope toward the Optical Limit,QingYing E&T LLC,http://www.mobile-scope.com/,"Super 700nm resolution, 1200x magnification, 1/2 inch 1/60 oz, explore the microworld with any smartphone at an affordable cost."
The KikPik,Keith McGregor,https://www.thealpinelab.com/,"Remove ice, snow and debris buildup from your bindings with the ultralight KikPik for alpine touring and backcountry skiers."
OMOOSPACE -Versatile Phone Mount | Wallet | Kickstand | Grip,OMOOSPACE,https://www.omoospace.com/,Unlock the full potential of your phone with a versatile solution that perfectly answers your everyday carry needs
fufuly | A cushion that breathes with you,Yukai Engineering,"http://www.ux-xu.com/?language=en, http://qoobo.info/, https://twitter.com/Qooborobot, https://www.facebook.com/Qooborobot/",robotic cushion with deep breathing technology
[OPTI] Kino: Limited Edition Psychedelic Light Projector,Rob Stitcher,https://www.optikinetics.co.uk/,Introducing our 70's inspired retro LED projector. Chill out with friends with this iconic limited edition psychedelic mood enhancer
Shargeek 170: Coolest Powerbank with Unparalleled Charging.,STORM 2,https://www.shargeek.com/,"Transparent Prism Silhouette | 3-device Fast Charging | 170W Max Output | 140W Max Input | 24,000mAh | Smart Display | Water Resistance"
HiDock H1: ChatGPT-Powered Audio Dock with AI Summary,HiDock,https://www.hidock.com/,Transcription & AI Summary | Noise-free Con-call | Phone-call Recording | 11-in-1 Docking Station
Davcarve L1|Multi-Module Laser Engraver&DIY Center,BEAVERLAB TECH,https://www.beaverlabtech.com/,Wide Application | Replace in 1-Second | Easy-to-Use | 2000 cm² Large Working Space | Cost-Effective｜
NITECORE Forged Carbon Fiber Wireless Power Bank,Theodore,"https://nitecore.com/, https://www.facebook.com/NitecoreCrowdfunding, https://www.instagram.com/nitecore_crowdfunding, https://www.youtube.com/channel/UC2ze76sbqabrEgs1q3WSMmQ",Magsafe | EDC | NITECORE | NW5000 Portable Magnetic Wireless Power Bank: Crafted in Forged Carbon Fiber with an Exquisite Appearance
TAU 2 - A new kind of power bank.,Rolling Square,https://rollingsquare.com/,Emergency keyring power bank | Smaller than AirPods Pro | Universally compatible | 2000mAh | Magnetic Charging Dock | NFC Business Card
"TileRec 2.0 World's Slimmest Voice Recorder, Now Even Better",ATTO DIGITAL,https://www.atto-digital.com/,"The Practical, Tiny, and Subtle Mini Voice Recorder with 64GB of Storage, Designed to Store More Than 1100 Hours of Audio Conversations"
INIU PowerNova: Portable Airline-Approved 140W Power Bank,Ruby Chen,https://iniushop.com/,"140W Fast Charging| 27,000mAh| Support PD 3.1| 1 USB-A & 2 USB-C Outputs| Real-Time Smart Display| 3-Year Warranty"
"Glowstone: Ultra-Powerful, Versatile, Compact Flashlight",Glowstone Limited,http://www.glowstone.tech/,The incredibly bright rubber block of light that attaches to anything and lights up everything. 2000 lumens + 10.5Ah + IP69K
LOOP GEAR: Ultra Compact 360° Illuminating EDC Flashlight,LOOP GEAR,https://loop-universe.com/,Super Compact/1000 LUMENS / 360° Illumination /Side Lights/Rechargeable 14500 Battery/ AA Compatible /2-Year Battery Life/IP65
Moksha: A Smart Meditation Tool For Instant Calm,Moksha,https://mokshabreathing.com/,"Moksha makes meditating fun and easy. Use your breath to play games, earn rewards, and experience the future of stress relief."
"ULTIMEA Thor T60 Triple Laser TV:Born Bright,Beyond Daylight",ULTIMEA,"https://www.ultimea.com/, https://www.facebook.com/UltimeaOfficial, https://www.instagram.com/ultimea_official/",4000 ANSI Lumens | 4000:1 Contrast Ratio | 120% BT.2020 HCTC™️ Technology | Dolby Vision | 4K UHD | Dolby Atmos & DTS HD
bywal design future wallet,Bywal Design,https://www.bywal.com/,"bywal design future wallet One-handed operation，Automatic ladder arrangement of cards, your last wallet。"
Relm - A Smarter Way to Scent Your Home,Relm,https://relm.house/,The World's First Smart Scented Wax Warmer. Smart home connectivity | No-spill Wax Removal | Custom Scheduling | Adjustable Mood Lights
Artin-X Harmoni Bluetooth Speaker,Artin-X,https://harmoni.artin-x.com/,Bluetooth 5.1 Chip｜Portable & Lightweight｜High-quality Audio｜Non-slip Base｜72 Manual Processes｜Use in Multi-scene
"MuteKit - Never Hear ""You're On Mute""!",Mike Vitiello,"https://www.onairwarning.com/, https://www.mutekit.com/","3-ways to instantly mute or unmute your mic, cam & both together. Prevent disruptions, improve productivity & be more secure!"
HyperHedra Infinity Lighting,Dylan Lovinger and Timothy O'Connor,"https://www.facebook.com/hyperspacelighting, https://www.instagram.com/hyperspace_lighting, https://www.youtube.com/channel/UCN3o17A6hlV85XUdqbSEXEw",A chromatic fusion of art and technology
Exoy™ ONE: Lighting's Next Dimension,Exoy,https://exoy.one/,"The future of lighting, AI-powered, immersive, and artistically infinite."
Flora: Innovation Air Purifier,Flora,"http://ecoflora.tech/, https://www.aviche.cn/",Natural materials | Modern design | Integrated air purification system | Ecological moss | Wooden stand | Ceramic tower
BirdWeather PUC - your birdlistening companion,Scribe Labs,"https://runscribe.com/, https://birdweather.com/","BirdWeather unlocks the sounds of nature - at home or on the go - recognizing over 6000 global species, automatically!"
Pawly Door: The Smart Cat Door With Prey Detection,Pawly,"https://www.yourpawly.com/, https://www.instagram.com/yourpawly/, https://www.facebook.com/yourpawly","The Pawly Door detects when your cat tries to bring home prey, keeps intruders outside, and helps you find your missing cat."
Quanvizo ExtendPro: New Era Modular 4-Screen Laptop Monitor,Quanvizo,https://www.quanvizo.com/,"Ultimate Flexibility | Modular By Design | Streamlined Efficiency | Plug, Play, Move | Stability Without Magnets | Pocket-Friendly"
MAKA | All-in-1 Pro Laser Measure,JINHUA MAKA TECHNOLOGY CO.LTD,http://makatechnology.com/,"The most versatile laser measure that integrates 9 materials stud finder, thermal imager, cross laser level and much more"
"NITECORE MT2A PRO, EDC Pocket Flashlight by 2AA Batteries",Sysmax,"https://www.youtube.com/channel/UC2ze76sbqabrEgs1q3WSMmQ, https://www.nitecore.com/, https://www.facebook.com/groups/1278398619305106","NITECORE | NITELAB | MT2A PRO | UHI20 LED | EDC | FLASHLIGHT |LIGHTING |DESIGNDESIGN 1000Lm | 255M | 2AA Batteries | IP68 | 5.63"" | 1.5"
MagLight: The 1st MagSafe Smart Camera Light For Your Phone,Moonside,"https://moonside.design/, https://instagram.com/moonside_lighting, https://www.youtube.com/channel/UCTZlVtbKZJHBIpMz43wTTLA/featured","Smartphone Camera RGB light, MagSafe and Qi-compatible, 4000mAh battery power bank, wireless charger, and smart home lighting"
RayCue 128K: Retro Style Multifunctional Dock w/ Display,RayCue,https://www.raycue.com/,Support Apple MST|3*4K@60HZ display|21 ports|Customized screen Display|Time display|Digital album| Bluetooth speaker|Mini Macintosh
Night Vision System 2.0 - Digital RearView Mirror Dashcam,AKEEYO,https://www.akeeyo.com/,"Universal Compatibility: Installable on Mirror & Dashboard | 11"" Full-color Screen | 1/1.8"" Sony Sensor | Long-Range Visibility | BSD"
Vented Sleep Cooling Duvet - no more hot sleepless nights,Jesse Richard Tudwal Coleman,https://www.ventedsleep.com/,"Unlike other cooling duvets or blankets, our bamboo cooling sensation lasts throughout the entire night because of soft mesh vents."
World's Most Powerful 2-in-1 40000mAh Portable Power Bank,AOHi,https://www.iaohi.com/,PD 3.1 140W Input/Output|40000mAh|3 USB-C 1 USB-A|2-in-1 Charging Station & Power Bank|Intelligent Power Distribution
"UPERFECT Delta/Δ , Folding Portable Monitor",UPERFECT,https://www.uperfectmonitor.com/,Folding Monitor Dual Portable Display Bult-in Stand VESA Bring more convenient to work with a stackable dual-screen
MECH ONE: Mecha Styled Travel Portable Mini Magnetic Razor,MECH·ONE,https://mation.top/,Portable|small size|Self-abrasive cutterheads|Built-in mirror|Replaceable magnetic tips|LED power display|12000 RPM|IPX7 waterproof
Orange Dongle - FREE Voice & Text Messaging Anywhere Anytime,Mazi Hosseini,"http://www.arshon.com/, https://ca.linkedin.com/in/arshon, https://www.facebook.com/ArshonTech/, https://www.iotlinks.com/","Secured Off-Grid Communication: Long Range Mesh Coverage, Maximum Privacy"
NaviCam - Multifunction Motorcycle Smart Screen,NaviCam,"https://ks.spedal-store.com/, https://spedal-store.com/",Wireless CarPlay/Android Auto l 1080P 60FPS Dual Cameras l Loop Recording l Tire Pressure Monitoring l Auto Dimming
CopGain H3: The Stream Dock & Hub that Gets More Stuff Done,CopGain,https://signup.copgain.com/,8-in-1 Visual Macro Keyboard Hub | Full-Featured Interface | Customize One-Key Application Triggering | Intuitive Touch Control
SCORKL 2.0 - Electric,David Hallamore,"http://www.scorkl.com/, https://www.instagram.com/scorkl/, https://www.facebook.com/Scorkl/",Breathing underwater is NOW possible at the TOUCH of a button
Motorize Your Existing Wheelbarrow - The eBarrow Kit,Moe Power,https://buy.ebarrowkit.com/,Powerful Electric Motor | Long Lasting Battery | Installs in 4 Minutes | Universal Kit Fits All Wheelbarrows
100W 3-in-1 Retractable & 360° Rotating Fast Charging Cable,mobfree,https://www.imobfree.com/,100W PD Max | Adjustable Lengths | Charge 3 Devices at Once | 360° Rotation|Easy to Store| Stickable
ELO Vagabond | Turn Your Smartphone Into A Gaming Console,ELO,"https://eloesports.com/, https://www.linkedin.com/in/king-hepburn/, https://www.instagram.com/elogamingesports/, https://twitter.com/ELO_EsportsG",The Elite Mobile Gaming Controller for IOS & Android | Cloud Gaming | Remote Gaming | Play Console Games On Your Phone
DS1 Nixie Tube Clock: your geeky Christmas present,Vadim Antonov,"https://us.past-indicator.com/, https://twitter.com/past_indicator, https://www.reddit.com/u/PastIndicator/",Only this summer Past Indicator is launching an exclusive product limited to 500 pieces at a special price!
The Cartable: All Purpose Recreational Cart & Table in One,Paul Myrant,http://www.thecartable.com/,"Stows in Your Trunk and Easily Converts Into a Cart, Then Quickly Transforms Into a Table! It's the Best Outdoor Solution Ever Created!"
FitMe: Advanced 3D Body Scanner and AI Trainer,FitMe,https://www.fitmelabs.com/,"Supercharge your fitness! Measure body fat % from your home and get actionable, personalized feedback."
MountPro: Blending MagSafe with Car Mount,Nargiz Jarchiyeva,https://www.prinolab.com/,"Turn your Apple MagSafe Battery Pack into a seamless, sturdy Car Mount."
HOLOFIL-cardboard : Your mobile simulated3D experience buddy,Dr. Mrunal Gawade,"https://www.holofil.com/, https://www.mrunalg.com/, https://www.devgad-photography.com/",HOLOFIL-cardboard offers a mobile based platform to experiment with 3D visualization ecosystem to inspire 3D learning and development.
Tactical Scrunchie™ - EDC Multitool Hair Tie,TactiCouture,"https://chevassus.com/, https://knok.org/, https://kalosagon.com/, https://tacticlip.org/, http://tacticouture.com/",Super Tough Hair Tie w/ Convenient pocket | Fire Resistant Material | Super Comfy & Tough - 11th Successful Kickstarter
Kagami Wireless Earbuds,Zerest Audio,https://zerestaudio.com/,Made by audiophiles for consumers. Kagami Wireless Earbuds—a pocket-sized companion for immersive sound and unmatched comfort.
Open Antikythera Project,S&T Geotronics,"https://stgeotronics.com/, https://openenigma.com/, https://opendsky.com/, https://openantikythera.com/",An Open-Source replica of the legendary device for all. Build your own or reserve your hand-crafted masterpiece today.
DNV-9 Modular Digital Night Vision,Hoplite Industries,https://www.instagram.com/hoplite_industries/,"Modular Helmet mounted digital night vision. Monocular, Binocular, Panoramic"
Dolphin D5 Lite USB-Powered 3D LiDAR with 76m Scanning Range,info01@lidar.jp,"https://lidar.jp/, https://www.facebook.com/Dolphinlidar/","Extreme Long-Range Accuracy | Wide Angle Scanning | Easy to Carry Handheld Scanner | Low Power Consumption, USB Drivable | Eye-Safe"
X-Turbo:The World's First Keyboard Wrist Rest with Dual Fans,X/Layout,"https://www.xlayout.net/, https://www.facebook.com/Xlayout, https://www.tiktok.com/@xlayoutofficial, https://www.instagram.com/xlayoutsupport/",Keeping You Cool and Focused Like a Pro. Dual fans and vents | ±30° rotation | Memory foam + PU leather | Bi-color LEDs
AirGo- Mini Bike Pump,AirGo,https://airgoii.shop/,135g | Up to 100 psi | Presta & Schrader | USB:QC3.0 | 630mAh*2 | 20 min Full Charge
"7functions in 1 unit! ""Iron Multipot""",Sunfield Inc,https://sfsf.jp/,7 functions in 1 unit! More convenient than you can imagine! Iron multi-pot that can be used as both a pot and a frying pan
World's 1st Apple-Certified 6-in-1 MagSafe Charger with GaN,ESR,https://www.esrgear.com/,"Charging Station for iPhone 15 & All Other Apple Devices with Made for MagSafe Fast Charging, CryoBoost Cooling, & 100W GaN Technology"
ReLaunch Solaqua28 - Solar Powered Pool Heater,Ken Barksdale,"http://www.solar4pools.com/, http://www.getsolaqua.com/","Using just the power of the sun, heat your pool between 8-12 degrees within a day and save an average of 1/3 in energy cost per season."
"EvoDuster：A powerful Air Pump,Blower,Air Duster&Hair Dryer",EvoDuster,https://evoduster.shop/,"up to 100,000RPM / 2700mAh Battery / Type-C Fast Charge / 4 Gears of wind speed / 3 nozzles/PC deep cleaning /Car cleaning/Cooling down"
Darwin M2 - The World's First Detachable Digital Microscope,BEAVERLAB TECH,https://www.beaverlabtech.com/,IPS Screen | 1600X Magnification | Capture Photo & Video | Quick Projection | RGB Staining | Dual Light Sources | 1080P CMOS
Moss Air - Refreshen and Hydrate with Nature's Breath,MOSSLAB,"https://www.mosslab.com/, https://www.mosslab-air.com/","Enjoy a moss-filled, purifying oasis at your home 🌱 Natural functionality for a healthier and revitalizing environment."
PIN-Master® 2.0 | The Most Secure & Compact Password Manager,Lennart Qvist,https://www.pin-master.com/,Never worry about being hacked or forgetting a critical code again. A 100% safe and secure offline device in credit card size.
ABLEFIT: Master Your Breath and Unlock Your Potential,Addable,https://www.ablefit-air.com/,Breath Training | Coaching App with Games | Detachable Power Plate | Hands-free Operation | Just 5 Minutes a Day | Increase Performance
PLAUD NOTE: ChatGPT Empowered AI Voice Recorder,iZYREC,"https://plaud.ai/, https://note.plaud.ai/, https://izyrec.com/",One-Press Recording｜Transcription & Summary｜Powered by ChatGPT｜30-Hour Continuous Recording｜64GB Storage｜Snap with MagSafe｜Free App
Skadu M1: Clean & Sterilize Your Home In A Single Pass!,Hyper Lychee,https://www.hyperlychee.com/,INNOVATION ALERT: Vacuum Wet & Dry | Handheld Vacuum Mode | Electrolysis (HOCL) + UV Lamp Sterelization | Self Cleaning & Drying
OpenGym Basketball & Pivot Technology,OpenGym LLC,https://www.opengymtx.com/,"Unless...The backboard itself could rotate,💡🤯"
FlameShip - 3D Electric Steam Fireplace,FlameShip,"https://udtech.co/, https://www.linkedin.com/company/udtech/",Absolute safety. Maximum flame realism. 5 operating modes. Unique design.
MEGAPUFF: Origami Solar Power Bank and Light,Solight Design,"https://solight-design.com/, https://www.goodmorningamerica.com/news/video/entrepreneur-helping-people-ukraine-96259357, https://www.msnbc.com/know-your-value/out-of-office/ukraine-without-power-entrepreneur-taking-lanterns-ukraine-n1302047, https://tamronhallshow.com/videos/inventor-alice-chun-illuminates-our-studio-her-innovative-new-technology/",Power + Light anywhere any time Designed by Architects and Humanitarians. Empowering you!
"allroundo Pro- Convertible, Modular Power Bank for On-the-Go",Vonmahlen International,https://vonmaehlen.com/,It's a bidirectional ecosystem of product that can be integrated in endless configurations to make your on-the-go setup truly personal.
Jelly Star - The World's Smallest Android 13 Smartphone,Unihertz,"http://www.unihertz.com/, https://www.facebook.com/1526680197345277/, https://twitter.com/unihertz, https://www.instagram.com/unihertzjelly, https://www.youtube.com/@unihertzofficial, https://www.linkedin.com/company/unihertz/","The New Star of Unihertz Jelly Series with Transparent Design and LED Light. Still Small, Yet Powerful."
VH-80A : Auto Calibration Dual Laser Distance Meter,Magpie Tech,"https://www.instagram.com/magpietech_us/, https://www.magpiefunding.com/, https://magpietech.us/, https://www.youtube.com/@MagpieTech_official/featured",New Era of Distance Measurement | Highest Accuracy with Auto-Calibration Feature | 9 Times Faster Project Speed | Data Management App
Trailbrush: The Two-Gram Toothbrush,Andrew,https://www.trailbrush.com/,A 2.6-gram toothbrush that connects to your long-handled camp spoon. For Ultralight backpacking camping bikepacking.
SHARGE Disk 丨The ultimate storage solution for EDC device,Sharge Tech,"https://shargeek.com/, https://sharge.com/",Two-bottle-cap size丨Cool down your SSD by 20°C丨Cable-free丨Tool-free assembly丨Sending a 4K movie in <2min
Magmo Pro: Automatic Call Recorder for iPhone,MUNE AMERICA INC,"https://www.magmoglobal.com/, https://www.muneproduct.com/",Record Calls. Clearly. Freely. Automatically with MagSafe
NEWYES Scan Reader Pen 4: a Multifunctional Translator,NEWYES,https://www.newyes.com/,112 languages Translator| Scanner Pen|Speech & Text & Photo Translator |Dyslexia Aid |Built-in Collins Dictionary |Built-in ChatGPT
Zeus-X Go Ultra : Fastest 6-in-1 240W USB 3.2 Keychain Cable,Futurizta Tech,https://www.futurizta.com/,6-in-1 Charge Any Device | 240W PD| USB 3.1 Gen2 | 10Gbp Data Transfer | Apple 30W | 0-100% in 30 minutes| Innovative adapter mechanism
Apple WWDC 2023 Pin Set,Straton Roberts,https://glitchbits.com/,An enamel pin set commemorating Apple's WWDC 2023 conference and iconic hardware. Unofficial gear by a passionate UX designer.
Redkey USB V5 The Ultimate Data Eraser for Your Privacy!,Gareth Owen,http://www.redkeyusb.com/,"All-in-One Data Wipe Tool for PCs, Phones & Tablets. Simple, Secure, Unlimited use. Lifetime Updates."
OENKLEN: Turn Tap Water Into Ozone Mouthwash In Sec At Home,OENKLEN,http://oenklen.com/,100% Natural & Organic|99%Sterilization|Solve Oral Problems |Upgraded Oral Care|Achieve Professional Oral Care at Home
AirCard - Find your wallet. Always.,Rolling Square,https://rollingsquare.com/,Apple Find My worldwide tracking - RFID Blocker - Digital Business Card - 2.2mm thin - 2.5 years battery life
"mi-inta : easy, plug-in home Internet activity monitor",speedtechs.net,https://speedtechs.net/,"With interactive app | Devices, websites visited & activity levels in real time | No tech skills, sign-up or subs needed"
AceCard - World's Thinnest Wallet Tracker,Ace,https://www.acecards.co/,"Track your Wallet, Passport & More. Works with Apple & Android Find My - 1.9mm - 30 Month Battery - 105 dB Ringtone"
Azio Tera 75 | Wireless Keyboard with Various Materials,Azio Corporation,https://www.aziocorp.com/,75% Layout | Interchangeable Materials | Hot-Swappable | Backlit RGB | Wired & Wireless | For Mac & PC
PasswordPocket | Your Personal Data Guardian,Atlancube,https://www.atlancube.com/en-tw,"Offline Password Manager | Military-Grade Encryption | Autofill | Save 1,000 Passwords | Support Multiple Devices | Bluetooth 4.2+"
JordiLight Ultimate Headlamp/Flashlight for Home & Adventure,Robert Haddad,https://www.jordilight.com/,3600 Lumens | Magnetic N35 | Flexible | 256 Color Mode | Rechargeable | Waterproof IP68 | e-Compass | Fall Sensor
Bird Buddy: The Summer of Birds,Bird Buddy,"https://mybirdbuddy.com/, https://www.facebook.com/mybirdbuddy, https://twitter.com/mybirdbuddy, https://www.instagram.com/my.bird.buddy/, https://www.reddit.com/r/bestofbirdbuddy/, https://www.linkedin.com/company/birdbuddy/, https://www.tiktok.com/@mybirdbuddy","A Smart Hummingbird Feeder & Smart Bird Bath that identify and capture stunning, up-close photos and videos of your backyard visitors."
Cable Matters® USB-C® KVM Switch Docking Station,Cable Matters,http://www.cablematters.com/,The Cable Matters® USB-C® KVM Switch Dock is an ideal solution for sharing displays and USB peripheral devices between 2 USB-C devices.
E-Tank: 200W Fast-Charging Power Strip for 7 Devices at once,Davis,https://facebook.com/MFiShStudio,200W PD 3.1 Fast Charging Technology/GaN Tech/3*AC Outlets+4*USB-C Fast Charging Port/7 Devices/ RGB Lights/Touch Switch/ E-sports Life
HiBREW G5 Electric Coffee Grinder with 99.8% Powder Rate,HiBREW,"https://ks.hibrewcoffe.com/, https://www.hibrew.com/",Innovation structure design. Can realize the production of Turkish、Espresso、Mocca、Drip Coffee、Pour Over Coffee.
Upgraded LeMat Magnetic Fixer 2.0 - Modernize your Desk Mat.,VoRis,"https://lemat.io/, https://www.facebook.com/profile.php?id=61550909843465",CHARGING | NFC TAG | TOOLBAR | PERSONALIZATION. Clever desk organizer featuring a magnetic design compatible with any desk pad.
K3 Foldable Touch-Expanding Screen Keyboard,Kwumsy,https://kwumsy.com/,13-INCH Touch-expanding Screen | 10-Point Touch Screen | 1920*720 P 60HZ Resolution Display | Foldable 0-90 degree | 82-Key Detachable
RayBit SC1: All-in-one LIVE Streaming Camera,RayBit,"https://www.raybit.com/, https://www.facebook.com/RaybitCam",Manage 5 Cameras & 3 Platforms|Low Latency Wireless Connection|AI Auto Framing|Intelligent Voice Tracking|External Device Supported
"Permaplug: The charger your roommate can't ""borrow.""",Permaplug,"https://www.instagram.com/permaplug/, https://www.facebook.com/permaplug, https://www.perma-plug.com/","Definition: a charger that locks into place to prevent your housemates, children, and siblings from ""borrowing"" your precious charger."
Cord Mate: Rare-Earth Magnetic Cord Holder and Organizer!,GM Innovations,"https://thecordmate.com/, https://www.instagram.com/cord.mate/","Light weight and holding 80X it’s weight, The Cord Mate shows impressive versatility while being used commercially and residentially."
Bord,Bord,https://www.buybord.com/,The mouse pad that moves with you
IAQ: The First Complete Home Air Quality Monitor,Gideon Rubin,https://www.youriaq.com/,Take control of your indoor air with a no-setup device that monitors for more than 20 common air pollutants.
JuicePi: Ultimate EDC Magnetic Power Bank Wall Charger Combo,iSwift,https://iswift.us/,"10,000mAh power bank charges magnetically when attached to the 30W wall charger | Travel-friendly | Rapid charging | Sleek & portable"
Feel Good Mat: A New Way to Relax & De-Stress,Kristan,https://www.feelgoodpeople.com/,The Immersive Vibration Therapy Mat + App Designed to Deeply Relax Your Mind and Body.
Energy Buddy: EDC All-in-one Compact & Portable Power Bank!,Magica Team,https://www.facebook.com/profile.php?id=100087366761316,Bluetooth Speaker | 5000mAh Power Bank | Phone Stand | Light & Portable | Wide Compatibility
Pick!tUp - A revolution in picking up litter & garbage,Arnaud Huber,"https://umweltfreund.earth/, https://piu.earth/","You're tired of seeing litter strewn around the environment? Join the P!U movement and make a difference! Pick it Up with us, together!"
Checkpad - Add items to your shopping list with one press,MOONTO,https://www.moonto.app/,Wi-Fi & & BLE - Easy Setup - Magnetic System - Open to Automation - Energy-efficient - Free Mobile App
Personal Flight Vehicle: Electric & Folding SkySurfer eVTOL,Hunter Kowald,https://skysurferaircraft.com/,A compact electric flight vehicle which can fold down into your luggage & provide anyone with safe freedom of movement within the sky.
