serial_no;title;status;fund_perc;category;place;last_updated;company;websites;project_link;description
1;WiredMaker - a wire EDM for makers;Ended;207%;Fabrication Tools;Kortrijk, Belgium;February 7, 2025;Closed Loop Makers;[];https://www.kickstarter.com/projects/closedloopmakers/wiredmaker-a-wire-edm-for-makers;Make precise parts out of any metal at your home or workshop.
2;Maslow4.1 - Accessible Large Format CNC Router;Ended;2865%;Fabrication Tools;Seattle, WA;February 6, 2025;Bar Smith;['http://www.maslowcnc.com/'];https://www.kickstarter.com/projects/maslow4/maslow41-accessible-large-format-cnc-router;Bringing your digital projects to life!
3;SineCore CNC Lathe: Professional Grade, Compact Size;Ended;765%;Fabrication Tools;Chicago, IL;February 9, 2025;SineCore CNC;['https://www.sinecorecnc.com/'];https://www.kickstarter.com/projects/sinecorecnc/sinecore-cnc-lathe-professional-grade-compact-size;Engineered for professionals, yet beginner-friendly. The power you want, in the size you need. Let’s open new doors to innovation.
4;CNC Machining: Your Complete Course;Late;active;Fabrication Tools;New York, NY;Oct 8 2024;Teach me CNC;['https://www.teachmecnc.com/'];https://www.kickstarter.com/projects/teachmecnc/cnc-machining-your-complete-training-program;Explore CNC Machining with detailed lessons, real-world projects, and personalized coaching from experienced professionals
5;Bakon210pro-A Portable Thermostatic Soldering Iron for You;Ended;452%;Fabrication Tools;Hong Kong, Hong Kong;January 21, 2025;BAKON;[];https://www.kickstarter.com/projects/1893796574/bakon210pro-a-portable-thermostatic-soldering-iron-for-you;Lightweight Handle/180℃-480℃/Safe and Rapid Heat-up/Temperature Visualization/Temperature Correction Function/Pluggable Heating Element
6;Carvera Air: A Smart and Versatile Desktop CNC;Ended;6939%;Fabrication Tools;Beijing, China;January 22, 2025;Makera;['https://www.makera.com/'];https://www.kickstarter.com/projects/makera-inc/carvera-air;Endless Materials | Quick Tool Changer | Auto Probing and Leveling | 4th Axis | Laser Engraving | All-in-one CAM Software
7;TorkStrap Pro™ Load Safe. Load Smart.;Ended;117%;Fabrication Tools;Santa Clarita, CA;December 24, 2024;Grant;[];https://www.kickstarter.com/projects/torkstrap/torkstrap-protm-load-safe-load-smart;A Spring Loaded Cargo Strap That Always Stays Tight
8;Tabletop Pneumatic Injection Molder - INARI P35;Ended;115%;Fabrication Tools;Nagano, Japan;April 23, 2024;Originalmind;['https://www.originalmind.co.jp/', 'https://www.originalmind.co.jp/company/'];https://www.kickstarter.com/projects/originalmind/tabletop-pneumatic-injection-molder-inari-p35;Craft Your Vision: A Machine That Brings Your Art to Everyone.
9;BLSTRsander: a totally new powertool;Ended;374%;Fabrication Tools;Antwerp, Belgium;August 1, 2024;Koen Meukens;['https://blstrsander.com/'];https://www.kickstarter.com/projects/koenmeukens/blstrsander;The power of a sandblaster in a handheld format that doesn't require a bulky compressor. Sand all surfaces anywhere without effort!
10;SUPCUTTER, The Powerful & Safe Board Cutting Tool;Ended;753%;Fabrication Tools;San Francisco, CA;June 19, 2024;SUPCUTTER;[];https://www.kickstarter.com/projects/1154298676/supcutter-the-powerful-and-safe-board-cutting-tool;Simulate your creativity and bring you a unique DIY journey-for inventive minds of any age!
11;FORMART S：Industrial Grade Vacuum Former Built for Desktops;Ended;2142%;Fabrication Tools;Taipei City, Taiwan;May 27, 2024;FORMART;[];https://www.kickstarter.com/projects/formart/formart-s-industrial-grade-vacuum-former-built-for-desktops;Achieve professional-grade molds with this tiny-footprint vacuum former!
12;xTool Screen Printer-1st Screen Printing Solution with Laser;Ended;3717%;Fabrication Tools;California City, CA;December 23, 2023;xTool;['https://www.xtool.com/'];https://www.kickstarter.com/projects/makeblock/xtool-screen-printer-1st-screen-printing-solution-with-laser;Reinvent Traditional Screen Printing Process with Laser Engraver, with Effortless Steps, Limitless Compatibility and Flawless Quality.
13;CREATOR: 3-Axis Desktop CNC Mill;Ended;733%;Fabrication Tools;New York, NY;December 2, 2024;CREATOR;['https://www.creatorcnc.com/'];https://www.kickstarter.com/projects/creatorcnc/creator-3-axis-desktop-cnc-mill;Experience the freedom to shape toughest metals. Have your creativity meet cutting-edge technology.
14;ChompSaw: A kid-safe power tool for cutting cardboard;Ended;2350%;Fabrication Tools;Philadelphia, PA;December 3, 2024;ChompShop;['https://www.chompshop.com/', 'https://www.instagram.com/itschompshop/', 'https://www.facebook.com/itschompshop', 'https://www.tiktok.com/@itschompshop'];https://www.kickstarter.com/projects/chompshop/inventable-a-kid-safe-power-tool-for-cutting-cardboard;Unleash your creative potential - for inventors of all ages!
15;Red Fox 2 | All-in-One CNC Router to Fabricate like a PRO;Ended;1407%;Fabrication Tools;Valladolid, Spain;December 4, 2024;Nomad Technologies S.L.;['https://nomadtech.es/', 'https://redfox2.nomadtech.es/getyours'];https://www.kickstarter.com/projects/nomadtech/redfox-2-all-in-one-cnc-router;Robust 3-axis milling machine, user-friendly, suitable for many materials, with remote control, and accessories for more possibilities.
16;Maslow4 - Affordable Compact Large Format CNC Router;Ended;418%;Fabrication Tools;Port Townsend, WA;June 27, 2024;Bar Smith;['http://www.maslowcnc.com/'];https://www.kickstarter.com/projects/maslow4/maslow4-affordable-compact-large-format-cnc-router;Compact | 8' x 4' | Open Source | Easy set up | Compatible with all platforms
17;Colfer: Cold Brew Coffee Made Simple;Ended;413%;Fabrication Tools;Hong Kong, Hong Kong;January 12, 2024;Colfer;[];https://www.kickstarter.com/projects/525268091/colfer-cold-brew-coffee-made-simple;Precise Temperature Control | Freezing Point Cooling | Rapid Refrigeration | One-Click Cooling
18;Rownd CNC Lathe - Machining for Everybody;Ended;1818%;Fabrication Tools;Los Angeles, CA;December 24, 2024;Rownd Precision;['https://www.rowndcnc.com/'];https://www.kickstarter.com/projects/rowndprecision/rownd-cnc-lathe-machining-for-everybody;Gamepad Controller | 4'th Axis | Automatic Tool Changer | 800 W Spindle Motor | Laser Engraving | Safe and Clean Machining
19;The Adjustable Mortise Jig and Tenon Fastener System™;Ended;135%;Fabrication Tools;Champaign, IL;August 23, 2024;Philip Miller Furniture;['https://philipmillerfurniture.com/', 'https://howyoucanmakeit.com/', 'https://www.instagram.com/philipmillerfurniture/', 'https://youtube.com/@howyoucanmakeit'];https://www.kickstarter.com/projects/philipmiller/the-adjustable-mortise-jig-and-tenon-fastener-systemtm;A routing jig & fastener system designed for anyone who wants to quickly and accurately create a shallow mortise and tenon joint.
20;ELEGOO PHECDA Laser Engraver & Cutter;Ended;2811%;Fabrication Tools;Shenzhen, China;December 19, 2023;elegoo official;['https://www.elegoo.com/'];https://www.kickstarter.com/projects/elegooofficial/elegoo-phecda-laser-engraver-and-cutter;Quality Products for Less, Creating Savings for All｜1600 cm² Working Area｜Smoke Filtering｜Easy-to-use｜
21;Built-in Storage Bin Multi-function Ratchet Screwdriver;Ended;594%;Fabrication Tools;Hong Kong, Hong Kong;September 27, 2023;GLEDE;[];https://www.kickstarter.com/projects/glede/built-in-storage-bin-multi-function-ratchet-screwdriver;Ratcheting screwdriver / Screwdriver set / Three Ratcheting Settings / Oxidized surface treatment / Decompression function
22;Cubiio X: Portable CNC Robot for Makers;Ended;11851%;Fabrication Tools;Taipei City, Taiwan;December 1, 2023;Muherz;['http://cubiio.muherz.com/'];https://www.kickstarter.com/projects/cubiio/cubiio-x-portable-cnc-robot-for-makers;Big workspace. Big projects. Smart design saves space. Wood, metal, etc. The power to create is in your hands.
23;Creating New Router Bits For The Woodworking Community;Ended;496%;Fabrication Tools;Tempe, AZ;September 28, 2023;Cody Elkins;['https://www.cadencemfgdesign.com/shop'];https://www.kickstarter.com/projects/259014845/creating-new-router-bits-for-the-woodworking-community;Transforming woodworking tradition with custom CNC router bit technology
24;Soundway Foldable Ultrasonic Purifier:Make Things Cleaner;Ended;220%;Fabrication Tools;New York, NY;August 10, 2023;SOUNDWAY;[];https://www.kickstarter.com/projects/2026464046/soundway-foldable-ultrasonic-purifier-make-things-cleaner;120W High power丨 Only takes 10 minutes to clean丨10L Large capacity丨The folding design saves space
25;FUSIFY: Better MPG (up to 13%) | Reverse engine wear in cars;Ended;153%;Fabrication Tools;Warsaw, Poland;July 2, 2023;FUSIFY;['https://fusify.eu/'];https://www.kickstarter.com/projects/fusify/fusify-better-mpg-reverse-wear-more-hp-and-torque;Save money by boosting gas mileage, increasing HP, reversing wear and long-time protecting your car's engine using ceramic n-particles.
26;VacuumSnap - The Ultimate Desktop Vacuum Former;Ended;4849%;Fabrication Tools;Lynn, MA;October 29, 2023;VacuumSnap;[];https://www.kickstarter.com/projects/1606951350/vacuumsnap-the-ultimate-desktop-vacuum-former;Set Your Creativity Free with Effortless Desktop Vacuum-Forming
27;iMAG-E, The customizable animate pixel mug for daily life;Ended;245%;Fabrication Tools;Toronto, Canada;March 24, 2023;iMAG Electronic;[];https://www.kickstarter.com/projects/imagcharging/imag-e-the-customizable-animate-pixel-mug-for-daily-life;iMAG-E is the first-ever portable and interactive mug with animation that is totally customizable.
28;Mi-Cord: The Mighty Composite Cord;Ended;109%;Fabrication Tools;Traverse City, MI;August 5, 2023;Christian Smith;[];https://www.kickstarter.com/projects/mi-cord/mi-cord-the-mighty-composite-cord;World's Strongest Synthetic Fiber + Thermoplastic = A self adhering, strong as steel cord that is UV/waterproof, and GLOWS IN THE DARK
29;The Knife Lounge Case;Ended;560%;Fabrication Tools;Hamburg, Germany;December 7, 2022;Maxi Haensch;['https://altonaer-silberwerkstatt.de/shop/en'];https://www.kickstarter.com/projects/maxihaensch/the-knife-lounge-case;A Knife Case for your grails
30;CNC ONE MAX: Professional CNC Milling made Easy & Affordable;Ended;271%;Fabrication Tools;Munich, Germany;December 26, 2023;CNC ONE;['https://www.instagram.com/cnc.one.machines/', 'https://www.youtube.com/channel/UCGfHftAghHr4u8RDJoMhyXg'];https://www.kickstarter.com/projects/cnc-one/cnc-one-max-professional-cnc-milling-made-easy-and-affordable;MAX Performance, MAX Usability, MAX Work Area, MAX Possibilities. Made in Germany.
31;Raven CNC;Ended;495%;Fabrication Tools;Houston, TX;June 24, 2024;CarveWright;['https://www.carvewright.com/'];https://www.kickstarter.com/projects/carvewright/raven-cnc;A unique feed-through CNC machine for large-scale creations with a small desktop footprint.
32;Spider M1: Laser Engraver & Cutter with Infinite Work Area;Ended;4105%;Fabrication Tools;Kowloon, Hong Kong;September 3, 2024;Tyvok;[];https://www.kickstarter.com/projects/1295051943/a-portable-laser-engraver-and-cutter-with-infinite-work-area;Portable & compact, redefines laser engraving & cutting with infinite possibilities.
33;ACTU - NewLaser 10W High Power Portable Laser Engraver;Ended;508%;Fabrication Tools;Hong Kong, Hong Kong;July 9, 2022;ACTU;[];https://www.kickstarter.com/projects/actu-newlaser/actu-newlaser-10w-high-power-potable-laser-engraver;Advanced 10w power laser provides higher speed and precision
34;Optic - The Portable Laser Cutter;Ended;1476%;Fabrication Tools;Blacksburg, VA;February 1, 2025;Rendyr;['https://www.rendyr.com/'];https://www.kickstarter.com/projects/rendyr/optic-the-portable-laser-cutter;Folding Design | Infinite Work Area | Works with Hundreds of Materials | Industrial Precision & Accuracy | Internal Fume Filtration
35;TRONZADORA CNC;Ended;144%;Fabrication Tools;Alcoy, Spain;February 15, 2022;Joan Sánchez;[];https://www.kickstarter.com/projects/tfgcortadora/tronzadora-cnc;Proyecto final de grado superior, cortadora por control numérico para corte de perfil de aluminio o PVC de forma automatizada.
36;Square Stand;Ended;108%;Fabrication Tools;Philadelphia, PA;March 21, 2022;Ryan Matthews;['https://www.facebook.com/Square-Stand-102558428782703', 'https://framingsquarestand.com/'];https://www.kickstarter.com/projects/squarestand/square-stand-0;"Woodworker , DYI person, or a wood workers ""third-hand"""
37;Injection machine Make plastic parts cheaper, easier, faster;Ended;2721%;Fabrication Tools;Mexico City, Mexico;September 8, 2022;Alejandro esquivel;['https://industriasael.mx/'];https://www.kickstarter.com/projects/industriasael/injection-machine-make-plastic-parts-cheaper-easier-faster;Manual injection machine - Make plastic parts cheaper, easier, faster with better quality than a 3D printer and eco-friendly.
38;Carvera: A Fully Automatic Desktop CNC;Ended;1704%;Fabrication Tools;Beijing, China;May 4, 2023;Makera;['https://www.makera.com/'];https://www.kickstarter.com/projects/makera-inc/carvera;The first desktop CNC that's as easy as 3D printing w/ smart features as ATC, Auto Probe, Vacuum system, laser engraver and much more.
39;OKU Desk - Powerful Laser Cutter and Engraver;Ended;525%;Fabrication Tools;Madrid, Spain;September 19, 2023;Nomad Technologies S.L.;['https://nomadtech.es/', 'https://redfox2.nomadtech.es/getyours'];https://www.kickstarter.com/projects/nomadtech/oku-desk-powerful-laser-cutter-and-engraver;A laser tool to transform any tabletop into your most versatile workshop
40;Powerful 10W Dual-Laser Cutter & Engraver W/ Autofocus;Ended;4183%;Fabrication Tools;Hong Kong, Hong Kong;July 18, 2023;Wainlux Laser;[];https://www.kickstarter.com/projects/wainlux-laser-tech/most-powerful-10w-dual-laser-cutter-and-engraver-w-autofocus;Wainlux L3 Laser Downsized Industrial Power At Your Tabletop. Versatile DIY Tool For Creative Hobbyists, Artists, And Small Businesses
41;Comgrow ROBO - The Laser Engraver CNC for Everyone;Ended;1192%;Fabrication Tools;Hong Kong, Hong Kong;October 30, 2024;Comgrow;['https://www.comgrow.com/', 'https://www.facebook.com/Comgrow/', 'https://www.youtube.com/channel/UCXGov5MdDdH6zCv2yLM9LIw', 'https://www.instagram.com/comgrowofficial/?hl=en', 'https://twitter.com/Comgrow3D'];https://www.kickstarter.com/projects/comgrow-robo-cnc/comgrow-robo-cnc;An compact,  beginner-friendly and affordable desktop Laser Engraver & CNC
42;The WoodAnchor™ System;Ended;165%;Fabrication Tools;Galena, OH;August 14, 2021;ToolQuest LLC;['https://toolquest.net/'];https://www.kickstarter.com/projects/toolquest/the-woodanchortm-system;Heavy-duty, adjustable fixturing for woodworkers
43;Evo - The Evolving CNC Milling Machine;Ended;773%;Fabrication Tools;Brussels, Belgium;September 27, 2021;Mekanika;['https://www.mekanika.io/'];https://www.kickstarter.com/projects/mekanika/evo-the-evolving-cnc-milling-machine;A unique CNC milling machine that can follow you as you grow.
44;The Multi-Trowel: The world’s only radius adjustable trowel.;Ended;566%;Fabrication Tools;Ottawa, Canada;April 6, 2021;Alex Cloutier;['https://www.innovatools.ca/'];https://www.kickstarter.com/projects/innovatoolsinc/multi-trowel-the-worlds-most-versatile-trowel;Any surface, any shape, any material, the Multi-Trowel will save you time and money by creating consistent shapes, every single time.
45;"""Swiss-Army"" 1-2-3 Block: The Multi-Purpose Machining Tool!";Ended;206%;Fabrication Tools;Tacoma, WA;February 7, 2022;DIY Project Kits;['https://www.diyprojectkits.com/'];https://www.kickstarter.com/projects/diyprojectkits/limited-edition-swiss-army-1-2-3-block-1-of-100;LIMITED EDITION (1 of 100). Precision multi-purpose Machinist/Metalworking tool.
46;Automatic Wire Measurer & Cutter - Pays for itself in 3 days;Ended;101%;Fabrication Tools;Quebec, Canada;February 3, 2021;Martin Cote;['https://www.facebook.com/mhpro.net/', 'https://mhpro.net/', 'https://shop.mhpro.net/', 'http://www.youtube.com/c/mhpronet'];https://www.kickstarter.com/projects/mhpro/automatic-wire-measurer-and-cutter-pays-for-itself-in-3-days;Automates the task of measuring and cutting wire  →  Quick – Accurate - Efficient
47;Nano: spot welding just got easy and affordable;Ended;670%;Fabrication Tools;Ottawa, Canada;March 15, 2022;RePowered Batteries;['https://www.repoweredbatteries.ca/', 'https://www.battery.market/'];https://www.kickstarter.com/projects/repowered/nano-spot-welding-just-got-easy-and-affordable;Cordless, 18650 powered, fuse wire welder, active cooling, hacker friendly, and more! Check out our video https://youtu.be/xMgPlQ8VaUY
48;CNC ONE: Easy, Powerful & Fast Milling;Ended;532%;Fabrication Tools;Munich, Germany;October 7, 2022;CNC ONE;['https://www.instagram.com/cnc.one.machines/', 'https://www.youtube.com/channel/UCGfHftAghHr4u8RDJoMhyXg'];https://www.kickstarter.com/projects/cnc-one/cnc-one-kickstarters-easiest-and-most-powerful-cnc-ever;Bring Your Ideas To Life With CNC ONE - mill metal, wood and other materials
49;1/4 Series Clamp | Impact-Rated. Modular. Single-Handed.;Ended;341%;Fabrication Tools;Milford, CT;February 2, 2021;Dimide Clamps;['https://dimide.com/pages/1-4-series-clamp-coming-soon'];https://www.kickstarter.com/projects/dimideclamps/dimide-1-4-series-clamp-impact-compability-and-modular-clamp;Clamp 10X Faster while effortlessly delivering 1,700 lbs of clamp force on any job with the new DIMIDE 1/4 Series Clamp!
50;Cubiio 2: Laser Cutter & Metal Engraver with Autofocus;Ended;7417%;Fabrication Tools;Taipei City, Taiwan;April 2, 2023;Muherz;['http://cubiio.muherz.com/'];https://www.kickstarter.com/projects/cubiio/cubiio-2-laser-cutter-and-metal-engraver-with-autofocus;Compact and Versatile. Make Your Creativity a Reality.
51;Arno goes CNC: A milling machine for the ages;Ended;108%;Fabrication Tools;Marstal, Denmark;December 18, 2021;Motorfabrikken Marstal;['https://www.motorfabrikkenmarstal.com/'];https://www.kickstarter.com/projects/motorfabrikken/arno-goes-cnc-a-milling-machine-for-the-ages;Help rebuild an ARNO milling machine  from the 1950's to CNC-control / Hjælp med at ombygge en ARNOfræser fra 1950'erne til CNC-styring
52;The WangerFlange: A new way to build.;Ended;168%;Fabrication Tools;Cumbria, UK;February 10, 2020;Paul Robinson;['https://wangerflange.com/', 'http://geo-dome.co.uk/'];https://www.kickstarter.com/projects/wangerflange/the-wangerflange-a-new-way-to-build;A flange for connecting sticks or tube so you can build stuff
53;beamo: Powerful Laser Cutter Made Compact and Simple;Ended;1831%;Fabrication Tools;Taipei City, Taiwan;June 8, 2020;FLUX Technology LLC;['http://flux3dp.com/'];https://www.kickstarter.com/projects/flux-inc/beamo-worlds-smallest-co2-laser-cutter;Bring ideas to life with beamo, the small, simple and affordable laser cutter that gives you the power to make something you'll love.
54;MillRight CNC Mega V Router and Plasma System;Ended;397%;Fabrication Tools;Dawson, GA;March 23, 2020;MillRight CNC;['https://www.millrightcnc.com/'];https://www.kickstarter.com/projects/millrightcnc/millright-cnc-mega-v-router-and-plasma-system;This is the next level of affordable, high performance CNC.  The Mega V comes as a CNC router, plasma table, or hybrid.
55;Scalpel Jones 2 Redux. A Titanium Scalpel, Made in the USA.;Ended;725%;Fabrication Tools;Hopatcong, NJ;April 21, 2020;Jackson Knife and Tool;['https://www.instagram.com/jacksonknifeandtool/'];https://www.kickstarter.com/projects/2122739158/scalpel-jones-2-redux-a-titanium-scalpel-made-in-the-usa;An updated version of my Scalpel Jones design with a textured grip, also available in the classic untextured version.
56;LongMill Benchtop CNC Router;Ended;727%;Fabrication Tools;Kitchener, Canada;December 18, 2019;Sienci Labs;['http://www.sienci.com/', 'https://twitter.com/SienciLabs', 'https://www.facebook.com/siencilabs/'];https://www.kickstarter.com/projects/sienci/longmill-benchtop-cnc-router;The LongMill brings the power of CNC milling to the maker, hobbyist, woodworker, and craftsman
57;Solderdoodle Plus | Cordless USB Rechargeable Hot Multi Tool;Ended;262%;Fabrication Tools;Portland, OR;March 21, 2022;Isaac Porras;['http://www.solarcyclepower.com/', 'http://www.solderdoodle.com/'];https://www.kickstarter.com/projects/249225636/solderdoodle-plus-cordless-usb-rechargeable-hot-mu-0;Replace your corded soldering iron! Soldering, 3D print finishing, cutting, and wood burning attachments included!
58;Automate anything with 'Super Gerbil' CNC Gcode Controller;Ended;102%;Fabrication Tools;Sydney, AU;April 10, 2019;Paul de Groot;['http://awesome.tech/', 'http://makerfaire.com/maker/entry/59915/', 'http://hackaday.com/2017/06/10/drop-in-controller-for-ebay-k40-laser-engraver-gets-results/', 'https://diyodemag.com/features/precision_laser_controller_upgrade', 'https://au.pinterest.com/pauljacobdegroo/laser/', 'https://www.facebook.com/paul.degroot.7165', 'https://www.linkedin.com/in/pauldegroot/'];https://www.kickstarter.com/projects/2118335444/automate-anything-with-super-gerbil-cnc-gcode-cont;The Super Gerbil CNC controller allows smooth and precise control of your laser, lathe, CNC mill, plasma cutter, water jet, etc.
59;Affordable desktop injection moulding machine!;Ended;113%;Fabrication Tools;Norwich, UK;January 10, 2019;Samuel Thompson;[];https://www.kickstarter.com/projects/1548435736/affordable-desktop-injection-moulding-machine;Following the success of our pilot model and feedback, this is the prototype of our new & improved desktop injection moulding machine!
60;Beambox, The Accessible Laser Cutter And Engraver;Ended;1139%;Fabrication Tools;Taipei City, Taiwan;February 13, 2019;FLUX Technology LLC;['http://flux3dp.com/'];https://www.kickstarter.com/projects/flux-inc/beambox-the-accessible-laser-cutter-and-engraver;Beambox shapes materials including wood, leather, acrylic, and more. It is the tool you’ve been waiting for to free your inner artist.
61;The First Handheld Sound Camera for Everyone;Ended;555%;Fabrication Tools;Gutersloh, Germany;February 19, 2019;SOUNDCAM;['https://www.cae-systems.de/en/', 'https://twitter.com/Acoustic_Camera', 'https://www.facebook.com/AkustischeKamera/'];https://www.kickstarter.com/projects/351002836/the-first-handheld-sound-camera-for-everyone;Experience seeing sound. This camera images sound sources - it's like having six senses. Experience what it can do for you!
62;SwissMak - The Mill Turn Center for your machine shop;Ended;157%;Fabrication Tools;Fort Collins, CO;September 24, 2019;Overlord Robotics Corporation;['https://www.facebook.com/OverlordRobotics/', 'https://www.youtube.com/channel/UC5v-vgAub4M3Ksw1k0oAfQQ/featured?view_as=subscriber'];https://www.kickstarter.com/projects/1260359869/swissmak-the-mill-turn-center-for-your-machine-sho;A modular, heavy duty Swiss mill-turn machining center for cutting metal. The ultimate prototyping machine.
63;Bow-Shackle Pen + Fisher Space Cartridge;Ended;6277%;Fabrication Tools;Boston, MA;January 28, 2021;Oceanus Brass;['https://www.instagram.com/oceanus_brass/', 'https://twitter.com/oceanus_brass', 'http://www.oceanusbrass.com/'];https://www.kickstarter.com/projects/oceanusbrass/bow-shackle-pen-fisher-space-cartridge;Nautically inspired, built to last.
64;CryptoHex - Backup your Cryptocurrency;Ended;238%;Fabrication Tools;Copenhagen, Denmark;January 24, 2019;Nicolas, Dane and Kåre;['http://www.northernlayers.com/', 'https://cryptoship.dk/', 'http://www.prytoc.com/'];https://www.kickstarter.com/projects/northernlayers/cryptohex-backup-your-cryptocurrency;CryptoHex, a stainless steel rod as an “external backup” for LEDGER and TREZOR, or any other BIP39 HD wallet that stores Crypto
65;Desktop CNC FoamCutter XY4040;Ended;3604%;Fabrication Tools;Nuneaton, UK;September 18, 2018;Artur;[];https://www.kickstarter.com/projects/designandbuildcnc/desktop-cnc-foamcutter-xy4040;"Cut out your designs from Styrofoam or other Polymer based Foam 
Sponge."
66;Ghost Pepper Desktop CNC;Ended;286%;Fabrication Tools;Keller, TX;January 10, 2018;Robert Adrian;[];https://www.kickstarter.com/projects/464299954/ghost-pepper-desktop-cnc;We are building a true desktop CNC that wont break the bank.  Furniture grade cabinet, pro features, open source!
67;Routakit M: The next level in desktop CNC performance;Ended;179%;Fabrication Tools;West Palm Beach, FL;December 6, 2018;Louis Vissepo;['http://www.routakit.com/', 'http://www.kicktraq.com/projects/lumacco/routakit-m-the-next-level-in-desktop-cnc-performan/'];https://www.kickstarter.com/projects/lumacco/routakit-m-the-next-level-in-desktop-cnc-performan;The Routakit M series is our new lineup of desktop CNC machines offering high levels of cutting power and extreme precision.
68;Geatronic CNC: The Multipurpose Desktop CNC Milling Machine;Ended;246%;Fabrication Tools;Cairo, GA;November 23, 2017;Geartronic Inc.;['https://www.instagram.com/geartronicinc/'];https://www.kickstarter.com/projects/geartronicinc/geatronic-cnc-the-multipurpose-desktop-cnc-milling;The Geartronic CNC turns your ideas into reality by carving 3D objects from materials such as wood, plastic, foam, and PCB.
69;xaVNA - a full featured, low cost two port VNA;Ended;147%;Fabrication Tools;Vancouver, Canada;September 13, 2018;Cary Wang;[];https://www.kickstarter.com/projects/1759352588/xavna-a-full-featured-low-cost-two-port-vna;The xaVNA is portable, easy to use, and allows S parameter export.
70;Phoenix Rising;Ended;121%;Fabrication Tools;Lehigh Valley, PA;November 13, 2017;Philip Danaher;[];https://www.kickstarter.com/projects/880567698/phoenix-rising-2;Custom designed outdoor and indoor field hockey sticks crafted with patent pending process design made in the USA.
