serial_no;title;status;fund_perc;category;place;last_updated;company;websites;project_link;description
1;Pixy Mini Pro: World's Smallest & Lightest 30W 10k Powerbank;Ended;869%;Gadgets;;February 13, 2025;Futurizta Tech;['https://www.futurizta.com/'];https://www.kickstarter.com/projects/futuriztatech/pixy-mini-pro-30w-built-in-type-c-cable-10000mah-powerbank;Smaller than your palm, charges your laptop | Built-in Type-C Cable | 30W PD | 10,000mAh | Dual Output | LED Touch Display
2;M-Light 100 : Mini motion sensor night light | MAKE 100;Ended;1260%;Gadgets;;February 6, 2025;aniFree;[];https://www.kickstarter.com/projects/anifree/m-light-100-mini-motion-sensor-night-light-make-100;A multifunctional rechargeable light miniature activated by motion in the dark, ideal for night bathroom trips, cabinets, etc.
3;Pilet: Opensource, Modular, Portable Mini Computer;Late;active;Gadgets;;Jan 8 2025;soulscircuit;['https://soulscircuit.com/'];https://www.kickstarter.com/projects/soulscircuit/pilet-opensource-modular-portable-mini-computer;Where retro meets modern, powered by Raspberry Pi 5 with 7-hour battery life, Starting at $199
4;Power Mole V2 - Power Outdoor Devices via Indoor Outlets!;Late;active;Gadgets;;Jan 7 2025;Acqua Industries;['https://www.acquaindustries.com/'];https://www.kickstarter.com/projects/acquaindustries/power-mole-v2-power-outdoor-devices-via-indoor-outlets;Capable of delivering 5V Power through windows up to 36mm (1.4 inches) thick! Smaller, longer range, and more power than V1!
5;Xring D13: Air Mouse for All Devices and Scenarios;Late;active;Gadgets;;Jan 7 2025;Xring;[];https://www.kickstarter.com/projects/428836879/air-mouse-for-every-scenario;A Versatile Air Mouse for Seamless Control—Navigate, Create, and Interact Effortlessly Across Devices Anytime, Anywhere
6;4URPC: True Wireless 4K Type-C Transmitter and HDMI Receiver;Late;active;Gadgets;;Jan 6 2025;4URPC;['https://www.4urpc.com/'];https://www.kickstarter.com/projects/1469979441/4urpc-4k-wireless-transmitter-and-4k-receiver-gen-2;Video & Audio Transmit丨4K 30Hz, 1080P 60Hz丨Plug-and-Play丨Remote Transmit丨Built-in 5G-WiFi丨100W PD3.0丨Supports Windows & MacOS & Android
7;Power in Pocket, Life on Track: PowerGo WN01;Late;active;Gadgets;;Jan 2 2025;PowerGo;[];https://www.kickstarter.com/projects/powergo/w01-reliable-and-hassle-free-charging-experience;Reliable and Hassle-Free Charging Experience
8;ENMESI V50: Your Gateway to Immersive Vision;Ended;3163%;Gadgets;;January 29, 2025;ENMESI TECH;['https://www.enmesi.com/'];https://www.kickstarter.com/projects/enmesitech/enmesi-v50-step-into-the-future-of-immersive-reality;210” AR Display | 75g Lightweight | 3000nits Ultra Bright | 0-6D Myopic Adjustment | ANC Audio Experience
9;REACCT Multisensory Laser Target System;Late;active;Gadgets;;Dec 26 2024;Thomas Branyon;[];https://www.kickstarter.com/projects/reacct/reacct-multisensory-laser-target-system;Train your brain and your marksmanship with this multisensory target system.
10;New Air Duster with Super Performance;Late;active;Gadgets;;February 12, 2025;WindElf;[];https://www.kickstarter.com/projects/583290237/windelf-new-air-duster-with-super-performance;125,000 RPM Motor Speed | Three Noozles| 40m/s Wind Speed | Weighing Just 300g | 6,000mAh Battery | Fast Charge
11;The Mic Light;Ended;107%;Gadgets;;February 18, 2025;Brighter Devices;['https://brighterdevices.co.uk/'];https://www.kickstarter.com/projects/1981033384/the-mic-light;A stylish PC peripheral device that lights up automatically when you're in an online meeting to prevent others interrupting you.
12;HubKey Pro: 10-in-1 Hub with Shortcut Keys for Easy Access;Ended;7142%;Gadgets;;February 14, 2025;HubKey;[];https://www.kickstarter.com/projects/66072671/hubkey-10-in-1-dock-with-shortcut-keys-for-easy-access;10-in-1 Hub｜5 Keys & 1 Knob｜100W PD Fast Charging｜8K@30Hz｜Plug and Play｜SD/TF Slots｜RJ45｜Audio｜Supports Windows & MacOS & Steam Deck
13;WAVE: A New Experience of Smart Touchscreen Music;Ended;145%;Gadgets;;February 6, 2025;WAVE;[];https://www.kickstarter.com/projects/817409054/a-new-experience-of-smart-touchscreen-music;MP3 Bluetooth Headphones in One | Noise Reduction| Sound Effect | Record Sports
14;H6 Coffee Maker: Brew Coffee Just the Way You Like;Ended;877%;Gadgets;;January 23, 2025;HiBREW;['https://ks.hibrewcoffe.com/', 'https://www.hibrew.com/'];https://www.kickstarter.com/projects/848154631/h6-coffee-maker-brew-coffee-just-the-way-you-like;Automatic Recognition of 4 Capsule Types | Adjustable Temperature, Pre-brew Time, and Coffee Volume | Hot & Cold Brew | 24-Hour Timer
15;CARLUEX VISION: Wireless CarPlay Aapter with Screen;Ended;1136%;Gadgets;;January 27, 2025;Carluex Team;['https://carluex.store/', 'https://carluex.com/', 'https://www.youtube.com/@CARLUEX', 'https://www.tiktok.com/@carluex_official'];https://www.kickstarter.com/projects/carluexbmwsmartbox/carluex-vision-wireless-carplay-aapter-with-screen;Screen Control | Wireless CarPlay & Android Auto | Watch Netflix, YouTube, Apple TV, etc | HDMI Output | Downloadable Apps
16;DONGYING A3: All-in-1 Projector with a Smart Touchscreen;Ended;7585%;Gadgets;;January 24, 2025;DONGYING;[];https://www.kickstarter.com/projects/823237370/dongying-a3-versatile-projector-with-a-smart-touchscreen;"Integrated 1080P Touchscreen | Android 9.0 System | Auto Flip-over Projecting | 4K Resolution | 3000 ISO Lms | 260° Tilt | 40-450"" Size"
17;SEEPPO: Your Lightweight Solution for Ultimate Back Support;Ended;850%;Gadgets;;January 25, 2025;SEEPPO TECH;['https://www.shipengexo.com/'];https://www.kickstarter.com/projects/473250077/seeppo-your-lightweight-solution-for-ultimate-back-support;Lightweight Lumbar Exoskeleton | Max 300N Assistance | 0.95kg Ultra-Light Design | Adjustable for Comfort | Quick Release Mechanism
18;Protmex Neptune: Your Guardian for Outdoor Adventure;Ended;129%;Gadgets;;February 8, 2025;Protmex;['https://www.protech-instruments.com/'];https://www.kickstarter.com/projects/protmex-neptune/protmex-neptune-your-guardian-for-outdoor-adventure;The All-In-One Outdoor Safety Companion that keeps you informed and safe with real-time data on CO2, CO, UV levels, and more!
19;STIFF/ARM Remote Controlled Home & Hotel Security Device;Ended;104%;Gadgets;;January 28, 2025;Kenneth Finley;['https://www.stiffarmdoorstop.com/'];https://www.kickstarter.com/projects/kenfinley/stiff-arm-remote-controlled-home-and-hotel-security-device;STIFF/ARM provides resistance & early warning, activated inside or outside, easy to install & remove, leaving no holes or scratches.
20;Nikoko 9-in-1 Flashlight: The Most Powerful Adventure Tool;Late;active;Gadgets;;Dec 13 2024;nikoko;[];https://www.kickstarter.com/projects/1715164440/portable-flashlight-with-double-laser-cigarette-lighters;2000 Lumens Tactical Flashlight|2000m Green Laser|300m Red Laser|Cigarette Lighter|5000aMh Power Bank|Magnetic|For EDC, UV Ultraviolet
21;Laser Focus Sprayer｜Precision Painting With Every Spray;Late;active;Gadgets;;Dec 12 2024;XTryFun;[];https://www.kickstarter.com/projects/xtryfun/xtryfun-laser-focus-sprayer;Laser Focus｜Spray evenly｜Quick Easy Swap | Unlimited Imagination | Fully Cordless｜Long Running Time
22;LORZOR Wallet: World's 1st Trackable Minimalist Wallet;Late;active;Gadgets;;Dec 12 2024;LORZOR;['https://www.facebook.com/Lorzorofficial/', 'https://www.instagram.com/lorzor_official/'];https://www.kickstarter.com/projects/lorzor/the-lorzor-trigger-wallet-instant-and-slim;An ultra-slim wallet with NFC, tracking, quick access, and seamless design. Lifetime warranty.
23;Looktech AI Glasses: The Smart Glasses That Truly Know You;Late;active;Gadgets;;Dec 11 2024;Looktech;['https://www.looktech.ai/'];https://www.kickstarter.com/projects/looktech/looktech-smart-ai-glasses-and-hands-free-hd-camera;Personalized AI Assistance | Hands-Free Control | 13MP Camera | 2K Video | Immersive Audio | Privacy-First | 14-Hour Battery | Only 37g
24;Imises S1 Mini Direct-Insert Mobile Phone Microphone;Ended;368%;Gadgets;;February 3, 2025;Jitao Liu;[];https://www.kickstarter.com/projects/liujitao/imises-s1-mini-direct-insert-mobile-phone-microphone;Pocket Sound Ace. Direct-Insert. Digital Audio, AI Noise. Great for Live & Vlog. Plug & Go. Compact, Impactful. Top Mobile Audio Pick.
25;VitaLink: Auto Transform 3-in-1 Fast Wireless Charge Station;Ended;992%;Gadgets;;February 7, 2025;VitaLink;[];https://www.kickstarter.com/projects/vitalink/vitalink-auto-transform-3-in-1-fast-wireless-charger;Smart Electric Rotation, 15W Fast Wireless Charging, All-in-one Concept, Built-in Fan and LED, Qi 2 Compatibility, Pretty Appearance
26;DEFI AI Smart Pill Bottle | Don’t Ever Forget Your Meds;Late;active;Gadgets;;January 16, 2025;donteverforgetit, Inc;['https://donteverforgetit.com/'];https://www.kickstarter.com/projects/1417632119/defi-smart-pillbottle-l-dont-forget-your-medicine;Upgrade your basic pill bottle to an AI-powered smart solution
27;TitanForged: The Unprecedented Mini Multi-Pry Bar;Ended;8520%;Gadgets;;February 1, 2025;MIAOIDEAS;[];https://www.kickstarter.com/projects/390707999/titanforged-the-unprecedented-mini-multi-function-pry-bar;Stunning Titanium Design | Only 7.3cm | 12-in-1 | Pry Bar, Bottle Opener, Bit Driver, Caliper, Eternal Pen...
28;Reference Circuits, Volume 1 and 2;Ended;287%;Gadgets;;January 24, 2025;Ian;['https://www.boltind.com/', 'https://www.iandunnart.com/'];https://www.kickstarter.com/projects/bi-vfd-clock/referance-circuits-volume-1-and-2;Electronics books made from circuit boards with actual circuits on each page.
29;Tankok: The Titanium 10-in-1 Innovative EDC Multi Carabiner;Ended;108%;Gadgets;;January 5, 2025;TANKOK;[];https://www.kickstarter.com/projects/tankok/tankok-titanium-10-in-1-innovative-edc-multi-carabiner;10-in-1 Saw, Slotted, Inner Hex, Keychain Port, Bottle Opener, Compass, Locking, Expand Adapter, Knife, and Ruler
30;The Hard Bar - A Titanium Pry Sheath;Late;active;Gadgets;;Dec 5 2024;Sanctum Brand;['https://www.sanctumbrand.com/'];https://www.kickstarter.com/projects/sanctumbrand/the-hard-bar-a-titanium-pry-sheath;The Hard Bar is a compact titanium pry tool that houses a fixed-blade knife, the first of its kind.
31;SOULCUBE: Bring Your Beloved Pet Back to Life;Late;active;Gadgets;;Dec 2 2024;AIDICOME Inc.;['https://aidicome.com/kr/index.php'];https://www.kickstarter.com/projects/soulcube3d/soulcube-bring-your-beloved-pet-back-to-life;Interactive holographic device that brings the spirit of your beloved pet back to life
32;Kompo - Redefining Food Waste;Late;active;Gadgets;;Dec 2 2024;Ben;['https://get.kompo.online/'];https://www.kickstarter.com/projects/kompo/kompo-redefining-food-waste;Transform the way you dispose of food waste with Kompo. Quick, Sleek, Odor Free.
33;hand://poem Presenter Glove (remote control);Late;active;Gadgets;;Nov 30 2024;Handpoem - Sound of Movement;['https://handpoem.com/'];https://www.kickstarter.com/projects/handpoem/hand-poem-presenter-glove-remote-control;Gesture-Controlled Presentations: * The Presenter Glove allows making presentations more engaging and fluid.
34;Viora: The Dual-Head Fan for Powerful, All-Around Cooling;Ended;412%;Gadgets;;December 29, 2024;Viora Tech;[];https://www.kickstarter.com/projects/1046665921/viora-the-dual-head-fan-for-powerful-all-around-cooling;Dual-Head Fan | 8000mAh Long Battery Life | 360° Airflow | 5 Wind Speeds + Smart Mode | Portable Design | Powerful & Versatile Cooling
35;Wireless Karaoke: Sing Like a Pro, Wherever You Are.;Ended;787%;Gadgets;;December 29, 2024;SonicPlay Tech;[];https://www.kickstarter.com/projects/1604930950/1st-karaoke-speaker-with-scrolling-lyrics-and-rhythm-lights;Instantly Transform Any Space into an Immersive Entertainment Experience.
36;FlexPow: The 3-in-1 Transformable Power Bank for All Devices;Ended;2983%;Gadgets;;February 10, 2025;X-POWER;[];https://www.kickstarter.com/projects/x-power/flexpow-transformable-3-in-1-magsafe-power-bank-for-all-gear;All in OnePower Bank That Twists, Clicks, and Powers Your World. Charge Three Devices While Playing with Precision.
37;GLUMI:World’s First Fill Light Power Bank for Stunning Shot;Ended;176%;Gadgets;;January 16, 2025;GLUMI TECH;[];https://www.kickstarter.com/projects/1966623053/glumi-worlds-first-fill-light-power-bank-for-stunning-shot;10000mAh Power Bank | Magnetic Charging | 3 Light Modes | Stepless Dimming | Phone Stand | Strap & Cable Combo | Portable Design
38;KALOS K1 Pro:3-in-1 CarPlay, Android Auto & Gaming for Tesla;Late;active;Gadgets;;Nov 28 2024;Zjinnova;['https://www.zjinnova.com/'];https://www.kickstarter.com/projects/kalos-k1-pro/kalos-k1-pro-maximize-your-tesla-screens-capabilities;Wireless CarPlay | Android Auto | Mobile Phone Mirroring | Switch & Xbox Compatibility | OTA Upgrades | Tesla Screen Enhancement
39;TagLock 2-in-1 Multi-Functional Preservation Machine;Ended;474%;Gadgets;;February 3, 2025;zhangfeng;[];https://www.kickstarter.com/projects/taglock111/taglock-2-in-1-multi-functional-preservation-machine-0;Multi-functional design: Vacuum sealing, label printing, easy operation Reduce food waste: Keep storage information, maintain freshness
40;Seesmile: Pioneering 0-100 Levels Stepless Water Flosser;Ended;328%;Gadgets;;January 2, 2025;seesmile;[];https://www.kickstarter.com/projects/134337082/seesmile-pioneering-0-100-psi-stepless-water-flosser;A flexible, portable water flosser that delivers optimal oral care solutions anytime, anywhere.
41;Pixeldarts: The Retro-Inspired Electronic Throwing Game;Late;active;Gadgets;;Nov 27 2024;Chessnut;['https://chessnutech.com/'];https://www.kickstarter.com/projects/chessnut/pixeldarts-the-retro-inspired-electronic-throwing-game;Engage in electronic live games | Advanced recognition tech | Retro pixel display | Endless expansion with programmable games/widgets
42;Chargie - Protect Your Laptop's Battery Health;Late;active;Gadgets;;Nov 26 2024;Ovidiu Sandru;['https://chargie.org/'];https://www.kickstarter.com/projects/chargie-laptops/chargie-preserve-your-laptops-battery-health;If you're the type who keeps laptops plugged in all the time, Chargie is for you. It will prolong battery life by many years.
43;Careld: Anti-snore Self-Inflating Air Cushion Smart Pillow;Late;active;Gadgets;;Nov 26 2024;Careld;[];https://www.kickstarter.com/projects/careld/careld-smart-pillow;Reduce Snoring by up to 80% | Open Airways | Self-Inflating Air Cushion | Works Silently | Tracking Sleep Data | Ergonomic Memory Foam
44;Darwin MX Pro: All Microscopy Tasks on One Screen!;Late;active;Gadgets;;February 17, 2025;BEAVERLAB TECH;['https://www.beaverlabtech.com/'];https://www.kickstarter.com/projects/beaverlab/darwin-mx-pro-all-microscopy-tasks-on-one-screen;"Smart Digital Microscope | 2200X Magnification | 2K Microscopic Details | 9"" IPS Screen | Dual-screen | Free App | RGB Optical Staining"
45;TechPumpster: Power Up Your Cycling Journey;Ended;136%;Gadgets;;February 17, 2025;TechPumpster;[];https://www.kickstarter.com/projects/techpumpster/techpumpster-power-up-your-cycling-journey;Digital display/Fast charging/compact high-end design
46;DS Travel Set, Keep Your Essentials Safe with Apple Find My;Late;active;Gadgets;;Nov 26 2024;DISIDUW Team;[];https://www.kickstarter.com/projects/400641044/ds-travel-set-keep-your-essentials-safe-with-apple-find-my;MagSafe Wallet, Passport Cover, Luggage Tag | Apple Find My | 365-Day Battery | Wireless Charging | Recycled Leather｜RFID Blocking
47;Unifloss: 3-Sided Toothbrush, 3X Faster, 99% Cleaner Teeth;Late;active;Gadgets;;Nov 26 2024;Unifloss;['https://www.facebook.com/profile.php?id=61564453780015', 'https://www.unifloss.com/'];https://www.kickstarter.com/projects/unifloss/unifloss-your-all-in-one-oral-care-solution;Triple Action Care - Toothbrush, Water Flosser, and Mouthwash in One.
48;SharkyX - 3-in-1 Magnetic Power Bank - Dual Magnetic Design;Late;active;Gadgets;;Nov 25 2024;SharkyX;[];https://www.kickstarter.com/projects/2112121906/sharkyx-dual-magnetic-power-bank;Dual Magnetic Design / Fast Charging / 10,000mAh / Supports Phones, Earbuds, Watches / 8 Safety Features / Ultra-Strong Magnetic Force
49;Y-IN /Sliding double head multifunctional EDC tool;Late;active;Gadgets;;Nov 25 2024;Y-IN;[];https://www.kickstarter.com/projects/1903462244/y-in-6-in-1-sliding-double-head-multifunctional-edc-tool;EDC/Outdoor Use/Toys/Ti/Versatile/Portable
50;TC3 Tire Inflator-Faster Than Ever, Built to Inflate All;Ended;170%;Gadgets;;January 10, 2025;AstroAI;['https://www.astroai.com/', 'https://www.facebook.com/AstroAI'];https://www.kickstarter.com/projects/astroai/tc3-tire-inflator-faster-than-ever-built-to-inflate-all;6 Smart Modes|Inflates Balls to Heavy-Duty Car Tires|30s Fast Inflation|4000mAh Detachable Battery|Power Bank|Super Bright Flashlight
51;Mebelly: The Ultimate Electronic Belt for Everyday Comfort;Late;active;Gadgets;;Nov 21 2024;Mebelly;[];https://www.kickstarter.com/projects/1903715154/mebelly-smartfit-electronic-belt;One-Click Operation | 1.6mm Precision Control | Smart Adjustment | Customizable Fit Automatic Tension Sensing | 15+ Day Battery
52;Gemini Ultra: The Next-Gen Monitor Light Bar;Late;active;Gadgets;;Nov 21 2024;ELESENCE;[];https://www.kickstarter.com/projects/74139696/elesense-gemini-a-light-revolution-for-your-screen-time;Dual Light Sources | Auto Dimming | Adaptive Color Temperature | CRI ＞97Ra | Flicker-Free | Wireless Control
53;3rd Generation Plinic Upriser: Plasma personal skin care;Ended;725%;Gadgets;;December 3, 2024;Pliniclabs;[];https://www.kickstarter.com/projects/plinicupriser/3rd-generation-plinic-upriser-plasma-personal-skin-care;Patented plasma beauty technology sterilizes, absorbs, and regenerates, targeting skin bacteria to promote healthy skin
54;SonarPen 2: The Most Affordable iPad Pen with Pro Features;Late;active;Gadgets;;Nov 20 2024;GreenBulb;['http://www.greenbulb.com/', 'https://www.instagram.com/greenbulb_com/', 'http://www.sonarpen.com/', 'https://twitter.com/greenbulb_com', 'https://hackaday.io/project/26225-sonarpen-turning-an-earphone-into-a-smart-stylus'];https://www.kickstarter.com/projects/greenbulb/sonarpen-2-most-affordable-pressure-sensitive-pen-for-ipad;Tilt & pressure sensitivity, pointy nib, and pro features – all for the cost of 6 cups of coffee! Works with iPads (2017 & newer).
55;Defanbo: Strong Protective Sweatshirt to Keep You Safe;Ended;526%;Gadgets;;December 24, 2024;Defanbo;[];https://www.kickstarter.com/projects/121495489/defanbo-a-reliable-protective-sweatshirt-to-keep-you-safe;Electric Defense | Anti-flaming Material | Cut Resistant | Anti-odor & Antibacterial | Elbow-Protective Design
56;Starship 240W: The Ultimate Reliable Power On The Go;Ended;4488%;Gadgets;;January 14, 2025;AOHi;['https://www.iaohi.com/'];https://www.kickstarter.com/projects/aohi/starship-240w-the-ultimate-reliable-power-on-the-go;240W Max Output | 27,600mAh | TSA-Approved | 3-device Fast Charging | 140W Max Input | Smart Display | Automotive Grade Battery
57;KAYUSO Quick Defrosting Box:Rapid Restore to Freshest Flavor;Ended;2885%;Gadgets;;December 21, 2024;KAYUSO;[];https://www.kickstarter.com/projects/kayuso/kayuso-quick-defrosting-box-rapid-restore-to-freshest-flavor;Fastest Defrosting | Plasma Locking Freshness | UVC Antibacterial Protection |Eliminate acidity and odor
58;PORTAL: Real-time coffee brew profiler.;Late;active;Gadgets;;Nov 19 2024;Belka;['https://belkacoffee.com/'];https://www.kickstarter.com/projects/belkacoffee/portal-real-time-coffee-brew-profiler;It provides a real-time log of the concentration(EC), temperature, etc. during brewing, and is used as a brew profiler for baristas.
59;ChargeMate 3-in-1: Power Bank Charger With AC Plug & Cables⚡;Ended;683%;Gadgets;;February 3, 2025;VoxyLite;[];https://www.kickstarter.com/projects/voxylite/voxylite-chargemate-3-in-1-pro-powerful-power-bank;⚡ 20000 mAh Powerbank | Built-in AC Plug & Type-C Cable | Fast Charging | Sleek Compact Design | Universal Device Compatibility ✅
60;Ballsy Brew - make an espresso in home like a pro barista;Late;active;Gadgets;;Nov 19 2024;Baluta Marian;[];https://www.kickstarter.com/projects/645842101/ballsy-brew-coffee-pot-with-unique-features;Compact coffee maker that brew under a very high pressure
61;MultiEffectELF Z01:Magnetic Card Bag/Wireless Charging/Stand;Ended;104%;Gadgets;;January 10, 2025;MultiEffectElf;[];https://www.kickstarter.com/projects/846697801/multieffectelf-z01-magnetic-card-bag-wireless-charging-stand;3 in 1 Products/Magnetic Card Bag/Wireless Charging/Stand Functions/Portable/Convenience
62;BLEShark Nano: A Compact Wireless Multi-Tool for Hackers;Ended;2890%;Gadgets;;February 10, 2025;InfiShark Tech;['https://infishark.com/'];https://www.kickstarter.com/projects/infishark/bleshark-nano-a-compact-wireless-multi-tool-for-hackers;A portable device for testing Bluetooth and Wi-Fi vulnerabilities—including games, apps, auto updates, and a buttery-smooth interface.
63;MecArmy RU01 Minimalist Zeroscrew Tech Multifunctional Ruler;Ended;652%;Gadgets;;January 12, 2025;mecarmy;[];https://www.kickstarter.com/projects/mecarmygear/mecarmy-ru01-minimalist-zeroscrew-tech-multi-caliper-ruler;A Handy Tool for Work and Study: Unique design | Ti-6Al-4V Titanium | stationery Ruler | Vernier Caliper | Fidget Toy | EDC Tool
64;Gvidea eGPU HUB: Unleash Your Computer's Potential;Late;active;Gadgets;;Nov 15 2024;Gvidea Hub;[];https://www.kickstarter.com/projects/1251822183/gvidea-egpu-hub-unleash-your-computers-potential;External GPU & Hub - 10GbE Port - 3x 10Gbps USB-A - 2x 40Gbps USB-C or 63Gbps OCuLink - SD/microSD Reader - Supports All Graphics Cards
65;Cyber Breaker: The Ultimate Safety Tool for Every Drive;Ended;2541%;Gadgets;;January 23, 2025;ZEOWING;[];https://www.kickstarter.com/projects/zeowing/cyber-breaker-the-ultimate-safety-tool-for-every-drive;Shatters Double-Layer Glass | One-Strike Break | Tungsten Steel Tip | All Metal | Seatbelt Cutter
66;GD10 Touchscreen Portable SSD – Your Data Security Guardian;Ended;1925%;Gadgets;;January 16, 2025;MOVE SPEED;['https://www.movespeed.com/'];https://www.kickstarter.com/projects/movespeedtech/worlds-first-touchscreen-pssd-with-encryption-and-tracking;"1.83"" TouchScreen｜Encryption/Unlock｜Support Apple Find My｜Status monitoring｜10Gbps｜USB 3.2 Gen2｜1TB/2TB Portable SSD"
67;The Supertiny - the smallest 65W GaN charger, ever.;Late;active;Gadgets;;Nov 12 2024;Rolling Square;['https://rollingsquare.com/'];https://www.kickstarter.com/projects/rollingsquare/smallest-ever-65w-gan-usb-c-charger-super-tiny-fast-power;It's 2024, and you are still carrying around heavy brick chargers, but why? We got you. US, UK and EU compatible.
68;Night Storm X1: See the Night with 1200m of True 4K Vision;Late;active;Gadgets;;Nov 12 2024;DVX Night Vision;[];https://www.kickstarter.com/projects/night-vision/night-storm-x1-see-the-night-with-1200m-of-true-4k-vision;1200m Range | IP67 | True 4K Footage | 52 MP Starvis 2 Night Vision CMOS | 18 Hour Battery | 4 IR Levels | Patented & Award Winning
69;VaccumWave : Transforming Cleaning 5-in-1 Home Wonder;Late;active;Gadgets;;Nov 12 2024;VaccumWaveTeam;[];https://www.kickstarter.com/projects/2127263636/vaccumwave-transforming-cleaning-5-in-1-home-wonder;5-in-1 Vacuum Brushless Power, Washable Filters, & Type-C Charge for Cars, Home, & Outdoors,Window Breaker
70;Kimtow: The Super 400mm Lens For Smartphone;Ended;463%;Gadgets;;December 13, 2024;Martin;[];https://www.kickstarter.com/projects/925436646/kimtow-turn-your-phone-to-optical-telephoto-shooting-tool;400mm Focal Length | 12X Magnification | 11 Elements in 8 Groups | 17mm Threaded | Aluminum Design | ¼ inch Tripod Mount |
71;SPERAS U3: Versatile EDC Flashlight for All Your Light Needs;Ended;740%;Gadgets;;February 11, 2025;SPERAS Flashlight;['https://sperasflashlight.com/'];https://www.kickstarter.com/projects/speraslight/u3-magnetic-edc-flashlight-red-light-uv-laserside-light;Red Light | Green Laser | UV Light | Side Light | Bike Light | Magnetic | Quick Mode Switch & Stress Relief Slider | P68
72;EffiPump: Ultimate Portable Wind Pump for All Your Needs;Late;active;Gadgets;;Nov 12 2024;RoadReady;[];https://www.kickstarter.com/projects/roadreadyt2/effipump-ultimate-portable-wind-pump-for-all-your-needs;180g Lightweight丨100,000rpm Motor Speed丨Overclocking Mode丨Vacuum Cleaner丨USB-C 10W Fast Charge丨120min Usage Time丨Built-in LED Light
73;Hilight WideX Lamp：Illuminate Every Corner of Your Desk;Ended;2145%;Gadgets;;February 18, 2025;HILIGHT;[];https://www.kickstarter.com/projects/hilight/widex-lamp-illuminate-every-corner-of-your-desk;160cm Light Coverage | 3 Light Sources | Ra≥90 | Stepless Light Tempeture Adjustment | 5 Stops Lightness Adjustment | Auto Mode
74;Mstick4: Unlock Your Car Display's Full Potential;Ended;1650%;Gadgets;;January 13, 2025;Mgears;['https://www.m-gears.com/'];https://www.kickstarter.com/projects/137202113/mstick4-turn-your-car-display-into-a-versatile-tablet;Go beyond CarPlay and Android Auto. Waze, Netflix, YouTube, Spotify, and more — Bring all your favorite apps to your car display!
75;Golizard-Powerful Portable Air Duster & Vacuum Fan;Late;active;Gadgets;;Nov 11 2024;GO_Lizard;[];https://www.kickstarter.com/projects/386688327/golizard-mini-jet-fan-with-led-screen;160,000RPM丨 2-in-1 Duster & Vacuum丨Real-time RPM Display丨Palm-sized丨Long Battery丨Multiple Nozzles
76;Wrap Rabbit: Simplifying Cable Chaos for Musicians and DJ's;Ended;183%;Gadgets;;January 3, 2025;Edmund Sugzdinis;['https://www.wraprabbit.com/', 'https://www.hotdammit.com/'];https://www.kickstarter.com/projects/wraprabbit/wrap-rabbit-simplifying-cable-chaos-for-musicians-and-djs;Designed for Musicians and DJs, this tool ends cable chaos, so you spend less time untangling and more time focused on your sound.
