serial_no;title;status;fund_perc;category;place;last_updated;company;websites;project_link;description
152;Flare: An Off-grid Locator with Messaging;Ended;144%;Gadgets;;January 21, 2025;Metrazi;['https://metrazi.com/'];https://www.kickstarter.com/projects/metrazi-flare/flare-an-off-grid-locator-with-messaging;Flare elevates your outdoor experiences with friends in areas without cell-service. Background location sharing and text messaging.
153;DECOKEE—Magnetic M.2 NVMe SSD Enclosure;Ended;1502%;Gadgets;;January 23, 2025;DECOKEE;['https://www.decokee.com/', 'https://www.facebook.com/groups/decokee', 'https://www.instagram.com/decokeeai/', 'https://x.com/DecokeeTech', 'https://discord.com/invite/xdE3PAUwuq'];https://www.kickstarter.com/projects/decokee/decokeemagnetic-m2-nvme-ssd-enclosure;Magnetic Structure Design | LED Lighting | USB 3.2 Gen2 | 1GB File in about 1 Second | M.2 NVMe SSD Up To 2TB
154;SmartBo: The Ultimate AI-Powered Camera for Home Security;Ended;380%;Gadgets;;October 24, 2024;SmartBo Tech;[];https://www.kickstarter.com/projects/1384247101/smartbo-the-ultimate-ai-powered-camera-for-home-security;Real-Time Video Calls| AI Interactions| Touch Control| Multi-Device Support| Smart Alerts| Cloud Storage |Omnidirectional Monitoring
155;Disk Plus: Ultra-slim Data Solution for Your Daily Tech;Ended;10194%;Gadgets;;February 3, 2025;Sharge Tech;['https://shargeek.com/', 'https://sharge.com/'];https://www.kickstarter.com/projects/shargetech/disk-plus;"World's Thinnest 0.24""｜10Gbps｜Max 4TB｜Data & Charging at Once｜Snap with MagSafe｜Streamlined Cable Management"
156;E-Paper Calendar and Smart Display;Ended;289%;Gadgets;;January 24, 2025;Konstantin;['https://www.invisible-computers.com/'];https://www.kickstarter.com/projects/invisible-computers/e-paper-calendar-and-smart-display;A 10-inch digital paper display for your calendars and other apps.
157;ChargeUltra: Newly upgraded truly 5-in-1 wireless charger;Ended;2507%;Gadgets;;November 30, 2024;ChargeUltra;[];https://www.kickstarter.com/projects/1062523922/chargeultra-newly-upgraded-truly-5-in-1-wireless-charger;Wireless Charger | Simultaneously Charge 5 Devices | USB C & Lightning | Support 65W Input | MagSafe & Qi Compatible | Fast Charging
158;AllGearPro: 7-in-1 Outdoor Gear for Total Protection;Ended;1176%;Gadgets;;October 9, 2024;AllGearPro;[];https://www.kickstarter.com/projects/49698192/allgearpro-7-in-1-outdoor-gear-for-total-protection;30,000 mAh Power Bank | Anti-mosquito Protection | Four Lighting Options | 3-Level Speed Fan | Bluetooth Speaker | Weights Only 2400g
159;ANTPO-500w Ultimate Portable Power Station;Late;active;Gadgets;;Aug 21 2024;DockVista;[];https://www.kickstarter.com/projects/1067986246/antpo-500w-ultimate-portable-power-station;500Wh capacity/retro oil barrel design/500W power/energy storage power supply/portable/4kg/solar charging port
160;Qubii Power: 2-in-1 Auto-Backup & Charge, 10 Years Warranty!;Ended;1778%;Gadgets;;December 6, 2024;Maktar Inc.;['http://www.maktar.com/', 'http://www.piconizer.com/'];https://www.kickstarter.com/projects/maktar/qubii-power-one-step-auto-backup-and-charge-10-year-warranty;One-step backup & charge simultaneously without Internet. Zero effort, never forget again! Foolproof, convenient & compact for travel!
161;QicoBay P1: Redefine Flossing with Elegance and Innovation;Ended;916%;Gadgets;;February 13, 2025;QicoBay;['https://qicobay.com/'];https://www.kickstarter.com/projects/qicobay/qicobay-p1;Ultra-Modern Flosser: World's 1st Auto-Restringing, Steel Body, Ergo-Design, Stylish Portability, UV Sanitizer, Zero Waste, and More
162;LifeGoc Mini compact multi-tool;Ended;290%;Gadgets;;October 31, 2024;LifeGoc;[];https://www.kickstarter.com/projects/1683265947/lifegoc-mini-wrench-compact-multitool;2 in 1 Screwdriver & Rotary Tool | Magnetize | LED light | Multi-functional | 3-Speed Adjustments | DIY
163;Hopper: The Footrest That Promotes Healthy & Active Sitting;Ended;176%;Gadgets;;January 25, 2025;Wes Furuta;['https://www.hopperfootrest.com/'];https://www.kickstarter.com/projects/hopperfootrest/hopper-the-footrest-for-the-fidgety;Support better posture, reduce stress, and burn calories with every move. Hopper keeps you comfortable & active while you work or relax
164;NextBlower KING: Ultra Large Powerful Airblower for Everyone;Ended;329%;Gadgets;;December 12, 2024;NextBlower;[];https://www.kickstarter.com/projects/nextblower/nextblower-king-ultra-large-powerful-airblower-for-everyone;Crazy Wind of 1500g Wind Pressure / Only 1.1kg / Thor's Hammer Design / 4000mAh×8 Lithium Battery / Up to 30 minutes
165;Hippo 65: New Budget King Redefines Your Top Keyboard Choice;Ended;315%;Gadgets;;December 2, 2024;Hippokey;[];https://www.kickstarter.com/projects/hippokey/hippokey-hippo65-compact-programmable-mechanical-keyboard;65% Layout| Full Aluminum| Gasket Mount| Custom Huano Switches| QMK/VIA| Tri-Mode| Hot-Swappable| RGB Backlight| 6000mAh Battery
166;Mechtron:4 Types of Cyberpunk Series Electric Screwdrivers;Ended;832%;Gadgets;;January 13, 2025;Mechtron;[];https://www.kickstarter.com/projects/2000949694/mechtron-4-types-of-cyberpunk-series-electric-screwdrivers;Inspired by sci-fi affection,we crafted electric screwdrivers,infusing daily life with futurism,bringing the sci-fi world into reality
167;Portable SSD Magbox: Your Ultimate Mobile Storage Solution;Ended;3928%;Gadgets;;November 29, 2024;COWZRY;['https://www.facebook.com/profile.php?id=100091825238692', 'https://www.facebook.com/groups/943361597804490'];https://www.kickstarter.com/projects/828791693/cowzry-magbox-gen2-your-ultimate-mobile-storage-solution;Wide Compatibility with Type-C Device| 2TB M.2 NVMe SSD | Magnetic Design | Support Apple ProRes 4K·60 | 10Gbps Transfer | Compact
168;Effortless Freshness: One-Click Vacuum-Sealed Mason Jars;Ended;1438%;Gadgets;;December 31, 2024;Creative;[];https://www.kickstarter.com/projects/fujiangtarot/one-touch-vacuuma-reusable-electric-mason-jar-sealer;Reusable | Auto Seal | Keep Food Fresher Longer | Rechargeable | Dry & Moist Food | Cordless Design | Easy to operate
169;Kefary: Dual Cassette Stoves for Outdoor Cooking Adventure;Ended;733%;Gadgets;;November 14, 2024;Kefary;['https://kefary-service@outlook.com/'];https://www.kickstarter.com/projects/yangyuan/kafary-dual-cassette-stove-for-outdoor-cooking-adventures;Double Stoves | 3.6KW High Heat | Explosion-proof | Portable and Foldable Structure | Applicable for Various Fuels
170;FarReach A1: Your In-Car Rescue Tool, All in One Solution;Ended;324%;Gadgets;;November 13, 2024;FarReach Auto;['https://www.facebook.com/profile.php?id=61559937074563'];https://www.kickstarter.com/projects/farreach/farreach-a1-your-in-car-rescue-tool-all-in-one-solution;150PSI Super Inflation | Real-Time Tire Pressure | 2000A Instant Jump Start | 20000mAh Powerful Power Bank | Multi-Mode LED Light
171;Uija—A Portable Reverse Osmosis Membrane Water Filter;Ended;188%;Gadgets;;September 14, 2024;Uija;[];https://www.kickstarter.com/projects/1182406323/uijaan-outdoor-portable-reverse-osmosis-water-filter;Uija Pro & Uija Max | Plug-free & Tankless | CSM RO Membrane | Strontium-Enriched Mineral Water | Multiple Outdoor Water Sources
172;FUNDIAN X1 Gaming Keyboard   CookieRun Limited Edition;Ended;5105%;Gadgets;;December 19, 2024;FUNDIAN;['https://www.fundian.com/', 'https://www.youtube.com/channel/UCAYV5bR-n3ACfGQ8YCdLazw', 'https://www.facebook.com/fundians'];https://www.kickstarter.com/projects/fundian-team/fundian-x1-game-keyboard-cookierun-tower-of-adventures-ed;All-in-one Wireless GamePad and Keyboard Combo compatible with iOS Arcade, Android, Win Mac Steam PC Game and Nintendo Switch.
173;EvoDuster Pro: Ultimate Powerful Cordless Blower&Air Duster;Ended;189%;Gadgets;;February 18, 2025;EvoDuster;['https://evoduster.shop/'];https://www.kickstarter.com/projects/evoduster/evoduster-pro-a-powerful-blower-for-clear-the-leavesandsnow;Wireless / 1.2kg~1.5kg Strong Wind Force / 10×2000mAh Big Battery / 1.2kg Lightweight / Various Nozzles / Suitable for Courtyard Use
174;HydroShine: Nano-Ceramic Coating Spray For Vehicles;Ended;313%;Gadgets;;November 9, 2024;HydroDefrost;[];https://www.kickstarter.com/projects/hydrodefrost/hydroshine-nano-ceramic-coating-spray-for-vehicles;Shines | Polishes | Protects | Repels Pollen/Debris | 3-6 Months Long Lasting | Easy To Apply
175;NOMAD 3.0: Electronic Mosquito Protector;Late;active;Gadgets;;Aug 13 2024;Luc Deschamps;['https://www.lifts.life/', 'https://www.bacterras.com/'];https://www.kickstarter.com/projects/nomad-mosquito/nomad-30-electronic-mosquito-protector;Embrace Nature, Not Mosquitoes: A Chemical-Free Protector!
176;Meet AstraLink: Your 4-in-1 Pocket-Sized Power Genius;Ended;637%;Gadgets;;January 9, 2025;AstraLink;[];https://www.kickstarter.com/projects/1408516406/elitecharge-plus-versatile-4-in-1-power-module;Phone Charging|Watch Charging|Headphone Charging|Foreign object detection|Adjustable angle|Smart control chip
177;Womier RD75: Rapid Disassembly QMK/VIA Wireless Keyboard;Ended;847%;Gadgets;;October 28, 2024;Womier INC;['https://womierkeyboard.com/'];https://www.kickstarter.com/projects/womier/womier-rd75-rapid-disassembly-qmk-via-wirelss-keyboard;Wireless and Wired | Full Aluminum | QMK/VIA | Ultra-Low Latency | Hot-Swappable | Connects Up to 5 Devices | For Mac, Windows, Linux
178;Thumby Color;Late;active;Gadgets;;Aug 8 2024;Ken Burns;['https://twitter.com/TinyCircuits', 'https://tinycircuits.com/'];https://www.kickstarter.com/projects/kenburns/thumby-color;Next Generation of the Playable Programmable Keychain
179;HIVEGYM: The Ultimate Portable Gym for All Fitness Goal;Ended;785%;Gadgets;;January 14, 2025;TOUSAINS;[];https://www.kickstarter.com/projects/tousains/hivegym-the-ultimate-portable-gym-for-all-fitness-goal;Revolutionary Portable Gym with TOUSAINS: All-in-One Fitness Solution for Your Every Workout Goal Anywhere Anytime
180;Keychron K2 HE: Ultimate Customizable Magnetic Keyboard;Ended;5887%;Gadgets;;February 12, 2025;Keychron;['https://www.keychron.com/'];https://www.kickstarter.com/projects/keytron/keychron-k2-he-mechanical-keyboard-with-magnetic-switches;Hall Effect Magnetic Switches | Wireless 2.4G & Bluetooth | Custom Actuation Points | Rapid Trigger | QMK | For Mac & Windows | Wooden
181;Chillix Turbo Fan:Experience Unmatched Power and Versatility;Ended;157%;Gadgets;;October 14, 2024;Chillix;[];https://www.kickstarter.com/projects/100102058/chillix-turbo-fan-experience-unmatched-power-and-versatility;1250W High Power | 20000mAh Battery Capacity | Quick Battery Replacement | Overheat Protection | Durable Housing | Precision Control
182;FlipZip Magnetic Quick-release Phone Mount System;Late;active;Gadgets;;Aug 7 2024;MCHAOS;[];https://www.kickstarter.com/projects/mchaos/flipzip-magnetic-quick-release-phone-mount-system;Streamline phone lanyard setup for fast, secure adjustments. Seamless switching between hands-free & tether-free modes in one second
183;COOLSMILE: Ultimate Portable Air Cooler for Any Space;Ended;2308%;Gadgets;;February 2, 2025;ecostar;['https://en.eco-star.co.kr/'];https://www.kickstarter.com/projects/490909329/enjoy-cool-comfort-at-the-best-value-coolsmile-air-cooler;Cost-saving alternative to AC and fans | Turns warm air into a cool breeze | Runs up to 8 hrs on one charge | Ideal for all environment
184;12,240LM Flashlight with Advanced Cooling System;Late;active;Gadgets;;Aug 6 2024;RODMAN;[];https://www.kickstarter.com/projects/mv99s/12240-lm-flashlight-with-advanced-cooling-system;3515 conventional lumen丨Three lamp beads丨120° irradiation range丨417m irradiation distance丨 8000mAh battery丨7 modes
185;Luck - The Smart Hummingbird Feeder;Ended;3562%;Gadgets;;December 21, 2024;bbpeco;['https://bbpeco.com/', 'https://www.youtube.com/@bbpEco'];https://www.kickstarter.com/projects/bbpeco/luck-the-smart-hummingbird-feeder;Experience Every Moment with Real-Time Alerts, Stunning Imagery, and Nectar Quality and Level Monitoring
186;AUDIO ADVENTURES;Ended;1247%;Gadgets;;January 26, 2025;Lee McGeorge;['https://www.trumantoys.com/'];https://www.kickstarter.com/projects/1004238548/audio-adventures;An electronic story adventure system designed for all, but optimized for people with blindness and disabilities
187;H10Plus Coffee Maker: DlY Your Coffee Your Way;Ended;956%;Gadgets;;December 6, 2024;HiBREW;['https://ks.hibrewcoffe.com/', 'https://www.hibrew.com/'];https://www.kickstarter.com/projects/848154631/h10plus-maker-infinite-custom-flavors-brewed-your-way;HiBREW offers flexible options for crafting your coffee's flavor profile while maintaining stable control over its taste.
188;The SheltieCam - The portable pet camera with temp sensor!;Ended;105%;Gadgets;;February 7, 2025;Meanwhile;['https://www.meanwhile.nu/', 'https://www.instagram.com/meanwhile_petcam/', 'https://www.facebook.com/MeanwhileAB'];https://www.kickstarter.com/projects/meanwhile-ab/the-sheltiecam-the-portable-pet-camera-with-temp-sensor;4G connection | Rechargeable battery | Monitors video, temperature, sound and motion | Universal mounting | Alerts and warnings
189;Titaner TiGlide S1: Unparalleled Single-edge Titanium Razor;Ended;301%;Gadgets;;January 21, 2025;Titaner TiGlide;['https://www.titaner.com/'];https://www.kickstarter.com/projects/tiglide/single-edge-titanium-safety-razor;Comforting Smooth Skin-fitting, Adjustable Close Efficient Shave, Ergonomic Handle, and Aesthetical Design for Every Gentleman
190;Hydra : World's First Triple Type-C 100W LED Cable;Late;active;Gadgets;;Jul 30 2024;Futurizta Tech;['https://www.futurizta.com/'];https://www.kickstarter.com/projects/futuriztatech/hydra-100w-triple-fast-charging-type-c-cable;Triboost™ Technology | Fast Charge 3 Devices At Once Up To 100W | LED Display | Data Transfer | Optional Watch/Lightning/Micro Adapter
191;MiniNova MAX:131,000RPM Powerful High-speed Turbo Jet Fan;Ended;4891%;Gadgets;;December 18, 2024;MiniNova;[];https://www.kickstarter.com/projects/29484870/mininova-max-131000rpm-powerful-high-speed-turbo-jet-fan;131000RPM丨Three Adjustable Wind Speeds丨Maximum Wind Speed Over 50 m/s丨Cordless丨 Brushless Motor丨 3D Printing Drying丨Aluminum Alloy Body
192;Portable Keyring Laptop Stand & Eco Tote Bag Set for Nomadic;Ended;110%;Gadgets;;August 26, 2024;Habitamin;['https://www.habitamin.com/'];https://www.kickstarter.com/projects/habitamin/portable-keyring-laptop-stand-and-eco-tote-bag-set-for-nomadic;Productivity tool, Portable keyring laptop stand and eco tote bag set for those working diligently in diverse environments.
193;OVERLYING Portable Nintendo Switch Monitor with TV Mode;Ended;428%;Gadgets;;September 9, 2024;OVERLYING;['https://overlyingtech.com/'];https://www.kickstarter.com/projects/overlying/overlying-portable-nintendo-switch-monitor-with-tv-mode;Unlock TV Mode Anywhere! Switch Monitor with Portable Power & Modular Design for Enhanced Gaming Anytime, Anywhere!
194;World's 1st Wallet with Built-in Find My;Ended;1735%;Gadgets;;November 27, 2024;ESR;['https://www.esrgear.com/'];https://www.kickstarter.com/projects/esrgear/worlds-1st-wallet-with-built-in-find-my;Easy to Find | Thin & Lightweight | Cost-Effective | Rechargeable | More Storage | RFID Blocking
195;RUNK: The world's smallest stylish mini portable power bank;Ended;8540%;Gadgets;;January 1, 2025;RUNKER;['https://runkerinc.com/'];https://www.kickstarter.com/projects/runker/runker-your-edc-portable-power-bank;Mini Portable |3000mAh | 62g | 30W | EDC | NFC | Comes with Charging Cable | Can be placed on Key Ring| 3-in-1 |
196;Whaley | Sleep & Relaxation Pillow | For Better Relaxation;Ended;110%;Gadgets;;January 13, 2025;Whaley Sleep;['https://www.whaleysleep.com.au/'];https://www.kickstarter.com/projects/whaleysleep/whaley-pillow-sleep-living-sleep-relax-heat-therapy;Improve Sleep | Two Guided Deep Breathing Exercises | 3 Levels of Heat Therapy | Menstrual Pain Relief | Stress Relief | For Wellness
197;The latest convenience: MINI ssd and 5-in-1 watch charging.;Ended;350%;Gadgets;;August 20, 2024;AUSSBSSD;[];https://www.kickstarter.com/projects/ausbssd/the-latest-convenience-u-disk-and-watch-charging-in-one;Up to 4TB.SSD 2000M/S.240W max input, 140W output(for charging laptops),A brand new combination of wireless watch charging and SSD.
198;Woowind NW10: The Ultimate Cordless Fast SUP and Kite Pump.;Ended;768%;Gadgets;;November 4, 2024;Woowind;['https://woowindshop.com/'];https://www.kickstarter.com/projects/woowind/woowind-nw10-the-ultimate-cordless-fast-sup-and-kite-pump;Cordless Design | Max 20PSI | Auto-off｜13500mAh Battery｜Pumps 8 SUPs｜Power Bank｜Made to Last｜Energy Efficient
199;Aligoo Boost: 4000A SuperSafe Car Battery Jump Starter;Ended;1594%;Gadgets;;January 8, 2025;Aligoo;['https://www.backerarea.com/aligooboostseries'];https://www.kickstarter.com/projects/aligoo/aligoo-boost-your-3-in-1-powerful-car-companion;For Engines Up to 10L/8.0L | 4000A | 24000mAh Capacity | 100W PD Power Bank | IP67 Waterproof | 4-Level LED Light | Magnetic Base
200;Jelly Max, The Smallest 5G Smartphone ?;Ended;397%;Gadgets;;January 17, 2025;Unihertz;['http://www.unihertz.com/', 'https://www.facebook.com/1526680197345277/', 'https://twitter.com/unihertz', 'https://www.instagram.com/unihertzjelly', 'https://www.youtube.com/@unihertzofficial', 'https://www.linkedin.com/company/unihertz/'];https://www.kickstarter.com/projects/jellyphone/jelly-max-the-smallest-5g-smartphone;Max Power, Perfect Size! Jelly Max is the latest 5G small smartphone that ideally fits in your palm.
201;FOLI : Smart Phone Expansion/New life partner;Late;active;Gadgets;;Jul 15 2024;FOLI;[];https://www.kickstarter.com/projects/1902177748/foli-smart-charging-power-bank-new-life-partner;15,000 mAh | 100W PD | 2.2in HD Touch Screen | With charging cable | Suitable for TYPE-C/Lightning/Micro/USB| Dozens Of Apps
202;OZONESWATER Ozone Laundry System2.0;Ended;113%;Gadgets;;September 27, 2024;OZONESWATER;[];https://www.kickstarter.com/projects/ozoneswater/ozoneswater-ozone-laundry-system;Add multiple functions to your washing machine to enhance your washing style
203;iGulu S1: The Ultimate Beer Brewer For Everyone;Ended;4723%;Gadgets;;February 3, 2025;iGulu;['https://comingsoon.igulu.com/igulus1'];https://www.kickstarter.com/projects/1487983457/igulu-s1-the-next-gen-smart-home-brewing-machine;One-Tap Easy Brew丨Chill&Dispense丨Intelligent Brewing System丨Customize Ingredients&Recipes丨Craft Kombucha, Cider, Mead丨Easy Clean-up
204;KonGeeker Q1:The First Dual-Use Visual Head and Beard Shaver;Ended;150%;Gadgets;;November 25, 2024;KonGeeker;[];https://www.kickstarter.com/projects/810455577/kongeeker-q1-the-first-dual-use-visual-head-and-beard-shave;Real-Time View with Smart Phone App | 2 Speed Settings | Detachable Floating Blade Heads | IPX7 Waterproof Rating
205;Solar Energy S：Retractable solar power bank;Ended;776%;Gadgets;;September 4, 2024;solarexcel;[];https://www.kickstarter.com/projects/solarexcel/solar-energy-s-retractable-solar-power-bank;40,000 mAh | Full band solar charging| 120W PD fast charging | Pocket size | LCD screen
206;Miniproca: Powerful All-in-1 MINI PC with Inbuilt Display;Ended;2045%;Gadgets;;January 16, 2025;Miniproca;[];https://www.kickstarter.com/projects/91388361/miniproca-all-in-1-mini-pc-with-intergarted-display;"7"" Inbuilt Screen | Screen Touch | AMD Ryzen™ 9 6900HX CPU | DDR5 8/16/32GB | SSD 512/1T/2TGB | Definition of 4K 120Hz | Multiple Ports"
207;BreezeRest: Uninterrupted, Comfortable, Sweat Free Sleep;Ended;220%;Gadgets;;September 24, 2024;BeyondLab;[];https://www.kickstarter.com/projects/1093724281/breezerest-sweat-free-sleep-at-the-perfect-temperature;The mattress topper that circulates warm or cool air around your body. Stay comfortable all night long every season with Breezerest.
208;Hazel Quinn X Eduardo Recife 1 L Electric Kettle;Ended;124%;Gadgets;;December 2, 2024;Hazel Quinn;['https://hazelquinn.com/'];https://www.kickstarter.com/projects/hazel-quinn/hazel-quinn-10-l-electric-kettle;Gorgeous Botanical Motifs | Long Straight Spout | BPA-Free | STRIX Thermostat
209;NOVA Soundlamp: LED Lamp & Speaker & Charger;Ended;168%;Gadgets;;February 2, 2025;NOVA;[];https://www.kickstarter.com/projects/novasoundlamp/nova-soundlamp;Powerful Illumination LED | 14W Bluetooth Speaker | 10.800 mAh Battery | USB-C Charging Outlet
210;X-Cutter: Revolutionizing the Next Generation of Box Cutters;Ended;6890%;Gadgets;;December 27, 2024;X-Design;[];https://www.kickstarter.com/projects/532948039/x-cutter-the-perfect-ultimate-box-opener;Special blades, box opener that never cuts contents| Special overlay pen, instantly hides info|Auto-retracting| World's First
211;Holory X: Transparent Liquid-crystal Display with IPS Panel;Ended;108%;Gadgets;;February 11, 2025;AOHUA LIMITED - Ho;[];https://www.kickstarter.com/projects/holoryx/see-through-lcd-screen-transparent-display-box;Over 80% Transparency | Adjustable LED | Desksetup | HDMI | E-Fish Tank | Home & Office Decoration | Advertising Player | Android & IOS
212;Suplugg: MagSafe Power Hub – Simplify Your Charging!;Ended;473%;Gadgets;;August 17, 2024;Kylsen;['https://www.suplugg.com/'];https://www.kickstarter.com/projects/deteh/streamline-your-power-solutions-with-suplugg;6 AC Outlets | 4 USB Ports | 15W Charging | Light Sensor | Portable Bluetooth Speaker | Magnetic Wireless Charger | Wall Mount.
213;anyfree Hello Doorbell: AI-Powered Smart Home Security;Ended;316%;Gadgets;;January 22, 2025;anyfree;['https://www.anyfree.com/'];https://www.kickstarter.com/projects/anyfree/the-worlds-first-charging-freeanddistance-free-hello-doorbell;Solar-powered | AI Motion Detection | 1km Transmission Range | Easy to Install | 2.4GHz/5G Wi-Fi | Night Vision | 1080P Camera
214;The Jiizer 01X: The Most Convenient Electric Soldering Tool;Ended;644%;Gadgets;;October 29, 2024;Jiizer Design;[];https://www.kickstarter.com/projects/jiizer/the-jiizer-01x-the-most-convenient-electric-soldering-tool;165W Power Output / 80°C - 450°C Temperature Range / 15s Rapid heating / Heat Gun Mode / 1°C Precise Temperature Adjustment
215;Magic Box-S1: A Fingertip Metal Tactile Toy;Ended;20264%;Gadgets;;October 10, 2024;SANBS;[];https://www.kickstarter.com/projects/sb-s/magic-box-s1-a-fingertip-aluminum-toy;Function 10 in 1 丨TI/CU/AI丨Super Mini丨Metal Handle丨Fingertip Gyroscope丨Fidget丨Addicted to Gadgets, Can't Stop
216;Windsible: Desktop Wind Tunnel for Your Diecast Cars Models;Ended;2681%;Gadgets;;February 17, 2025;Fun-Tech-Lab;['https://www.fun-tech-lab.com/'];https://www.kickstarter.com/projects/1053593589/windsible-desktop-wind-tunnel-for-your-diecast-car-models;Make Your Model Move Through the Air: Think and Observe Like an F1 Designer
217;Apple WWDC 2024 Pin Set;Ended;851%;Gadgets;;October 1, 2024;Straton Roberts;['https://glitchbits.com/'];https://www.kickstarter.com/projects/straton/apple-wwdc-2024-pin-set;An enamel pin set commemorating Apple's WWDC 2024 conference and iconic hardware. Unofficial gear by a passionate UX designer.
218;ChargeMate 3-in-1: Your Portable Power Solution PowerBank 🎉;Ended;467%;Gadgets;;November 20, 2024;VoxyLite;[];https://www.kickstarter.com/projects/voxylite/chargemate-3-in-1-your-portable-power-solution-powerbank;✅ VoxyLite ChargeMate 3-in-1 Power Bank: The Ultimate Fast Power Solution for On-the-Go Charging with Built-in Cable and LCD Display ✌
219;Connect Pro: World's 1st 100W Magnetic Cable With LED screen;Late;active;Gadgets;;Jun 25 2024;asap Technologies;['https://www.chargeasap.com/', 'http://www.youtube.com/c/asapTechnologies', 'https://www.instagram.com/chargeasap/'];https://www.kickstarter.com/projects/asaptechnologies/connect-pro;Powerful cable for devices: Supports 100W PD Charge | 27W Apple Fast Charge | Charge USB-C, Apple & Micro USB devices with one cable
220;Trap and Zap: Fly into my home, face death thrice!;Ended;3872%;Gadgets;;September 18, 2024;Zapsnare;[];https://www.kickstarter.com/projects/zapsnare/worlds-unique-uv-light-trap-zap-pests-in-style;UV Light Trapping, Odor Trapping, Electric Fly Swatter, No Cleanup Needed, Pet-Friendly, Stylish, Hanging Storage
221;TRMNL: The e-ink display for your favorite apps and news;Ended;3154%;Gadgets;;November 19, 2024;TRMNL;['https://usetrmnl.com/'];https://www.kickstarter.com/projects/usetrmnl/trmnl-the-e-ink-display-for-your-favorite-apps-and-news;"7.5"" Display Screen | Wall Mountable | No Subscriptions | No App Required | Minimalist Design | Easy WiFi Setup | Automatic OTA Updates"
222;Visinse: The Phoenix Spatial Audio Smart Glasses;Ended;471%;Gadgets;;July 26, 2024;Phoenix;[];https://www.kickstarter.com/projects/392374979/visinse-phoenix-spatial-audio-smart-glasses;Premium Carbon Fiber | Smart Amplifier | Open Soundstage | Anti-Leak Sound |UV400 Protection | Bluetooth 5.2 | IPX4 | Magnetic Charging
223;DESS C5 Enterprise-GTV:The First Auto Position Projector;Ended;206%;Gadgets;;October 12, 2024;Dess;[];https://www.kickstarter.com/projects/1854029643/dess-c5-enterprise-gtv-the-first-auto-position-projector;Cool & Sci-Fi|Patent Auto Position|Google TV System|Google Assistant|4K Decoding&HDR10+ |2500 ANSI Brightness|30,000-hour Lifespan
224;GORMODE: More User-friendly and Efficient Electric Grinder;Ended;209%;Gadgets;;November 22, 2024;GORMODE;[];https://www.kickstarter.com/projects/2011430002/gormode-more-user-friendly-and-efficient-electric-grinder;Two-speed Control, 63rpm Max | 7-Level Adjustable Grind Settings | Ceramic Burr-Powered Performance| Dual-Pillar LED Illumination
225;Sola Came: Stylish, Secure, Eco-Friendly Home Surveillance;Ended;727%;Gadgets;;November 11, 2024;NSK_Japan;['https://n-sk.jp/corporate-profile'];https://www.kickstarter.com/projects/nsk/solacame-stylish-secure-eco-friendly-home-surveillance;SolaCame: Elegance meets security. Guard your family and garden with our stylish, solar-powered camera, while championing the Earth's
