serial_no;title;status;fund_perc;category;place;last_updated;company;websites;project_link;description
226;Homing Pigeon: The Disc Golf Disc Finder;Ended;113%;Gadgets;;September 27, 2024;David Greenberg;['https://www.homingpigeondiscgolf.com/'];https://www.kickstarter.com/projects/homingpigeon/homing-pigeon-the-disc-golf-disc-finder;A disc in the hand is worth two in the bush!
227;TR10K: Innovative 3 in 1 Charger Built in Retractable Cable;Ended;1192%;Gadgets;;August 5, 2024;YKZ;['https://ykzofficial.com/'];https://www.kickstarter.com/projects/ykz/tr10k-innovative-3-in-1-charger-built-in-retractable-cable;Lipstick Size |PD3.0 |30W Input & Output Cable and USB-C Port |Foldable Wall Charger |10000mAh Power Bank |LED Display |IDC Technology
228;Koojack: Semiconductor Fast Cooling Vest for Chill Comfort;Ended;2967%;Gadgets;;July 19, 2024;Koojack;[];https://www.kickstarter.com/projects/1930875210/koojack-semiconductor-fast-cooling-vest-for-chill-comfort;Semiconductor Cooling Technology | Fast Cool Down in 3s | Intelligent Temperature Control | Comfortable and Lightweight | Durable Usage
229;MoziGuard: Your Ultimate Outdoor Mosquito Repeller Solution;Ended;2559%;Gadgets;;December 4, 2024;MoziGuard;[];https://www.kickstarter.com/projects/1175576428/moziguard-your-ultimate-outdoor-mosquito-repeller-solution;MCH Ceramic Rapid Heating | Dual Temperature Modes | 20h Heating Time | 3 Adjustable Light Modes | 10000mAh Battery| 10-30ft Protection
230;Olight: 3-in-1 Smart Battery Charger, Tester & Organizer;Ended;1142%;Gadgets;;January 10, 2025;Olight World;[];https://www.kickstarter.com/projects/olight/olight-3-in-1-smart-battery-charger-tester-and-organizer;For 32/36 Rechargeable AA/AAA Ni-MH Batteries | Automatic Charging & Storage | 2X Charging Speed | Ostation X | 8-Layer Protection
231;asStylish Twins Carry | Ultimate Solution for 2 Phones Users;Ended;327%;Gadgets;;September 30, 2024;Ricky Lui;['https://www.asstylish.com/'];https://www.kickstarter.com/projects/asstylish/asstylish-twins-carry-ultimate-solution-for-2-phones-users;Are you tired of fumbling with multiple cellphones, struggling to keep them organised and accessible throughout your day?
232;SmartyPlants: Sensors To Monitor Your Plants Every Need;Late;active;Gadgets;;Jun 18 2024;Ben;[];https://www.kickstarter.com/projects/smartyplants/smartyplants-sensors-to-monitor-your-plants-every-need;No more guesswork on plant problems, get expert insights at your fingertips to effortlessly help your houseplants thrive.
233;Surprise Pro - The Ultimate Precision Screwdriver Toolset;Ended;590%;Gadgets;;November 6, 2024;SURPRISE;[];https://www.kickstarter.com/projects/1207078012/surprise-pro-the-ultimate-precision-screwdriver-toolset;Carbon Fiber | 5-Gear Adjustable | 42x Bits 27x Repair Tools | LED Display | Notebook-Style Magnetic Case
234;AV Panel: Acoustic Foam LED Panels;Ended;103%;Gadgets;;December 13, 2024;Avarupt;['https://www.avarupt.com/'];https://www.kickstarter.com/projects/avarupt/av-panel-acoustic-foam-led-panels-0;Illuminate sound, eliminate echos. Wi-Fi controlled lights that seamlessly merge sound and visuals.
235;M-XTR: 148-in-1, a screwdriver for fixing anything you need.;Late;active;Gadgets;;Jun 12 2024;GLEDE;[];https://www.kickstarter.com/projects/glede/148-in-1-a-screwdriver-for-fixing-anything-you-need;148-in-1/ Precision maintenance/LED lighting/Strong magnetic adsorption/Full range of specifications/Anti-Rust/Single-handed operation
236;Achieve Healthy Sleep with Echofram's 12 White Noise Sounds;Ended;290%;Gadgets;;November 12, 2024;Echofram;['https://echofram.com/', 'https://www.facebook.com/profile.php?id=61559434988557'];https://www.kickstarter.com/projects/floatdek/echofram;Sleep soundly, wake gently, and enjoy 8 more features with Echofram.
237;Tiki Tag: The Ultimate Multifunction Tag;Ended;985%;Gadgets;;November 28, 2024;Tiki Smart Inc;['https://www.tikismart.com/'];https://www.kickstarter.com/projects/tiki-smart/tiki-tag-the-ultimate-multifunction-tag;The 4-in-1 Tag | Opening Detection | Movement Detection | Temperature Sensor | Activity Supervision | Easy to Use
238;XTape1: A Modular Digital Laser Tape for Creativity;Ended;3882%;Gadgets;;February 17, 2025;mileseey.ks;['https://www.mileseeytools.com/'];https://www.kickstarter.com/projects/mileseeyd9/the-worlds-1st-modular-digital-laser-tape;A pro-grade modular digital laser tape designed to enable the highest-quality creative projects with unique creativity-driven features.
239;The World's Best Transparent Projection Screen for Consumers;Ended;574%;Gadgets;;November 25, 2024;NanoAR;['https://nanoar.store/'];https://www.kickstarter.com/projects/nanoar/the-worlds-best-transparent-projection-screen-for-consumers;Transforming Glass into a Display / Up to 8K Support / Over 90% Transparency / AR&Glasses-free 3D Effect / Available in Three Sizes
240;Paladin Pro | The Hidden Camera Detector for Home or Travel;Ended;862%;Gadgets;;January 13, 2025;Safender;['https://safender.com/'];https://www.kickstarter.com/projects/safender/paladin-pro;Find Hidden Cameras - GPS Trackers - Other Hidden Devices - ZERO Tech Experience Required!
241;2-in-1 Compact Hybrid Power Screwdriver: H500+;Ended;3226%;Gadgets;;February 18, 2025;Magpie Tech;['https://www.instagram.com/magpietech_us/', 'https://www.magpiefunding.com/', 'https://magpietech.us/', 'https://www.youtube.com/@MagpieTech_official/featured'];https://www.kickstarter.com/projects/magpietech/2-in-1-compact-hybrid-power-screwdriver-h500;Compact yet Powerful | Adjustable Multi Torque Power| Switchable Auto&Manual | Maximized Efficiency in Various Environments
242;Cowzry MagBox:Expand Your Storage Space;Ended;811%;Gadgets;;August 21, 2024;COWZRY;['https://www.facebook.com/profile.php?id=100091825238692', 'https://www.facebook.com/groups/943361597804490'];https://www.kickstarter.com/projects/828791693/cowzry-magnetic-attachment-storage-expansion-box;Magnetic Attachment Design丨Storage Space Expansion丨Suitable for iPhone Photography丨10Gbps Transfer Speed丨Mini Size丨Wide Compatibility
243;Haptique RS90: A True universal remote controller;Late;active;Gadgets;;Jun 4 2024;Cantata;['https://www.cantatacs.com/'];https://www.kickstarter.com/projects/cantata/haptique-rs90-a-true-universal-remote-controller;Designed to Simplify Your Smart Home Control with a Single Remote.
244;NEO: World's Smallest Foldable Charger;Late;active;Gadgets;;Jun 4 2024;UZE;['https://www.uze.tech/'];https://www.kickstarter.com/projects/uze/uze-neo-3-in-1-foldable-wireless-charger;One charger for your Apple devices. Travel light, stay organized, and charge in style. Simple, smart, and clutter-free.
245;Santek EZ Sign 4.2 inch E-paper Display;Ended;309%;Gadgets;;August 28, 2024;Santek;['https://www.santechnology.com/'];https://www.kickstarter.com/projects/e-paper-display/santek-ez-sign-42-inch-e-paper-display;Displaying text and images of your choice
246;VaccuAire: Portable Vacuum Cleaner, Air Pump, Jump Starter;Ended;7893%;Gadgets;;August 2, 2024;VaccuAire;[];https://www.kickstarter.com/projects/vaccuaire/vaccuaire-portable-vacuum-cleaner-air-pump-jump-starter;120w max hoover | 0-150psi for tire/ball air inflation | 2500A peak current jump starter | 8000mAh battery | flash & SOS light
247;Clevedog: An Unparalled 2-Way Video Indoor Security Camera;Ended;1131%;Gadgets;;December 6, 2024;Clevedog;[];https://www.kickstarter.com/projects/462056887/clevedog-an-unparalled-2-way-video-indoor-security-camera;Built-in Monitor Screen | 2-way Video Call | Motion Detection | Instant Notification | Infrared Night Vision | 350° Pan Coverage
248;Snuuzu: Tesla-tailored mattress for Model Y and Model 3;Ended;299%;Gadgets;;February 17, 2025;Snuuzu;['https://www.snuuzu.com/'];https://www.kickstarter.com/projects/snuuzu/snuuzu-tesla-tailored-mattress-for-model-y-and-model-3;A comfortable double bed, tailored for the Tesla Model Y and Model 3. Folds into a duffel bag that fits in the sub-trunk.
249;NEOB ：Portable 20Psi or 150Psi Versatile Kite&Sup&Tires Pump;Ended;554%;Gadgets;;July 19, 2024;NEO-B;['https://www.neo-b.shop/'];https://www.kickstarter.com/projects/neo-b/neob-astonishing-20psi-or-150-psi-mutifuntional-air-pump;2 Mode - 20Psi & 150Psi | 110,000rpm Motor | 550L/min | 5000mah | Portable Size - 880g | Supports Multiple Kites & wings & Sup & Tires
250;MutiFlex: 13-in-1 Flashlight, Your Ultimate EDC Companion;Ended;1747%;Gadgets;;July 2, 2024;MutiFlex;['https://mutiflex.com/', 'https://www.facebook.com/profile.php?id=61555335875623'];https://www.kickstarter.com/projects/mutiflex/outdoor-flashlight;Power bank|Arc lighter|Plastic bottle cutter|Saw blade|Folding knife|Window breaker|Can&Bottle opener|6 Screwdrivers|Wire cutter|Wrench
251;LingoBook & LingoYak: The Language Learning Revolution;Ended;4488%;Gadgets;;February 10, 2025;LingoYak;['https://www.lingoyak.com/', 'https://blog.lingoyak.com/'];https://www.kickstarter.com/projects/lingoyak/lingobook-and-lingoyak-the-language-learning-revolution;The Future of Language Learning is Here | Driven by AI & Machine Learning | Learn 10x Faster
252;Qudi Mask 2: Animate Your Expressions;Ended;317%;Gadgets;;January 28, 2025;Qudi;['https://qudi.tech/', 'https://www.instagram.com/qudi.mask/', 'https://www.youtube.com/@qudimask'];https://www.kickstarter.com/projects/qudi/qudi-mask-2-self-expression-redefined;Emotional LED mask that opens mouth to your speech, reacts to head movements, and fully customizable to match your look.
253;GC6 - The first carbon fibre smart mini cordless rotary pen;Ended;1649%;Gadgets;;September 23, 2024;Arrowmax;['https://www.am-arrowmax.com/', 'https://am-smart.com/'];https://www.kickstarter.com/projects/arrowmax/gc6-the-first-carbon-fibre-smart-mini-cordless-rotary-pen;Ultra-lightweight, Smart gesture speed control, High torque, Bluetooth, APP Control, OLED, Wireless charger, Carbon fibre body
254;PIHSRE Projector—Turns Any Surface Into a Finger Touchscreen;Ended;171%;Gadgets;;July 2, 2024;PIHSRE;[];https://www.kickstarter.com/projects/1647449542/pihsre-projectorturns-any-surface-into-a-finger-touchscreen;Built-in Android system projects a finger-controlled screen like a tablet. Supports desktop and wall projection.
255;LightBoks: Perhaps the Smartest Projector on Earth 🌏;Ended;980%;Gadgets;;August 31, 2024;Openhagen;['https://www.openhagen.com/'];https://www.kickstarter.com/projects/openhagen/lightboks-perhaps-the-smartest-projector-on-earth;And the world's only wooden projector 🌳
256;ESOTAB Portable Solar Folding Table;Ended;1663%;Gadgets;;September 11, 2024;ESOTAB;[];https://www.kickstarter.com/projects/161320244/esotab-portable-solar-folding-table;Redefining Outdoor Convenience with Our Portable Solar-Powered Folding Table
257;World's First 8-in-1 Full-featured Magnetic USB-C Cable;Ended;892%;Gadgets;;July 11, 2024;xCool;['https://www.xcool.com/'];https://www.kickstarter.com/projects/xcool/xcool-cable-8-in-1-ultimate-magnetic-usb-c-cable;4 Interchangeable Ends | Magnetic Design | 240W Fast Charging | 20Gbps Data Transfer | 4K@60Hz Display
258;Multiangle iPad Keyboard for Type, View, Sketch and Read;Ended;3424%;Gadgets;;June 26, 2024;Typecase;[];https://www.kickstarter.com/projects/383650469/multiangle-ipad-keyboard-for-type-view-sketch-and-read;4 Modes | Keyboard + Trackpad | 11 RGB Lights | Magnetic Attach | Work with Apple Pencil | For iPad Pro and Air | Compact & Portable
259;World's First Spliceable 2-in-1 Charging&Data Storage Cable;Ended;2480%;Gadgets;;July 4, 2024;AOHi;['https://www.iaohi.com/'];https://www.kickstarter.com/projects/aohi/worlds-first-splicable-2-in-1-charging-and-data-storage-cable;2-in-1 Storage & Charging | PD 3.1 240W | 512GB | 1000MB/s | Custom Length | Portable
260;GLAZER Press: A Greater Way to Sculpt your Crystal ICE;Ended;1944%;Gadgets;;December 30, 2024;ORI Future;['https://orifuture.com/products/glazer-press-reshape-ice-reshape-moments', 'https://www.facebook.com/groups/1423133018278810'];https://www.kickstarter.com/projects/ori-future/glazer-press-a-greater-way-to-sculpt-your-crystal-ice;The next generation of ICE PRESS for Crystal-Clear Creations
261;Fusion Keyboard 2.0: 4-in-1 Keyboard with Invisible Touchpad;Ended;1756%;Gadgets;;November 18, 2024;Mokibo;['https://mokibo.com/'];https://www.kickstarter.com/projects/mokibo-/mokibo-fusion-keyboard-2-0-keyboard-touchpad-stand-cover;Revolutionary Touchpad on Keys | Built-In Kickstand & Case | Pair Up to 3 Devices | Multi-OS Support | Portable |by Mokibo
262;MELLO The World's Sleekest High-Speed Charger 180+ Countries;Ended;20112%;Gadgets;;February 6, 2025;MELLO POWER;[];https://www.kickstarter.com/projects/mellopowerinc/mello-high-speed-charging-in-style;20W GaN Charging | Compatible in 180+ Countries | Foldable Design | Fits on Keyring | Type-C Port | 28g | FREE Patented Charging Cable
263;Speekeys - Your EDC Data Hub and Storage Powerhouse;Late;active;Gadgets;;May 14 2024;Webble;['https://www.facebook.com/profile.php?id=61555616548880', 'https://speekeys.com/'];https://www.kickstarter.com/projects/speekeys/speekeys;10 Gbps | Up to 2 TB | Compact and Lightweight | M.2 NVMe SSD | Up to 1000 MB/s | Silicone case | Tool-free assembly
264;BoT Talk: AI-Powered GPS Communicator for Kids;Ended;532%;Gadgets;;October 26, 2024;BoT US INC;['https://www.bsize.com/en/bot/talk'];https://www.kickstarter.com/projects/bottalk/bot-talk;High-Precision GPS | 2-Way Voice Messaging | AI Monitoring | Unusual Event Alerts | One-Button Design | Waterproof & Shockproof
265;Brevoy Portable Espresso Maker, Brew Espresso Everywhere.;Ended;2416%;Gadgets;;July 8, 2024;Brevoy;['https://brevoy.com/'];https://www.kickstarter.com/projects/brevoy/brevoy-portable-espresso-maker-brew-espresso-everywhere;Boil, Brew, Taste 3-in-1 | Ground Coffee and Capsule | Rich Crema | Supports Double Espresso | One Charge 300 Cups | Portable Design
266;ELF Cable: 3-in-1 Portable Charging Cable;Ended;2350%;Gadgets;;September 10, 2024;STYLEPIE ELF Cable;['https://stylepie.com/'];https://www.kickstarter.com/projects/804533605/elfcable-multi-purpose-portable-charging-cable;Multi-Functional Use | Bright LED Lighting | Precision Heating Element | 240W High Power Output | Durable Construction
267;Eco-Felt laptop and tablet stylish sleeve case bag;Ended;193%;Gadgets;;June 3, 2024;Alex;[];https://www.kickstarter.com/projects/466558369/stylish-eco-felt-laptop-and-tablet-sleeve-case-bag;Nordic stylish multi-color laptop or tablet sleeve
268;Super mini rechargeable multifunctional Vacuum Sealer;Ended;2868%;Gadgets;;July 31, 2024;Creative;[];https://www.kickstarter.com/projects/fujiangtarot/super-mini-rechargeable-multifunctional-vacuum-sealer;VacSeal | Seal | External Container Vacuuming | Semi-automatic vacuum seal | Dry & Moist Food | Bag Cutter | Phone holder | Air pump
269;Shargeek 140: Unrivaled Portable Charging Accessible to All.;Ended;9718%;Gadgets;;January 28, 2025;Sharge Tech;['https://shargeek.com/', 'https://sharge.com/'];https://www.kickstarter.com/projects/shargetech/shargeek-140-unrivaled-portable-charging-accessible-to-all;20,000mAh/72Wh | Max 140W Output | 2-device Fast Charging | Premium & Portable | Robust Batteries
270;ASDOM Flexible & Cozy Outdoor Heated Jacket for Any Scenario;Ended;105%;Gadgets;;September 12, 2024;ASDOM;['https://www.asdomlife.net/'];https://www.kickstarter.com/projects/1472683072/outdoor-heated-jacket-cozy-and-functional-for-any-situation;Vest & Jacket | Composite Carbon Nanotube Heating Film | Breathable, Windproof, Waterproof | Ultra-lightweight at 610g | Machine Wash
271;Vobot Mini Dock: Docking Station w/ Screen & Built-in Apps;Ended;3759%;Gadgets;;September 9, 2024;Vobot;['https://getvobot.com/mini-dock'];https://www.kickstarter.com/projects/vobot/vobot-mini-dock-screen-equipped-dock-portal-to-infomation;Smart Display | 7-in-1 Hub | Pomodoro Timer | Todoist | Weather | CC/Stock Price | App Store | Custom App Dev | Improve Work Efficiency
272;Beyond Limits: Introducing The Next Generation Super Cable;Late;active;Gadgets;;Apr 30 2024;Horizon;['https://haloband.com/', 'https://www.facebook.com/halobandproducts', 'https://youtube.com/c/HALOBAND'];https://www.kickstarter.com/projects/thehorizon/beyond-limits-introducing-the-next-generation-super-cable;Up to 120Gbps, 240W, Multiple 8K, Ballistic Fiber, Lifetime Warranty, The World’s First
273;FacePlunge - Ice Water Rejuvenation;Ended;584%;Gadgets;;November 29, 2024;LastObject;['https://www.lastobject.com/'];https://www.kickstarter.com/projects/193289139/faceplunge-ice-water-rejuvenation;Dip into Serenity: Effortless Cold Immersion for a Clear Mind and Vibrant Health.
274;NexarPlay, The Ultimate Handheld for Gaming, Work, and Study;Ended;939%;Gadgets;;September 14, 2024;NexarPlay;[];https://www.kickstarter.com/projects/nexarplay/nexarplay-the-ultimate-handheld-for-gaming-and-beyond;"10.5"" Screen | Detachable Handles | Dual Cooling System | Seamlessly Switch Between Console, Tablet, Laptop"
275;BQEYZ® CLOUD-Exclusive Air-assisted Vibration Earphone;Ended;118%;Gadgets;;June 25, 2024;BQEYZ®;['https://cloud-earphone.shop/'];https://www.kickstarter.com/projects/cloudun-earphone/cloud-exclusive-air-assisted-vibration-tech-earphone-set;Aluminum alloy shell | Air-assisted Vibration tech | Ergonomics |30g Ultra-Lightweight |LCP Diaphragm
276;PhoneMicro5-Portable Smartphone HD Microscope;Ended;1177%;Gadgets;;December 6, 2024;PhoneMicro 5;[];https://www.kickstarter.com/projects/phonemicro5/phonemicro5-portable-smartphone-hd-microscope;Portable HD phone microscope with any phone model, explore the microscopic world anytime, anywhere.
277;Flexilink Pro: 65W High Power Dual-Screen 4-In-1 USB Cable;Ended;705%;Gadgets;;September 6, 2024;Flexilinkteam;[];https://www.kickstarter.com/projects/603171958/flexilink-pro-dual-screen-4-in-1-usb-cord;Dual-Screen Numeric Display | 3 Different Types of USB Ports | Data Transfer | Magnetic Keyring Charger Cord | Lightweight and Portable
278;Hilight Gen2:Illuminate Your Canvas and Workspace;Ended;907%;Gadgets;;November 13, 2024;HILIGHT;[];https://www.kickstarter.com/projects/hilight/hilight-dual-light-desk-lamp-for-painting-and-office;Natural Spectrum Lighting / Productivity Boosting Tools / R9 / Desk Lamp / LED Light / Adjustable / Professional
279;ChargeMax丨Ultra-slim Magnetic Wireless Charging Power Bank;Ended;7573%;Gadgets;;August 30, 2024;MagMate;[];https://www.kickstarter.com/projects/1718984321/chargemaxultra-slim-magnetic-wireless-charging-power-bank;10000mAh/15W Wireless Output/MagSafe & Qi compatible/Aluminum Alloy Shell/Phone Stand/Multi-device Charging/Fast charging
280;AirSpot - The Personal & Wearable Fresh Air Monitor;Ended;292%;Gadgets;;October 17, 2024;Robert Hackett;['https://airspothealth.com/', 'https://theatrecaps.com/', 'https://www.psnetwork.org/'];https://www.kickstarter.com/projects/airspot/airspot-the-personal-and-wearable-fresh-air-monitor;Fresh Air improves concentration and wellbeing. AirSpot makes it simple to optimise your air health.
281;ONE BOX 2.0/ Ancient craft wooden storage box;Ended;4686%;Gadgets;;January 17, 2025;CHENGSHE.design;[];https://www.kickstarter.com/projects/chengshedesign/one-box-20-ancient-craft-wooden-storage-box;Storage box/magnetic/infinite pens/stationery box/natural wood/lightweight and portable/modular/EDC
282;Feramica - Gadget to Nourish Mental Health;Ended;139%;Gadgets;;August 30, 2024;Sandi W;['https://intro.feramica.com/intro'];https://www.kickstarter.com/projects/smilingox/feramica-gadget-to-nourish-mental-health;Feramica serves gradual and consistent mental nourishment to improve mental health and overall wellness.
283;MateNova M3: Precision 3D Model Polishing Pen;Ended;2649%;Gadgets;;June 13, 2024;MateNova M3;[];https://www.kickstarter.com/projects/180839270/metenova-m3-electric-reciprocating-grinding-tool;Craftsmanship Perfected-Your Ultimate Model Finisher
284;WWDC24 | The unofficial community enamel pins;Ended;119%;Gadgets;;September 12, 2024;Clément Sauvage;['https://twitter.com/clementsauvage', 'https://clementsauvage.me/'];https://www.kickstarter.com/projects/csauvage/wwdc24-the-unofficial-community-enamel-pins;WWDC 2024 is coming. Let's with enamel pins, carefully made by developers in love with design and Apple technologies !
285;Scope Pro : The Lightest Dual / Triple 14'' 2K Monitor;Ended;5104%;Gadgets;;November 10, 2024;ScopePro;['https://kickstarter.scopepro.store/'];https://www.kickstarter.com/projects/82605225/scope-pro-versatile-monitor-extenter-for-macbooks;Five modes, Type-C, 350° rotation, compatible with any laptop including Mac / PC / Switch, 1.1 pounds 4.8mm thin, 100% sRGB, 2k
286;CLAWLAB: Tufting Kit for Rug Making, Custom Crafts, Artworks;Ended;3225%;Gadgets;;February 5, 2025;CLAWLAB;[];https://www.kickstarter.com/projects/clawlab/clawlab-tufting-kit-for-rug-making-custom-crafts-artworks;Create Rugs & Artwork with Our Easy-to-Use Tufting Kit and Transform Your Passion into a Profitable Venture
287;TorxTec: Universal Wrench Socket + Ratcheting Screwdriver;Ended;3371%;Gadgets;;June 24, 2024;TorxTec;[];https://www.kickstarter.com/projects/1339706056/worlds-portable-versatile-ratchet-screwdriver;Multifunctional Magnetic Bits | Hidden Screw Head Design | Gift Choice | Ergonomic L-shape | Versatile Socket Wrench
288;Guardian Alarm: Live your life freely, no fear for theft;Ended;207%;Gadgets;;January 19, 2025;eesens inc;['https://www.facebook.com/Eesens-109816187650699'];https://www.kickstarter.com/projects/eesens/guardian-alarm-live-your-life-freely-no-fear-for-thieves;110dB motion sensitive alarm, long-range wireless theft alert, sound localization, secure attachment to your bike and valuables
289;EASYPLAY 1s:Portable, Easy-to-Start Music Keyboard with MIDI;Ended;4137%;Gadgets;;October 22, 2024;SummerTones;['https://summertones.fun/', 'https://www.youtube.com/@SummerTones.EASYPLAY1s', 'https://www.facebook.com/groups/1072322430620976'];https://www.kickstarter.com/projects/summertones/easyplay-1s-pocket-sized-passion-easy-play-inspiration;25+ Sound Pack | MIDI supported | Bluetooth Speaker | 25-key 3X5 Keyboard Layout | C3-C8 Octave|8-Hour Playtime|Interchangeable Keycaps
290;Illuminate Your World With The TT3 Tower Lamp;Ended;1538%;Gadgets;;July 24, 2024;Tevole;[];https://www.kickstarter.com/projects/943870957/illuminate-your-world-with-the-tt3-tower-lamp;Versatile Lighting, Redefined: Compact, Powerful, Customizable
291;SWIFT PRO: The Powerful 140W 4th Gen GaN Travel Adapter;Ended;1925%;Gadgets;;September 22, 2024;iBlockCube Team;[];https://www.kickstarter.com/projects/iblockcube/swift-pro-the-powerful-140w-4th-gen-gan-travel-adapter;140W 4th Gen GaN Tech | 3 USB-C Ports | 1 USB-A | 1 Universal Socket | 4 Transfor ways | Charges 5 devices at the same time | Twin Fuse
292;AluPen: The Modular Multifunctional EDC Pen;Ended;331%;Gadgets;;October 19, 2024;AluPen;[];https://www.kickstarter.com/projects/1259100603/symtik-the-modular-multifunctional-edc-pen;Elevate Your Everyday Carry with AluPen: Screwdriver + Stylus Pen + Pencil
293;QuietEye 1132P: Precision Optics and Stabilization Unleashed;Ended;2950%;Gadgets;;January 14, 2025;Quieteye;[];https://www.kickstarter.com/projects/278327094/quieteye-1132p-precision-optics-and-stabilization-unleashed;Explore Beyond Limits with 11x Magnification, Advanced Stabilization, and Smartphone Connectivity
294;Fitorch K2 - Hardcore Brightness, Explore Freely;Ended;911%;Gadgets;;July 9, 2024;Fitorch;[];https://www.kickstarter.com/projects/fitorch/fitorch-k2-lite-hardcore-brightness-explore-freely;1000 Lumens / 5 Brightness Modes / 20-hour Strong Battery / 20 Funky Lights / Sleek Compact Design
295;DUKA: 42-IN-1 Rotary Tool-Superior Heat Dissipation, DIY Fun;Ended;1248%;Gadgets;;August 30, 2024;DUKA Team;[];https://www.kickstarter.com/projects/520848872/duka-mini-rotary-tool-superior-heat-dissipation-diy-fun;Surrounding Heat Dissipation Structure | 42 pcs Accessories | 10000-28000RPM | Long Battery Lifespan | 260g Lightweight
296;MOKiN All In One Station | 100W GaN Charger & USB-C Hub;Ended;1004%;Gadgets;;May 17, 2024;MOKiN Global;['https://mokinglobal.com/'];https://www.kickstarter.com/projects/mokinglobal/mokin-all-in-one-station-100w-gan-charger-and-usb-c-hub;3 Fast Charging Port | PD100W Power Delivery | 4K@60Hz HDMI | Up to 10Gbps Data Transfer | RJ45 Ethernet
297;AirGo Ⅱ: Evolved All-in-One Mini Bike Pump for Cycling Fans;Ended;889%;Gadgets;;July 8, 2024;AirGo;['https://airgoii.shop/'];https://www.kickstarter.com/projects/airgo/airgo-ii-evolved-all-in-one-mini-air-pump;135g | Clear Display | Up to 100 psi | Presta & Schrader & English Valve | QC3.0 Fast Charging | 30 min Full Charge | 4 Preset Modes
298;Shiukee：High Tensile 240W USB4 Coaxial LED Armid Fiber Cable;Ended;1840%;Gadgets;;May 15, 2024;Shiukee Cable;[];https://www.kickstarter.com/projects/191134110/shuikee-high-tensile-240w-usb4-coaxial-led-armid-fiber-cable;Transparent Interior Sense | Coaxial Core | Digital Power Display | USB4 40Gbps | PD3.1 240W | UHD 8K@30Hz | 40000+ Bending
299;First Toilet Brush Without Bristles, Drops and Brush Holder;Ended;1920%;Gadgets;;January 22, 2025;CLOOUBRUSH;[];https://www.kickstarter.com/projects/clooubrush/first-toilet-brush-without-bristles-drops-and-brush-holder;FRAGRANCE & SPRAY FUNCTION｜CONTACTLESS CLEAN｜100% HYGIENIC｜0% STINK｜NO BRISTLES｜NO BRUSH HOLDER｜NO DROPS｜NO DIRT｜STYLISH & SUSTAINABLE
300;SES NANO - Mini Powerful Electric Screwdriver Pen;Ended;1238%;Gadgets;;June 22, 2024;AM ARROWMAX;[];https://www.kickstarter.com/projects/amarrowmax/ses-nano-mini-electric-screwdriver-pen;5-gear torque for any job,Aluminum carry case with 60 magnetic bits,Easy to operate forward and reverse keys,Convenient USB-C charging
