serial_no;title;status;fund_perc;category;place;last_updated;company;websites;project_link;description
71;Adventure Tape - The Ultimate Rescue Solution For Your Gear;Ended;301%;Fabrication Tools;Lydney, UK;May 8, 2018;Adventure Tape;['http://www.adventuretape.com/'];https://www.kickstarter.com/projects/adventuretape/adventure-tape-the-ultimate-rescue-solution-for-yo;Adventure Tape® is the perfect rescue solution when the unexpected happens to your gear at the worst time and location possible!
72;Goliath CNC - An Autonomous Robotic Machine Tool for Makers;Ended;1192%;Fabrication Tools;Los Angeles, CA;June 29, 2024;Springa;[];https://www.kickstarter.com/projects/2130625347/goliath-cnc-an-autonomous-robotic-machine-tool-for;A portable robot that mills, cuts, and engraves to turn BIG ideas into tangible items with any materials and various CAD file formats.
73;Food Safe, Eco-Friendly, Re-usable Mold Making Putty;Ended;120%;Fabrication Tools;Augusta, ME;January 30, 2018;ComposiMold;['https://www.facebook.com/ComposiMold/', 'https://twitter.com/composimold', 'https://www.instagram.com/composimold/', 'http://impressiveputty.com/', 'http://composimoldstore.com/', 'http://ecoluremaker.com/'];https://www.kickstarter.com/projects/composimold/food-safe-eco-friendly-re-usable-mold-making-putty;Food Safe, Eco-Friendly, Re-usable Mold Making Putty for Making Your Own Unique Edible Shapes into Chocolate, Candies, and More.
74;Crowdception! - YOUR crowdfunding future & my thesis!;Ended;156%;Fabrication Tools;Hamburg, Germany;December 22, 2017;Christian Thielke;[];https://www.kickstarter.com/projects/1603754359/crowdception-your-crowdfunding-future-and-my-thesi;Learn how to crowdfund: A scientific paper about crowdfunding, published by crowdfunding and with this crowdfunding campaign inside.
75;Cubiio: The Most Compact Laser Engraver;Ended;5495%;Fabrication Tools;Taipei City, Taiwan;April 5, 2023;Muherz;['http://cubiio.muherz.com/'];https://www.kickstarter.com/projects/cubiio/cubiio-the-most-compact-laser-engraver;Portable x Affordable = Maker + Baker + Designer + Handcrafter
76;Gerbil: The Open upgrade for your K40 Laser;Ended;110%;Fabrication Tools;Sydney, AU;September 21, 2018;Paul de Groot;['http://awesome.tech/', 'http://makerfaire.com/maker/entry/59915/', 'http://hackaday.com/2017/06/10/drop-in-controller-for-ebay-k40-laser-engraver-gets-results/', 'https://diyodemag.com/features/precision_laser_controller_upgrade', 'https://au.pinterest.com/pauljacobdegroo/laser/', 'https://www.facebook.com/paul.degroot.7165', 'https://www.linkedin.com/in/pauldegroot/'];https://www.kickstarter.com/projects/2118335444/gerbil-the-open-upgrade-for-your-k40-laser;Realise your K40 laser's potential with open software for productivity and upgraded hardware for enhanced engraving and cutting quality
77;BondicEVO™ Liquid Plastic Welder;Ended;655%;Fabrication Tools;Toronto, Canada;September 13, 2018;Bondic®;['https://twitter.com/jimbondic', 'https://www.youtube.com/user/HowYouBondic', 'https://www.facebook.com/Bondic', 'http://www.notaglue.com/'];https://www.kickstarter.com/projects/notaglue/bondicevotm-liquid-plastic-welder;Bondic® is the worlds first liquid plastic welding tool, basically a pocket sized - battery operated - almost instant 3D printer!
78;The MicroMill - A desktop CNC milling machine.;Ended;179%;Fabrication Tools;Dorset, UK;October 2, 2017;RP3d;['http://www.rp3d.co.uk/'];https://www.kickstarter.com/projects/rp3d/the-micromill-a-desktop-cnc-milling-machine;A powerful, precise and affordable CNC milling machine for your desktop. Perfect for makers, designers, fablabs & small businesses.
79;Kniterate: The Digital Knitting Machine;Ended;636%;Fabrication Tools;London, UK;December 28, 2024;Kniterate;['http://kniterate.com/', 'https://twitter.com/Kniterate', 'https://www.instagram.com/kniterate/'];https://www.kickstarter.com/projects/kniterate/kniterate-the-digital-knitting-machine;Create a design and press knit. A compact digital knitting machine to bring fashion fabrication back to your neighborhood.
80;The Earscratcher;Ended;100%;Fabrication Tools;Lohn-Ammannsegg, Switzerland;May 5, 2017;Dominik Wyss;['http://www.ohrenkratzer.ch/'];https://www.kickstarter.com/projects/1989839131/the-earscratcher;"The earscratcher, who scratches the ear without hurting it.
The solution for all scratch-junkies out there."
81;Can your caliper do this? Precision Caliper Modification!;Ended;4520%;Fabrication Tools;Manvel, TX;January 12, 2018;Ian Hamilton;[];https://www.kickstarter.com/projects/1478806987/precision-caliper-modification;Improve the accuracy of measurements taken from concave surfaces. Titanium Now Available!
82;Vaquform: The World's First Digital Desktop Vacuum Former;Ended;355%;Fabrication Tools;Los Angeles, CA;October 26, 2018;Vaquform, Inc.;['https://vaquform.com/', 'https://facebook.com/vaquform', 'https://instagram.com/vaquform'];https://www.kickstarter.com/projects/vaquform/vaquform-the-worlds-first-digital-desktop-vacuum-f;With industrial strength and digital smarts, go beyond prototyping and start manufacturing right from your desktop.
83;TriboTEX: More HP, Better MPG, and Less Wear in Car Engines;Ended;1580%;Fabrication Tools;Seattle, WA;February 13, 2020;TriboTEX;['http://www.tribotex.com/', 'https://www.facebook.com/tribotex/', 'https://www.sbir.gov/sbirsearch/detail/399284', 'https://www.youtube.com/user/TriboTEX', 'https://instagram.com/tribotex99'];https://www.kickstarter.com/projects/tribotex/tribotex-more-engine-hp-better-mileage-less-wear-a;Boost gas mileage, increase HP, and reverse wear in your car's engine using nanoparticles developed with DoE, NASA, & NSF.  CarBoss
84;Kube OpenLathe - The open source glass blowing lathe!;Ended;117%;Fabrication Tools;Seattle, WA;December 29, 2020;Jordan Kube;['https://www.instagram.com/jordankube/', 'https://www.youtube.com/user/jordankube/videos?view=0&shelf_id=0&sort=dd'];https://www.kickstarter.com/projects/1932619845/kube-openlathe-the-open-source-glass-blowing-lathe;This project aims to bring a glassblowing lathe to every shop. Coming in at less than $2k in parts, this lathe is accessible to all!
85;Maslow CNC - a $500 open source 4 by 8 foot CNC Machine;Ended;629%;Fabrication Tools;Port Townsend, WA;July 27, 2017;Bar Smith;['http://www.maslowcnc.com/'];https://www.kickstarter.com/projects/maslow4/maslow-cnc-a-500-open-source-4-by-8-foot-cnc-machi;An open source 4 by 8 foot CNC cutting machine for under $500. A router designed to let you cut big, useful things out of wood and more
86;Cast-Right Vertical Pen Blank Casting System;Ended;470%;Fabrication Tools;Nashville, TN;December 13, 2016;Jim Pratt;[];https://www.kickstarter.com/projects/360272370/cast-right-vertical-pen-blank-casting-system;Cast-Right is a patent-pending vertical casting system for casting pen blanks vertically  all you need is your pressure pot and epoxy.
87;The EZ CYCLING SYSTEM Refreshes Your Old Water Supply;Ended;140%;Fabrication Tools;Salt Lake City, UT;November 10, 2016;Caleb Tucker;['http://www.emergencywatercorp.com/', 'https://www.linkedin.com/in/caleb-tucker-474022a?trk=nav_responsive_tab_profile', 'http://tchem.com/'];https://www.kickstarter.com/projects/1520454424/the-ez-cycling-system-refreshes-your-old-water-sup;Introducing the drum caps that connect to garden hoses to clean and cycle your old water supply.
88;The First Desktop Waterjet Cutter;Ended;1332%;Fabrication Tools;Bronx, NY;June 4, 2019;WAZER;['http://www.wazer.com/'];https://www.kickstarter.com/projects/1294137530/the-first-desktop-waterjet-cutter;Cut any material with digital precision using high pressure water. A compact waterjet for every workshop.
89;Delta Groove Guitars CNC Designs;Ended;171%;Fabrication Tools;Mount Vernon, IL;May 22, 2017;Darren Dukes;['http://www.deltagrooveguitars.com/', 'https://www.facebook.com/Delta-Groove-Guitars-'];https://www.kickstarter.com/projects/1121492999/delta-groove-guitars-cnc-designs;Delta Groove Guitars building Cigar box guitars, Necks, Pickups for over 8 years. we are planning to add CNC tooling to our offering
90;Bicycle Post Mount Disc Brake Jig;Ended;146%;Fabrication Tools;Gatineau, Canada;October 9, 2016;Eric Meinert;['http://www.incepi.net/', 'https://www.instagram.com/incepibicycle/', 'https://www.facebook.com/incepi/?ref=hl'];https://www.kickstarter.com/projects/4608648/bicycle-post-mount-disc-brake-jig;A fixture for bicycle frame builders. A tool for attaching Post Mount disc brake tabs(caliper mounts) to bicycle frames and forks.
91;FR4 Machine Shield -The CNC kit from an entire sheet of PCB.;Ended;121%;Fabrication Tools;Bozeman, MT;May 4, 2017;Pocket NC;['http://www.pocketnc.com/'];https://www.kickstarter.com/projects/1090944145/fr4-machine-shield;The FR4 is a 3 axis shield, cape, or hat for milling, laser engraving, and more assembled from a kit.
92;MotoSpirit UPC: Electric racing motorbike;Ended;106%;Fabrication Tools;Terrassa, Spain;July 13, 2016;MotoSpirit UPC;['https://motospiriteseiaat.com/'];https://www.kickstarter.com/projects/motospirit/motospirit-upc-engineering-for-racing;Students from the Polytechnic University of Catalonia, design and build an electric motorcycle for MotoStudent competition.
93;Mr Beam II - The Desktop Laser Cutter and Engraver;Ended;1178%;Fabrication Tools;Munich, Germany;July 10, 2020;Mr Beam Lasers;['http://mr-beam.org/', 'https://www.facebook.com/mrbeamlasercutter', 'https://twitter.com/mrbeamlasers', 'https://www.instagram.com/mrbeamlasers'];https://www.kickstarter.com/projects/mrbeam/mr-beam-ii-the-desktop-laser-cutter-and-engraver;Lasers are a wonderful technology - too wonderful to be used only in heavy industrial machines. Let's bring it to your desktop!
94;Scalpel Jones - A Titanium EDC Scalpel / Utility Knife;Ended;550%;Fabrication Tools;Hopatcong, NJ;March 13, 2018;Jackson Knife and Tool;['https://www.instagram.com/jacksonknifeandtool/'];https://www.kickstarter.com/projects/2122739158/scalpel-jones-a-titanium-edc-scalpel-utility-knife;An every day carry utility scalpel made in the USA of grade 5 titanium. Great for all occasions.
95;Flat Mount Disc Brake Jig;Ended;563%;Fabrication Tools;Ottawa, Canada;May 19, 2016;Eric Meinert;['http://www.incepi.net/', 'https://www.instagram.com/incepibicycle/', 'https://www.facebook.com/incepi/?ref=hl'];https://www.kickstarter.com/projects/4608648/flat-mount-disc-brake-jig;A fixture for bicycle frame builders. A tool for attaching Flat Mount disc brake caliper mounts to bike frames.
96;The Glue Looper - Version 3;Ended;443%;Fabrication Tools;Hartford, WI;March 6, 2017;Creative Dynamic LLC;['http://www.creativedynamicllc.com/'];https://www.kickstarter.com/projects/v5gluelooper/the-glue-looper-version-3;Ever wish there was a way to glue parts together without making a mess, slopping glue all over a project?
97;dTAPE Smart Laser Distance Meter;Ended;1029%;Fabrication Tools;Shenzhen, China;March 10, 2016;Mileseey;['http://www.mileseey.en.alibaba.com/'];https://www.kickstarter.com/projects/549146817/dtape-smart-laser-distance-meter;SMART DIGITAL TAPE,TOUCH NEW ERA
98;Evo-One desktop CNC Mill made for anyone!;Ended;239%;Fabrication Tools;Venice, Italy;May 5, 2017;MakerDreams;['http://www.makerdreams.it/'];https://www.kickstarter.com/projects/1029697729/evo-one-desktop-cnc-mill-made-for-anyone;Evo-One is a ready-to-run CNC Mill that gives life to your ideas from any materials.
99;Multistruder: 3D Printer Filament Extrusion Tool;Ended;100%;Fabrication Tools;San Jose, CA;December 24, 2015;The Green Engineers;['http://www.thegreenengineers.com/', 'https://www.facebook.com/thegreenengineers/', 'https://twitter.com/TheGrenEnginers'];https://www.kickstarter.com/projects/1718006136/multistruder-filament-extruder;A simple, rugged, expandable, modable, filament extruder and multipurpose fabrication tool.
100;polyXtruder - a DIY filament extruder for 3D Printers;Ended;100%;Fabrication Tools;Philadelphia, PA;May 5, 2016;Qudus Hamid;[];https://www.kickstarter.com/projects/290581102/polyxtruder-a-diy-filament-extruder-for-3d-printer;Stop wasting build materials/failed prints! Recycle & build your own filament. Blend different colors to have your own UNIQUE filament!
101;Makerarm-The first robotic arm that makes anything, anywhere;Ended;124%;Fabrication Tools;Austin, TX;October 20, 2018;Makerarm;['http://makerarm.com/'];https://www.kickstarter.com/projects/1849283018/makerarm-the-first-robotic-arm-that-makes-anything;A complete digital fabrication system for makers everywhere: 3D print, laser, carve, plot, assemble, pick/place + more on your desktop!
102;Squirrel Die Press: custom plexiglass dies & digital design;Ended;104%;Fabrication Tools;Chicago, IL;October 21, 2015;Maia Leppo;['http://www.maialeppo.com/'];https://www.kickstarter.com/projects/1481410701/squirrel-die-press-custom-plexiglass-dies-and-digi;Squirrel Die Press will offer custom hydraulic press dies made out of plexiglass as well as digital design assistance.
103;Let's Get Rolling;Ended;113%;Fabrication Tools;Pottstown, PA;October 28, 2015;T1 Trust;['http://prrt1steamlocomotivetrust.org/index.php'];https://www.kickstarter.com/projects/t1trust/lets-get-rolling;As construction of a new mainline steam locomotive continues, your help is needed to start the next phase rolling.
104;Macro and Micro Lens Maker - For Smartphones and Tablets;Ended;104%;Fabrication Tools;Canberra, AU;August 20, 2015;Kenny Cen, Rachel Watkins, David Wright;['https://www.facebook.com/skopeinaustralia', 'http://leenewt3.wix.com/aomlab/'];https://www.kickstarter.com/projects/84736294/diy-lens-maker-for-smartphones;Allows anyone to make high quality lenses in any environment. The lens maker is designed to be simple, reusable and repeatable.
105;Plot, Airbrush, Laser, Dispense. Tooli the creative CNC tool;Ended;103%;Fabrication Tools;Brisbane, AU;June 25, 2016;Troy Cundy;['http://toolbotics.com/'];https://www.kickstarter.com/projects/735824118/plot-airbrush-laser-dispense-tooli-the-creative-cn;An intelligent and versatile creative desktop tool for artists and makers. Plot, Airbrush, Laser and Dispense.
106;Pocket NC - The first 5 axis CNC mill for your desktop.;Ended;508%;Fabrication Tools;Bozeman, MT;March 31, 2016;Pocket NC;['http://www.pocketnc.com/'];https://www.kickstarter.com/projects/1090944145/pocket-nc-the-first-5-axis-cnc-mill-for-your-deskt;Pocket NC - The first 5 axis CNC mill for your desktop.
107;Kevo Vacuum Former;Ended;915%;Fabrication Tools;Kansas City, MO;April 9, 2016;Creation Hardware;['http://creationhardware.com/', 'https://twitter.com/creationHW'];https://www.kickstarter.com/projects/1647435193/kevo-vacuum-former;The easy, fun and affordable way to craft objects and creations in your home or studio through the accessible art of vacuum forming.
108;3D Printing Toolkit - Meshmixer  3D CAD - Full Online Course;Ended;176%;Fabrication Tools;San Francisco, CA;September 3, 2015;Nick & Liza Kloski of HoneyPoint3D;['http://www.honeypoint3d.com/', 'https://www.youtube.com/watch?v=Y-ajKWzpg4Y', 'http://inthefold.autodesk.com/in_the_fold/2015/04/honeypoint3d-teaches-3d-printing-workshops-to-consumers-with-help-from-autodesk-fusion-360.html', 'https://www.youtube.com/watch?v=plKYr6gXTGc&feature=youtu.be'];https://www.kickstarter.com/projects/1727665673/3d-printing-toolkit-meshmixer-3d-cad-full-online-c;"Expert tutorials on Autodesk's FREE ""Easy-To-Use"" Meshmixer software: 20+ Hrs, Mini Kid's Course,140+ Total Videos, 80+ Tools Explained"
109;Routakit;Ended;245%;Fabrication Tools;South Florida, FL;July 9, 2015;Louis Vissepo;['http://www.routakit.com/', 'http://www.kicktraq.com/projects/lumacco/routakit-m-the-next-level-in-desktop-cnc-performan/'];https://www.kickstarter.com/projects/lumacco/routakit;For CNC enthusiasts seeking affordability AND performance driven open source CNC machines.
110;Stepcraft 2: Universal Desktop CNC / 3D Printer / Laser;Ended;1459%;Fabrication Tools;Torrington, CT;December 16, 2015;Stepcraft Inc.;['http://www.stepcraft.us/'];https://www.kickstarter.com/projects/stepcraft2/stepcraft-2-universal-desktop-cnc-3d-printer-for-e;Stepcraft universal desktop CNC solution. Turn your ideas into reality - CNC milling, 3D Printing, Laser Cut/Engraving and much more!
111;Bicycle Disc Brake Jig Fixture INCEPI.net;Ended;281%;Fabrication Tools;Ottawa, Canada;June 13, 2015;Eric Meinert;['http://www.incepi.net/', 'https://www.instagram.com/incepibicycle/', 'https://www.facebook.com/incepi/?ref=hl'];https://www.kickstarter.com/projects/4608648/bicycle-disc-brake-fixture;A Universal jig for bicycle frame builders. One tool for attaching ISO disc brake tabs to bicycle frames AND forks!
112;BoXZY Rapid-Change FabLab: Mill, Laser Engraver, 3D Printer;Ended;2387%;Fabrication Tools;Pittsburgh, PA;August 17, 2017;Justin and Joel Johnson;['http://boxzy.com/'];https://www.kickstarter.com/projects/boxzy/boxzy-rapid-change-fablab-mill-laser-engraver-3d-p;Rapidly transforms into 3 kinds of machines: CNC Mill, 3D Printer & Laser Engraver while enhancing precision & power with ballscrews
113;CNC Piranha Fx - Make Anything;Ended;244%;Fabrication Tools;Holland, OH;September 5, 2015;Tim Owens;['http://www.nextwaveautomation.com/'];https://www.kickstarter.com/projects/1718930271/cnc-piranha-fx-make-anything;Piranha Fx is the Make Anything machine: carve, laser engrave and 3D print - all with one easy-to-use machine and user interface.
114;CNC 3D foam cube - the usb controlled foamcutter DIY kit;Ended;145%;Fabrication Tools;Tilburg, Netherlands;July 10, 2015;team Fablab013;['http://fablab013.nl/', 'http://facebook.com/fablab013', 'http://foamcuttingcube.com/', 'http://lasergraaf.nl/'];https://www.kickstarter.com/projects/fablab013-foamcube/cnc-foam-cube-the-usb-controlled-foamcutter-diy-ki;3D foam cutter for makerspaces   fully automatic 4 axis CNC in an  easy DIY kit. Also builds moulds and models at same time.
115;Laser Ink;Ended;139%;Fabrication Tools;Reno, NV;July 31, 2017;Nicholas Williams;['http://www.objectworks.co/', 'http://www.shapeoko.com/blog/archives/1433'];https://www.kickstarter.com/projects/1923304356/laser-ink;Solid State Laser attachment to fit Shapeoko 2 CNC. Provides Laser cutting and engraving. Software support for photos.
116;Carvey: The 3D carving machine for the maker in all of us;Ended;1253%;Fabrication Tools;Chicago, IL;January 19, 2016;Inventables;['https://www.inventables.com/', 'http://www.easel.com/', 'https://twitter.com/inventables'];https://www.kickstarter.com/projects/carvey/carvey-the-3d-carving-machine-for-the-maker-in-all;Carvey is a new, remarkably easy to use, tabletop 3D carving machine for making ideas into real objects. Make your mark.
117;Dowel Pin Guide for Precision Assembly;Ended;108%;Fabrication Tools;Wrightwood, CA;March 11, 2015;The Inventors ARK LLC;['http://www.theinventorsark.com/'];https://www.kickstarter.com/projects/2055151264/dowel-pin-guide-for-precision-assembly;An easy to use precision assembly dowel pin guide that protects your parts and your hands!
118;UNIBURR Tool Bit;Ended;128%;Fabrication Tools;Coeur D'Alene, ID;August 21, 2015;Chad Von Lind;['http://craftandlore.com/', 'http://instagram.com/craftnlore', 'https://facebook.com/craftnlore'];https://www.kickstarter.com/projects/chadvonlind/uniburr-tool-bit;The UNIBURR is a deburring tool bit that quickly repairs damaged bolts to thread nuts in place once more, saving you time and money.
119;Circle Guides for Cutting and Drilling;Ended;112%;Fabrication Tools;Sacramento, CA;January 20, 2015;Circle Perfect Tools;['http://www.circleperfecttools.com/', 'https://www.facebook.com/circleperfecttools', 'http://www.pinterest.com/circletools/', 'https://plus.google.com/+Circleperfecttools2013', 'https://twitter.com/CircleTools'];https://www.kickstarter.com/projects/circleperecttools/circle-guides-for-cutting-and-drilling;Innovative circle guides for woodworkers, hobbyists, and machinists who need to cut and drill precise circular patterns.
120;5AXISMAKER: First ever affordable 5axis multi-fabricator;Ended;116%;Fabrication Tools;London, UK;January 14, 2018;5AXISWORKS;['http://5axismaker.com/', 'https://www.instagram.com/5axismaker/'];https://www.kickstarter.com/projects/2003668803/5axismaker-first-ever-affordable-5axis-multi-fabri;First ever affordable 5axis multi-fabricator that brings most advanced fabrication right to your desk
121;Squink - the personal electronic circuit factory;Ended;100%;Fabrication Tools;Brooklyn, NY;September 17, 2015;BotFactory;['http://www.botfactory.co/', 'https://twitter.com/BotFactoryNYC'];https://www.kickstarter.com/projects/botfactory/squink-the-personal-electronic-circuit-factory;Create circuit boards in minutes, from home, at the cost of a cup of coffee - Squink prints conductive ink and assembles your circuit.
122;The Creation Station Open Source CNC Router;Ended;189%;Fabrication Tools;Buffalo, NY;December 19, 2015;Innovation Squared LLC;['http://www.creationstationcnc.com/'];https://www.kickstarter.com/projects/1417197574/the-creation-station-open-source-cnc-router;The Creation Station is a high performance, low cost CNC router designed for the maker, hobbyist, artist or educator.
123;CNC xPRO Driver;Ended;133%;Fabrication Tools;Dayton, OH;October 31, 2014;Spark Concepts LLC;['http://www.spark-concepts.com/'];https://www.kickstarter.com/projects/484774463/cnc-xpro-driver;A new way to CNC - single board with 4 powerful motor drivers, power from ATX PSU, and... wait for it... integrated wireless comms!
124;The MicroSlice | A Mini Arduino Laser Cutter & Engraver.;Ended;318%;Fabrication Tools;Derby, UK;February 4, 2025;Gregory L Holloway;[];https://www.kickstarter.com/projects/gregoryholloway/the-microslice-a-mini-arduino-laser-cutter-and-eng;The MicroSlice is a Build-It-Yourself kit, uses Open Source Software, and can be easily assembled at home by just about anyone.
125;Handibot™: A Smart Digital Power Tool;Ended;280%;Fabrication Tools;Durham, NC;July 5, 2014;ShopBot Tools;['http://www.handibot.com/', 'http://www.shopbottools.com/', 'http://www.100kgarages.com/', 'http://www.100kschools.com/', 'http://www.vectric.com/'];https://www.kickstarter.com/projects/1320575205/handibottm-a-smart-digital-power-tool;An innovative, portable tool run from apps on smartphones, tablets or PCs. Push-button CNC technology for jobsites and DIY projects!
126;ViKi LCD - A sleek LCD control interface for your 3D printer;Ended;278%;Fabrication Tools;Irvine, CA;March 14, 2013;Roy Cortes;['http://www.panucatt.com/'];https://www.kickstarter.com/projects/1245051645/viki-lcd-a-sleek-lcd-control-interface-for-your-3d;Sleek and versatile LCD Control interface for your 3D printer / CNC and micro controller projects. Lots of nav functions and LEDs.
127;Student Operated Fabrication Lab;Ended;100%;Fabrication Tools;Columbus, OH;October 10, 2012;PAST Foundation;['http://www.themetroschool.org/', 'http://www.pastfoundation.org/'];https://www.kickstarter.com/projects/90895326/student-operated-fabrication-lab;Completing this Lab will allow students across the country the access to technology bringing their computer created designs to life.
128;Kikori Open Source CNC Gantry Router;Ended;108%;Fabrication Tools;Somerville, MA;August 5, 2013;Judah Sher;['http://sindrianarts.com/', 'http://www.facebook.com/sindrianarts', 'http://twitter.com/sindrianarts'];https://www.kickstarter.com/projects/1738994529/kikori-open-source-cnc-gantry-router;The kikori is an open source entry-level machine for small businesses.  My main goal is to stimulate local manufacturing and design.
129;Project ShapeOko: a $300 complete cnc machine.;Ended;739%;Fabrication Tools;Dixon, IL;December 7, 2011;Edward Ford;['http://www.shapeoko.com/', 'http://www.thefordslife.com/', 'http://twitter.com/#!/shapeoko'];https://www.kickstarter.com/projects/edwardrford/project-shapeoko-a-300-complete-cnc-machine;ShapeOko is a dead simple Open-Source desktop CNC machine with an estimate build price of about $300. Get into CNC without going broke!
130;DIYLILCNC 2.0 - Open-source plans for a low-cost CNC mill.;Ended;106%;Fabrication Tools;Chicago, IL;August 16, 2012;DIYLILCNC;['http://chris-reilly.org/', 'http://diylilcnc.org/', 'http://rainbowlazer.com/', 'http://www.taylorhokanson.com/'];https://www.kickstarter.com/projects/chrisreilly/diylilcnc-20-open-source-plans-for-a-low-cost-cnc;We're preparing to release version 2.0 of our free, open-source plans for a robotic cutting machine that you can build yourself.
131;Arduino Powered Stepper Motor Board;Ended;3370%;Fabrication Tools;Lincoln, NE;June 3, 2012;John Chapman;[];https://www.kickstarter.com/projects/csshop/arduino-powered-stepper-motor-board;This board is perfect for any robotics project that needs stepper motors like a DIY CNC, laser engraver, or 3D printer.
