serial_no;title;status;fund_perc;category;place;last_updated;company;websites;project_link;description
77;Robostands RW1 Automatic Watch Winder;Ended;140%;Gadgets;;January 1, 2025;Robostands;['https://robostands.com/'];https://www.kickstarter.com/projects/robostands/robostands-rw1-automatic-watch-winder;A head-turning watch winder that appeals to the kid and nerd at heart.
78;World's First Carbon Fiber Electric Drill Pen Benchtop Press;Late;active;Gadgets;;Nov 5 2024;Arrowmax;['https://www.am-arrowmax.com/', 'https://am-smart.com/'];https://www.kickstarter.com/projects/arrowmax/dc5-plus-carbon-fiber-electric-drill-pen-and-benchtop-press;Carbon fiber body /5-Speed /900RPM /OLED Display /Multi-purpose fixed bracket /CNC machining /20 HSS Bits /LED Lights /500mAh /Cordless
79;KalimbaGo Plus: Even More Joy at Your Fingertips;Late;active;Gadgets;;Oct 30 2024;Evie Innotech;['https://kalimbago.com/', 'https://evieinnotech.com/'];https://www.kickstarter.com/projects/kalimbago/kalimbago-plus-even-more-joy-at-your-fingertips;Play Kalimba Effortlessly Like Never Before—Even More Intuitive, with a Beautiful Sound for Meditation
80;Scoutlite BlinkO: Ultimate Wearable Outdoor Safety Light;Ended;573%;Gadgets;;February 8, 2025;SCOUTLITE;['https://scoutliteworld.com/'];https://www.kickstarter.com/projects/scoutlite/scoutlite-blinko-ultimate-wearable-outdoor-safety-light;Multi-scenario | Wearable | Hands-free | Cut-out Design | One-click Magnetic Attachment | Dual Color | Compact & Versatile
81;Ravelights V2 | Lighting for Creative Expression;Late;active;Gadgets;;Oct 29 2024;Michael Madi;['https://ravelights.ca/', 'https://x.com/Ravelights', 'https://t.me/lithardware'];https://www.kickstarter.com/projects/cornflakes691/ravelights-v2-wearable-lighting-for-creative-expression;Wearable smart LEDs for parties & festivals. Transform any space with wall mounts. Sync to your environment and sync to your friends.
82;LAVA GENIE Sampler Guitar: 60 Seconds to Musical Freedom;Ended;12304%;Gadgets;;November 29, 2024;LAVA MUSIC;[];https://www.kickstarter.com/projects/2073384220/lava-genie-sampler-guitar-60-seconds-to-musical-freedom;Smart Sampler Guitar | Stringless | Pressure Sensing | 10K+ Songs in LAVA+ APP | 500+ Presets | Onboard Speaker | Foldable Detachable
83;TriXShave: 3-IN-1 Mini Grooming Kit Changing Your Daily;Ended;331%;Gadgets;;December 19, 2024;TriXShave;[];https://www.kickstarter.com/projects/1165160691/trixshave-3-in-1-mini-grooming-kit-changing-your-daily;Shaver&Face Washer&Nose Trimmer 3 IN 1 / Only 99g Lightweight / 60 Days Runtime / IP67 / Also can Smooth the Nails
84;Galegiant 4-in-1 Portable Air Duster, Vacuum, Fan & Inflator;Late;active;Gadgets;;Oct 29 2024;Royaheta;[];https://www.kickstarter.com/projects/royaheta/a-4-in-1-portable-air-duster-vacuum-fan-and-inflator;Royaheta | Air Duster, Vacuum Cleaner, Fan & Air Inflator 4-in-1 | 130000 RPM | Portable Clip Design | All Metal Body | 4000mAh Battery
85;6 in1 Power Combo Tower 140W GaN Charger;Ended;3297%;Gadgets;;January 13, 2025;fiklik;[];https://www.kickstarter.com/projects/827796756/6-in1-powercombo-tower-105w-gan-charger;Effortless Charging, Anytime, Anywhere – Power All Your Devices with a Single Compact Tower
86;Arlool: Smarter and Safer Floodlight Camera Powered by TUYA;Ended;114%;Gadgets;;January 7, 2025;Arlool;[];https://www.kickstarter.com/projects/643356754/arlool-smarter-and-safer-floodlight-camera-powered-by-tuya;5000LM Floodlight│Works with TUYA Sensors│Amazon Alexa & Google Assistant│Motion Detection & Human Tracking│Two-Way Chat│2.4GHz & 5GHz
87;Droplet Genie T1-A unique metal toy for the fingertips;Ended;999%;Gadgets;;January 6, 2025;TAVAKER;[];https://www.kickstarter.com/projects/-t1/droplet-genie-t1-a-more-fun-metal-stress-reliever;Fidget 丨Super Mini丨Titanium丨 6 in 1丨Super Stress Relief丨Fingertip Gyroscope丨EDC丨NFC丨Manual Maze丨Express Knife丨Can't Stop
88;The ISO-BAR;Late;active;Gadgets;;Oct 26 2024;ISO-BAR;[];https://www.kickstarter.com/projects/iso-bar/the-isoflex-0;The world's greatest isometric barbell!
89;PARDUS 2-in-1 Hand Warming Solution;Ended;917%;Gadgets;;December 24, 2024;PARDUS;['https://www.pardus-bikes.com/'];https://www.kickstarter.com/projects/818055712/pardus-2-in-1-hand-warming-solution;Magnetic Design | Pocket Size | 360° Heating | 3s Fast Warming | Single or Combined Use for Hand Warming Anytime, Anywhere.
90;Twelvetooo: A Mini 3D Projector With No Glasses Required!;Ended;3643%;Gadgets;;February 10, 2025;Twelvetooo;['https://www.twelvetooo.com/'];https://www.kickstarter.com/projects/86816116/twelvetooo-a-mini-3d-holographic-projector-for-your-home;Explore 60+ themes, where vibrant 3D worlds are brought to life with immersive sound and light, creating unique and enchanting stories
91;KUXIU—3-in-1 Wireless Charger Inspired by Basketball Hoop;Ended;102%;Gadgets;;January 8, 2025;kuxiu;['https://www.kuxiu.cc/'];https://www.kickstarter.com/projects/2068067641/kuxiu3-in-1-wireless-charger-inspired-by-basketball-hoop;A fun desktop basketball toy for basketball fans |Simultaneously charge your iPhone, AirPods, and Apple Watch with Qi2 certification
92;Triangular Macro Keyboard: Elevate Workflow to New Height;Ended;175%;Gadgets;;November 23, 2024;MacroKeyboard;[];https://www.kickstarter.com/projects/1117626550/triangular-macro-keyboard-elevate-workflow-to-new-height;Custom profiles/tailored layout/visual stream deck/cross platform
93;Portable Venty Clip Fan;Ended;871%;Gadgets;;January 31, 2025;Team Vento;['https://www.ventyfan.com/'];https://www.kickstarter.com/projects/teamvento/the-venty-clip-fan;Clip It. Hang it. Mount it. Your scented rechargeable fan for work & sleep.
94;Outrider: A Tire Pressure Sensor For Bikes;Ended;5556%;Gadgets;;January 23, 2025;Outrider;['https://www.outride-bike.com/'];https://www.kickstarter.com/projects/outride/outrider-a-tire-pressure-sensor-for-bikes;A low cost, Garmin-compatible device to keep you safe and optimize your tire performance on the trail
95;L-Ring 2: ChatGPT-Powered Ring for Control, Translate & More;Ended;1077%;Gadgets;;January 7, 2025;Toall Tech;['https://www.toall.com.cn/'];https://www.kickstarter.com/projects/1748145213/l-ring-2-1st-smart-ring-with-ai-control-and-communication;ChatGPT-Powered | Gesture Control | Air Mouse | Real-time Translation | Voice to Text | AI Chat | Meeting Summary
96;Plugable: Turn One USB-C Charger Into Ten;Ended;275%;Gadgets;;February 14, 2025;Bernie Thompson;['http://plugable.com/', 'http://www.linkedin.com/in/bernie', 'http://www.youtube.com/user/plugabletech', 'https://twitter.com/plugable'];https://www.kickstarter.com/projects/plugable/plugable-turn-one-usb-c-charger-into-ten;Charge up to 10 devices with Plugable's elegant charger. Up to 100W per port. Uses the USB-C power supply you already have.
97;Power1: Mobile Charging and Computing, Reinvented.;Ended;184%;Gadgets;;January 27, 2025;ODA;[];https://www.kickstarter.com/projects/odainc/power1-the-ultimate-all-in-one-charger-for-apple-devices;On-Device AirPods and Watch Charging | Custom, Snap-On SSD & Power Bank Modules | Extra USB-C Ports | Integrated MicroSD Slot
98;iMicro Q3p: A 1200x Polarizing Fingertip Microscope;Late;active;Gadgets;;Oct 17 2024;QingYing E&T LLC;['http://www.mobile-scope.com/'];https://www.kickstarter.com/projects/uchart/imicro-q3p-an-1200x-polarizing-fingertip-microscope;Tiny, light, optical performance comparable to a pro polarizing microscope, easy to use while affordable, and work on any camera phone
99;DigizuKi：A 40Gbps & 240W Magnetic Cable with Wattage Display;Ended;605%;Gadgets;;November 15, 2024;DigizuKi;[];https://www.kickstarter.com/projects/796278610/digizuki-40gbps-and-240w-magnetic-cable-with-wattage-display;Magnetic Tips | Wattage Display | 40Gbps Transfer | Coaxial Core | Max 240W Charging | 8K Video | Compact
100;CyberAxon D3: 13-in-1 Multifunctional Stream Control Dock;Ended;2277%;Gadgets;;February 17, 2025;RayCue;['https://www.raycue.com/'];https://www.kickstarter.com/projects/raycue/cyberaxon-d3-13-in-1-multifunctional-stream-control-dock;Stream Control Touchscreen| 8K Display | 10Gbps｜Triple 4K@60Hz | 13 ports | 100W PD | USB 3.2 Gen 2
101;Solidpixels Tetra;Ended;482%;Gadgets;;February 17, 2025;SolidPixels Inc.;[];https://www.kickstarter.com/projects/1975306765/solidpixels-tetra;Retro display | Sports | Crypto | Social Media | Todoist | Pomodoro Timer | Weather | CC/Stock Price | App Store
102;World's First 240W App-Controlled Magnetic Smart Cable;Ended;1036%;Gadgets;;January 21, 2025;mobfree;['https://www.imobfree.com/'];https://www.kickstarter.com/projects/mobfree-official/pixelcable-pro;App-Controlled | 240W Fast Charging | OLED Display | Customize Start-Up Animation | Magnetic Design. Redefine your charging experience!
103;Kaemeasu Mac Pro Laser Rangefinder: Master Every Measurement;Ended;648%;Gadgets;;November 14, 2024;Kaemeasu;[];https://www.kickstarter.com/projects/1494419630/kaemeasu-mac-pro-revolutionizing-rangefinder-with-precision;Unleash Versatility in Measurement Across Golf, Construction, Hydrology, and Beyond
104;Magnetic Handwarmer: Winter Magic in Your Hands;Ended;1480%;Gadgets;;January 20, 2025;Morwie;['https://morwie.net/'];https://www.kickstarter.com/projects/morwies1/morwie-s1-360-surround-heating-magnetic-hand-warmer;Power Bank | 10000 mAh | 360° Heating | 16h Battery Life | Magnetic | 3 Heat Levels | Intelligent Protection | Temp Battery Display
105;StormGo: Carry the Storm With You, Always;Ended;213%;Gadgets;;February 18, 2025;StormGo;[];https://www.kickstarter.com/projects/1745523983/stormgo-carry-the-storm-with-you-always;130,000 RPM Motor Speed | 1,000g Maximum Wind Pressure | 52m/s Wind Speed | Weighing Just 680g | 16,000mAh Battery | 45W Fast Charge
106;Pokoro: The World’s First GPT-4o Powered Reading Companion;Ended;241%;Gadgets;;January 16, 2025;Neolab;['https://pokoro.co/'];https://www.kickstarter.com/projects/2062387807/pokoro-the-talking-ai-companion-for-screen-free-learning;AI-Powered Conversations | Empower Kids to Read Independently | A Screen-Free Learning Experience | Foreign Language Practice
107;Valerion VisionMaster: Cinematic-Grade RGB Laser Projector;Ended;21843%;Gadgets;;January 25, 2025;Valerion;['https://www.valerion.com/'];https://www.kickstarter.com/projects/valerionvisionmaster/valerion-visionmaster-cinematic-grade-rgb-laser-projector;Most Funded Projector in Crowdfunding History | 2024 Most Funded Crowdfunding Project | The Hook Up's 2024 Top Pick Lifestyle Projector
108;RAF Pioneering Bike Backpack: Reduce Air Drag Enhance Safety;Ended;122%;Gadgets;;January 6, 2025;ramairfairing;[];https://www.kickstarter.com/projects/ramairfairing/raf-pioneering-bike-backpack-reduce-air-drag-enhance-safety;The Next Level of Cycling Safety and Performance with RAF 1 – The Ultimate Air-Filled Backpack with Drag Reduction & Airbag Protection!
109;NZUP PowerMate: Compact 180W DC Power for Every Moment;Ended;113%;Gadgets;;December 4, 2024;NZUP;[];https://www.kickstarter.com/projects/nzup/nzup-powermate-compact-180w-dc-power-for-every-moment;Intelligent Power Management | Up to 180W DC Output | 23,550mAh Battery | Fast Charging | Dual Voltage | Compact & Lightweight
110;ZapZone: Revolutionary 6-in-1 Global Travel Charger;Ended;504%;Gadgets;;December 20, 2024;ZapZone;[];https://www.kickstarter.com/projects/1186040043/zapzone-revolutionary-6-in-1-global-travel-charger;One-click switching between multiple international standard plugs, 100W PD, 6 ports and built-in retractable cable - Power Anywhere
111;SANJINZY: 240W USB 5 Ultra Cable for Every Type-C Device;Ended;4696%;Gadgets;;February 15, 2025;SANJINZY;[];https://www.kickstarter.com/projects/sanjinzy/sanjinzy-the-next-gen-all-in-one-truly-thunderbolt-5-cable;SANJINZY (サンジンズ) Type-C Cable | USB 5 compliant | 240W Charging | 80Gbps Transfer | 16K Display | Super Built Tough
112;XL Tactical Hair Clip Multitool in Iridescent Tacticlip® EDC;Ended;2000%;Gadgets;;January 13, 2025;TactiCouture;['https://chevassus.com/', 'https://knok.org/', 'https://kalosagon.com/', 'https://tacticlip.org/', 'http://tacticouture.com/'];https://www.kickstarter.com/projects/tacticouture/tacticlip-edc-multi-tool-survival-hair-clip-knife-cyberpunk;Minimalist CYBERPUNK tool for action lifestyles. New XL Size. Stainless Steel. Nail File. Raptor Claw Tip. 14th successful Kickstarter.
113;NANO TRACKS: A Tiny, Fully Functional RC Excavator;Late;active;Gadgets;;Oct 1 2024;Jonathan;['https://www.nanotracksrc.com/'];https://www.kickstarter.com/projects/nanotrx/nano-trx-n320-a-desktop-size-fully-functional-rc-excavator;Tiny Yet Mighty: Experience Precise, Fully Functional RC Excavation Anywhere
114;Reel Saber: Retractable, Customizable, Programmable!;Ended;107%;Gadgets;;January 20, 2025;"Matt ""Fish""";['https://www.reelsaber.com/'];https://www.kickstarter.com/projects/reelsaber/reelsaber;A Fully Retractable Saber – Engineered for Sci-Fi Fans, Tailored for Customization!
115;Iris: The all-in-one portable solar tracker;Ended;170%;Gadgets;;January 7, 2025;Iris Solar Technology;['https://iris-solar.com/'];https://www.kickstarter.com/projects/iris-solar/iris-the-all-in-one-portable-solar-tracker;Energy, anywhere.
116;VocaEase:The 1.st rotating 360° MagSafe AI Translation Ring;Ended;605%;Gadgets;;February 11, 2025;VocaEase;['https://vocaease.ai/'];https://www.kickstarter.com/projects/747710866/vocaease-translation-ring-speak-with-confidence;138 Languages|Multi-Mode Translation|Video Call|Cross-app|Recording Transcript|Dialogue|Power by AI|MafeSafe Ring|Summary|Free App
117;Liene PixCut S1 Photo Sticker Printer and Cutter;Ended;9064%;Gadgets;;February 14, 2025;Liene;['https://www.liene-life.com/'];https://www.kickstarter.com/projects/lieneprinter/pixcut-s1-photo-sticker-printer-and-cutter;High-quality Printing - 300 DPI｜Precise Cutting with Fine-point Blade｜Waterproof, Fade-resistant & Scratch-resistant Stickers｜Smart App
118;Ti-coolX: Premium Titanium Cooling Ice Pack;Ended;5512%;Gadgets;;December 25, 2024;TiCool;['http://www.ticooltech.com/'];https://www.kickstarter.com/projects/ticoolx/ti-coolx-premium-titanium-cooling-ice-packs;Model TA1 Pure Titanium | Instant Freezing | Extended Cold Retention | Compact, Safe & Eco-Friendly
119;GeckoWiper🦎| Removable Rear Window Wiper for Hyundai IONIQ5;Ended;1161%;Gadgets;;February 6, 2025;GeckoWiper;['https://www.instagram.com/gecko_wiper?igsh=MTkzdDFqaDlwaHJnaw==', 'https://www.facebook.com/profile.php?id=61561831824769&mibextid=ZbWKwL', 'https://www.reddit.com/u/GeckoWiper/s/4Z9gTQQ8uG', 'https://youtube.com/@geckowiper?si=MNGKbe9SJmG_J5vL', 'https://www.tiktok.com/@geckowiper?_t=8nmZyo1hDWq&_r=1', 'https://x.com/GeckoWiper'];https://www.kickstarter.com/projects/geckowiper/geckowiper-hyundai-ioniq-5-removable-rear-window-wiper;Retrofit | Rear Window Wiper | for Hyundai Ioniq 5 | Tool free Mounting | Dual Safety System | Attachable & Removable in seconds |🦎|
120;Pop piano：The MIDI keyboard that makes piano simple;Ended;4885%;Gadgets;;January 3, 2025;Pop piano;[];https://www.kickstarter.com/projects/644816124/popp-iano-making-piano-simple;Piano lessons from 0 to 1, online sheet music, multi-finger chords, light-up keys, Bluetooth connectivity,Expandable up to 72 keys
121;BLE caberQU: a digital USB-C to USB-C cable tester;Late;active;Gadgets;;Sep 25 2024;Peter Traunmüller;[];https://www.kickstarter.com/projects/electr/ble-caberqu-a-digital-usb-c-to-usb-c-cable-tester;first and only digital cable tester for USB-C to USB-C cables | information on data speed, charging power, cable health and many more
122;K-Go One: Fitness To Go;Ended;154%;Gadgets;;December 22, 2024;K-Go;[];https://www.kickstarter.com/projects/756297076/k-go-one-fitness-to-go;Smart. Portable. Versatile. Affordable. Voice Command Control
123;Icepura: The Instant Water Cooling & Filtration Pitcher;Ended;287%;Gadgets;;February 13, 2025;Icepura;['https://www.facebook.com/profile.php?id=61565903666040', 'https://icepura.com/'];https://www.kickstarter.com/projects/icepura/icepura-your-instant-oasis;Filter and cool your water to a perfect 10°C in minutes for instant refreshment anytime.
124;Sharp Hill: The 11 in 1 Titanium EDC Tool for Everyday Carry;Ended;671%;Gadgets;;November 13, 2024;Sharp Hill;[];https://www.kickstarter.com/projects/1157317141/sharp-hill-the-11-in-1-titanium-edc-tool-for-everyday-carry;Made from Titanium, Folding Knife, Screwdriver, Seat Belt Cutter, Keychain Clip, Bottle Opener, Tritium Gas Tube, Wrenches, Ruler...
125;McGIZ Oclick：Create your own phone accessories in a snap;Late;active;Gadgets;;Sep 24 2024;Nerz;['https://www.mcgiz.com/'];https://www.kickstarter.com/projects/nerz/mcgiz-o-create-your-own-phone-accessories-in-a-snap;McGIZ Oclick is a streamlined collection designed to unlock your creativity and make phone accessory truly personal!
126;GOKKCL: The Next-Gen Sodium Battery Emergency Jump Starter;Late;active;Gadgets;;Sep 24 2024;GOKKCL;['https://gokkcl.com/'];https://www.kickstarter.com/projects/gokkcl/gokkcl-the-next-gen-sodium-battery-emergency-jump-starter;Sodium-Ion Battery | High Safety | Longer Power Storage Time | 27000mAh | Digital Display Screen | 60W PD Power Bank |3-Level LED Light
127;Kupeeno: 2-in-1 Travel Mug for Easy Cooling & Heating;Ended;2233%;Gadgets;;January 16, 2025;Kupeeno;[];https://www.kickstarter.com/projects/1888292502/kupeeno-2-in-1-travel-mug-for-easy-cooling-and-heating;46-149℉ Temperature Adjustment | Semiconductor Heating/Chilling Tech | Temp Monitor Touchscreen | 350mL Capacity | Quiet Operation
128;Plleuow—Redefining the Fidget Cube!;Ended;174%;Gadgets;;January 23, 2025;Plleuow;[];https://www.kickstarter.com/projects/83073202/plleuowredefining-the-fidget-cube;Fits various hand movements and habits, shifting restless emotions while smartly upgrading our life and work experience.
129;Fosi Audio VOL20 - Multimedia Control Knob with RGB light;Ended;1619%;Gadgets;;November 27, 2024;Fosi Technology;['https://fosiaudio.com/'];https://www.kickstarter.com/projects/fositechnology/fosi-audio-vol20-multimedia-control-knob-with-rgb-light;Built with zinc alloy, VOL20 offers Bluetooth/USB connectivity, customizable RGB lighting, and plug-and-play ease for volume control
130;Stroway: All-in-1 Charging Station for Endless Power;Ended;236%;Gadgets;;January 16, 2025;Stroway;[];https://www.kickstarter.com/projects/311436571/stroway-one-box-endless-power-for-all;6 Independent Power Banks | 4 Charging Ports | Wireless Charging | Various Charging Mode | 24V 3A 7W Power Supply
131;Ti-ONE:Ultra-Portable All-in-One Titanium EDC Tool;Late;active;Gadgets;;Sep 18 2024;Clean One;['https://mation.top/'];https://www.kickstarter.com/projects/clean-one/ti-one;6-in-1/ Multi-Function Screwdriver/ Cutting Knife/ Craft Knife/ Window Breaker/ Eternity Pen/ Ruler/ Titanium/ Portable/ Fashions
132;AirCard Pro & AirNotch Pro - Track & find any item, forever.;Late;active;Gadgets;;Sep 17 2024;Rolling Square;['https://rollingsquare.com/'];https://www.kickstarter.com/projects/rollingsquare/rolling-square-aircard-airnotch-pro-trackers-android-apple;Rolling Square's Bluetooth trackers family | Android & Apple | Locate everything you care about | Lose the hassle of losing things
133;Illumi-key: Find your Keys in the Dark!;Ended;5725%;Gadgets;;December 1, 2024;Illumi-key;['https://www.illumi-key.com/'];https://www.kickstarter.com/projects/illumikey/illumi-key-never-lose-or-struggle-to-find-your-key-again;✅ Automatic LED lighting in the dark using GPS/WiFi detection ✅ Real-time tracking and sound alerts if you lose your keys or phone
134;SHERRIVA：Wireless Type-C Transmitter and HDMI Receiver 100ft;Ended;860%;Gadgets;;November 20, 2024;SHERRIVA;['https://sherriva.com/'];https://www.kickstarter.com/projects/sherriva/sherriva-wireless-type-c-transmitter-and-hdmi-receiver-100ft;High-Speed Stable Transmission丨Plug-and-Play丨Long-distance Transmission丨Wide Compatibility丨Compatible with Type-C Systems
135;TOKQI M03: Upgraded Intelligent 3-Axis Gimbal Stabilizer;Ended;1179%;Gadgets;;January 6, 2025;TOKQI;[];https://www.kickstarter.com/projects/tokqi-m1/tokqi-m03-upgraded-intelligent-3-axis-gimbal-stabilizer;3-Axis anti-shake |Audio Capturing Module | Separate Remote Controller| Magnetized Compensating Light |Al Automatic Tracking
136;MEMDock: The Ultra-Compact Magnetic USB-C Hub;Ended;4306%;Gadgets;;January 28, 2025;MEMDock;['https://www.memdock.com/', 'https://www.facebook.com/groups/1026072729246015'];https://www.kickstarter.com/projects/758873559/memdock-the-ultra-smallest-magnetic-docking-station;5-in-1 Hub｜USB 3.2 Gen 2｜10Gbps｜100W PD｜4K@60Hz｜Supports Steam Deck & Nintendo Switch
137;MOGABI V3 Guitar: Unleash Your Creative Power Anywhere;Ended;1130%;Gadgets;;January 27, 2025;MOGABI AMT;['http://www.mogabi.net/', 'https://www.facebook.com/Mogabi-106342851085624', 'https://www.youtube.com/channel/UChROH4L-z89BkQtlwpUChqA/featured'];https://www.kickstarter.com/projects/134517265/mogabi-v3-guitar-unleash-your-creative-power-anywhere-0;Electric Effect Sound Recording | Battery Self-Replacement | High-Output Sound | Foldable Design | Noise Cancellation| Wireless Pairing
138;Blips RGB Light-Up LED Grips;Late;active;Gadgets;;Sep 10 2024;Parker Brothers;[];https://www.kickstarter.com/projects/parkerbrothers/blips-rgb-light-up-led-grips;Light up LED grips for bicycles, E-Bikes, scooters and more.
139;SNAPPY: Super Stable Ergonomic Battery Grip for Mobile Phone;Late;active;Gadgets;;Sep 10 2024;Buddiesman;['http://www.buddiesman.com/'];https://www.kickstarter.com/projects/buddiesmanofficial/snappy-super-stable-camera-grip-and-battery-for-mobile-phones;Mobile Gimbal | Ergonomic Grip | One-Touch Switch | Ring Light | Bluetooth Remote | Zoom Wheel Control | Expansion Port | Power Bank
140;Kica JetFan Max：The World's Most Powerful Air Blaster;Ended;10774%;Gadgets;;December 12, 2024;FeiyuTech;['https://www.feiyu-tech.com/'];https://www.kickstarter.com/projects/feiyutech/kica-jetfan-max-the-worlds-most-powerful-air-blaster;324 KM/h Powerful Airflow, 785W Turbo Motor, Instant Thrust, Clean. Vacuum, Deep Cleaning, Precision Airflow, Recharge and Replace
141;GEMINI CABLE: Seamless Dual Charging & Versatile Cable Modes;Late;active;Gadgets;;Sep 10 2024;STYLEPIE ELF Cable;['https://stylepie.com/'];https://www.kickstarter.com/projects/804533605/gemini-cable-seamless-dual-charging-and-versatile-cable-modes;240W High Power Support | Two-in-One Mode Switching | 20-80% Power Distribution | Versatile Lengths | Built-in Wireless Charging
142;HydroGleam: Ultimate Revolutionary Bicycle Tail Light;Ended;157%;Gadgets;;January 17, 2025;HydroGleam;[];https://www.kickstarter.com/projects/1821237806/hydrogleam-ultimate-revolutionary-bicycle-tail-light;Fish-scale Reflective Surface | COB LED Technology | 120 Lumens of Brightness | Easy Installation | Runtime of 3-10 Hours
143;HEAER: Portable mini drill pen and graduated benchtop press;Ended;480%;Gadgets;;October 12, 2024;HEAER;[];https://www.kickstarter.com/projects/468517201/portable-mini-drill-with-drill-stand;65 W/MAX 30000 rpm/2500 mAh/Pure copper motor/Stepless adjustment/Aluminum alloy bracket base with scale
144;Super Charge Bros - Nostalgic Wireless Phone Charger;Ended;259%;Gadgets;;November 5, 2024;John Roo;['https://www.theretroroomgames.com/'];https://www.kickstarter.com/projects/elland/super-charge-bros-nostalgic-wireless-phone-charger;A retro styled wireless phone charger!
145;Poolert S- The Ultimate AI-Driven Pool Alarm for Security;Ended;603%;Gadgets;;October 15, 2024;Poolert;['https://poolert-alarm.com/'];https://www.kickstarter.com/projects/poolert/poolert-s-the-ultimate-ai-driven-pool-alarm-for-security;Quadruple Alert System丨Security AI Camera丨Real-time monitoring丨Automatic activation mode丨Solar Charging Pool Alarm丨Easy To Install
146;AVANTGO—All-in-One Mini Home Gym for On-the-Go Workouts;Ended;640%;Gadgets;;January 6, 2025;AVANTGO;[];https://www.kickstarter.com/projects/1745494521/avantgoall-in-one-mini-home-gym-for-on-the-go-workouts;The palm-sized and lightweight home gym provides power 3-60kg resistance full-body workouts, allowing you to set up your personal gym.
147;2-in-1 Qi2 Wireless Charger&Stress Toy&Magnetic Stand;Ended;366%;Gadgets;;January 11, 2025;RGBTRON;[];https://www.kickstarter.com/projects/108029994/rgbtronqi2-2-in-1-foldable-magnetic-wireless-charger;Charge your iPhone with the Qi2 protocol and Apple Watch. Attach to any metal surface for easy selfies, watching videos, and browsing
148;Charmast C10 | Hook and Go Power Bank for All Devices;Ended;3572%;Gadgets;;December 17, 2024;charmast;['https://www.charmast.com/'];https://www.kickstarter.com/projects/charmast1185/charmast-c10-8-in-1-magnetic-power-bank-one-for-all;Cookie Size, Lanyard Design | Charge 4 Devices at Once | 3-in-1 Wireless Charging | 2 Built-in Cables | 6 Colors | 20W | Smart Display
149;DIVEROID - Turn your smartphone into an All-in-one Dive gear;Ended;141%;Gadgets;;October 3, 2024;DIVEROID;['https://diveroid.com/'];https://www.kickstarter.com/projects/officialdiveroid/diveroid-turn-your-smartphone-into-an-all-in-one-dive-gear-3;Turn your smartphone into an affordable all-in-one Dive computer, Underwater camera, and Photo-synced log book with Diveroid.
150;Youtrons: Guardians of Focus;Ended;355%;Gadgets;;January 8, 2025;Captain Make;['https://captainmake.com/'];https://www.kickstarter.com/projects/captainmake/youtrons;Tiny, joyful pomodoro timers that keep distractions away. Simply plug into any USB port and focus. No settings, just pure concentration
151;Dual Magic Ring: The Smarter Way to Grip Your Smartphone;Ended;347%;Gadgets;;November 10, 2024;A-PlusCentury;[];https://www.kickstarter.com/projects/dualmagicring/dual-magic-ring-the-smarter-way-to-grip-your-smartphone;With 28 pieces of super-strong magnets inside, you will take advantage of this Dual Magic Ring in various situations
